titulo,empresa,localizacao,uf,descricao,fonte
Analista de SEO,UNIJORGE,Salvador / BA                                       A empresa aceita candidaturas de Salvador e cidades próximas,BA,"Descrição
: 
Estamos em busca de um(a) Analista de SEO Técnico para atuar diretamente na evolução da nossa estratégia de busca, combinando fundamentos sólidos de SEO com novas práticas voltadas para AI Search e LLM Optimization.
Essa posição é ideal para quem quer ir além do SEO tradicional e atuar na construção da próxima geração de presença digital.
Sobre o desafio
Você será responsável por estruturar e evoluir a frente de SEO técnico para as nossas instituições (UVA e UJ), atuando de forma integrada com times de tecnologia, conteúdo e agência, com foco em performance, escalabilidade e inovação.
Principais responsabilidades


Conduzir auditorias técnicas de SEO (crawl, indexação e performance), identificando e corrigindo gargalos estruturais;


Otimizar propriedades digitais para buscadores, com foco em arquitetura da informação, indexação e priorização de páginas;


Implementar melhorias técnicas, incluindo dados estruturados (schema) e otimizações relacionadas a Core Web Vitals;


Desenvolver estratégias voltadas para AI Search e LLM Optimization, estruturando conteúdos para melhor interpretação por sistemas de IA;


Trabalhar semântica, entidades e organização de informações para ampliação de autoridade e relevância;


Otimizar conteúdos para respostas diretas (featured snippets e respostas geradas por IA);


Atuar em parceria com times de tecnologia e conteúdo, traduzindo demandas técnicas e garantindo execução das melhorias;


Monitorar indicadores de performance, incluindo SEO tradicional (ranking, tráfego, CTR) e novos indicadores (zero-click, presença em respostas de IA).


Requisitos:


Ensino Superior completo em TI ou Afins;


Experiência comprovada com SEO técnico e atuação em times de tecnologia.


Domínio de ferramentas como: Google Search Console; Screaming Frog SEO Spider; Google Analytics;


Conhecimento de HTML(estrutura de páginas e performance web); Core Web Vitals; Arquitetura de informação.


Modelo:
 Híbrido - presencial terças, quartas e quintas
Local de Trabalho:
 Unijorge - Campus Paralela
Todas as nossas vagas também são destinadas a pessoas com deficiência (PCD).
Se você se identifica com esse desafio ou conhece alguém com esse perfil, compartilhe ou candidate-se!
Outros requisitos
: 


Experiência com SEO voltado para IA / LLMs


Conhecimento em entidades semânticas e topical authority


Experiência com estruturação de conteúdo para machine reading


Noções de automação (ex: Python)


Uso de ferramentas de IA para análise ou geração de conteúdo


Experiência em interface com agências",Vagas.com
Analista de SEO,Universidade Veiga de Almeida,Rio de Janeiro / RJ                                       A empresa aceita candidaturas de Rio de Janeiro e cidades próximas,RJ,"Descrição
: 
Estamos em busca de um(a) Analista de SEO Técnico para atuar diretamente na evolução da nossa estratégia de busca, combinando fundamentos sólidos de SEO com novas práticas voltadas para AI Search e LLM Optimization.
Essa posição é ideal para quem quer ir além do SEO tradicional e atuar na construção da próxima geração de presença digital.
Sobre o desafio
Você será responsável por estruturar e evoluir a frente de SEO técnico para as nossas instituições (UVA e UJ), atuando de forma integrada com times de tecnologia, conteúdo e agência, com foco em performance, escalabilidade e inovação.
Principais responsabilidades


Conduzir auditorias técnicas de SEO (crawl, indexação e performance), identificando e corrigindo gargalos estruturais


Otimizar propriedades digitais para buscadores, com foco em arquitetura da informação, indexação e priorização de páginas


Implementar melhorias técnicas, incluindo dados estruturados (schema) e otimizações relacionadas a Core Web Vitals;


Desenvolver estratégias voltadas para AI Search e LLM Optimization, estruturando conteúdos para melhor interpretação por sistemas de IA;


Trabalhar semântica, entidades e organização de informações para ampliação de autoridade e relevância;


Otimizar conteúdos para respostas diretas (featured snippets e respostas geradas por IA);


Atuar em parceria com times de tecnologia e conteúdo, traduzindo demandas técnicas e garantindo execução das melhorias


Monitorar indicadores de performance, incluindo SEO tradicional (ranking, tráfego, CTR) e novos indicadores (zero-click, presença em respostas de IA)


Requisitos:


Ensino Superior completo em TI ou Afins;


Experiência comprovada com SEO técnico e atuação em times de tecnologia.


Domínio de ferramentas como: Google Search Console; Screaming Frog SEO Spider; Google Analytics;


Conhecimento de HTML(estrutura de páginas e performance web); Core Web Vitals; Arquitetura de informação.


Modelo: Híbrido - presencial terça, quarta e quinta).
Local de trabalho:
 Tijuca
Todas as nossas vagas também são destinadas a pessoas com deficiência (PCD).
Se você se identifica com esse desafio ou conhece alguém com esse perfil, compartilhe ou candidate-se!
Outros requisitos
: 


Experiência com SEO voltado para IA / LLMs;


Conhecimento em entidades semânticas e topical authority;


Experiência com estruturação de conteúdo para machine readina;


Noções de automação (ex: Python);


Uso de ferramentas de IA para análise ou geração de conteúdo;


Experiência em interface com agências;",Vagas.com
Analista de Logistica,The Adecco Group,Itu / SP                                       A empresa aceita candidaturas de qualquer cidade do Brasil,SP,"Descrição
: 
Sobre a Adecco:
Líder Mundial em Recursos Humanos, a Adecco está presente em 60 países por uma rede de 5.500 delegações, que proporcionam diariamente emprego a 700.000 pessoas e presta serviço a mais de 100.000 empresas. Faz parte da lista 500 da Fortune Global e está cotada na bolsa de Zurique. A Adecco apresenta uma estrutura mundial orientada para a prestação de um serviço integrado na área dos Recursos Humanos, com o compromisso de um desenvolvimento contínuo de soluções eficazes e competitivas para os seus clientes.
 
A Adecco, em parceria com uma multinacional do segmento automotivo, busca um Analista de Logística para compor sua equipe.
Responsabilidades:


Planejar e estruturar o processo de agendamento de entregas, garantindo aderência às janelas dos clientes, capacidade operacional e nível de serviço, atuando preventivamente na redução de reentregas, filas e custos logísticos, além de propor melhorias contínuas no modelo de agendamento


Gerenciar o fluxo completo de transporte (coleta até entrega final), com visão sistêmica da operação, garantindo SLA, OTIF e nível de serviço ao cliente, atuando de forma proativa na mitigação de riscos operacionais


Atuar como ponto focal na gestão de transportadoras, incluindo avaliação de performance (SLA, lead time, avarias, devoluções), condução de reuniões de performance, desenvolvimento e homologação de novos parceiros logísticos e negociação de prazos, capacidades e melhorias operacionais


Realizar a gestão estratégica de fretes, incluindo análise e validação de tabelas de frete, estudos de otimização de custo (frete peso x cubagem x rota), simulações e tomada de decisão sobre modais e transportadoras, além do controle de budget logístico e identificação de oportunidades de saving


Garantir a governança completa do processo de pagamento de fretes, realizando auditoria de faturas versus tabelas contratadas, validação de divergências e negociação com transportadoras, controle de provisões (accrual), interface com financeiro e redução de custos indevidos


Estruturar, acompanhar e analisar indicadores logísticos como OTIF, lead time de entrega, custo por pedido, taxa de atraso, índice de avarias e devoluções, gerando insights e planos de ação com foco em melhoria contínua


Atuar no gerenciamento das ocorrências logísticas críticas, como atrasos, extravios e avarias, garantindo comunicação eficiente com clientes e áreas internas, com foco na rápida resolução e recuperação do nível de serviço


Gerenciar o fluxo de logística reversa, incluindo devoluções B2B e B2C, coletas reversas, tratativa de produtos não conformes e interface com áreas internas, assegurando rastreabilidade e otimização de custos e prazos


Liderar projetos de melhoria contínua e automação de processos logísticos, incluindo implementação de TMS, uso de ferramentas de BI, revisão de malha logística e iniciativas de aumento de produtividade e redução de custos


Atuar de forma integrada com áreas estratégicas como Comercial, E-commerce, PCP, Expedição e Financeiro, garantindo alinhamento operacional, cumprimento de SLAs e excelência no nível de serviço Jornada


Outros requisitos
: 


Experiência sólida em gestão de transportes end-to-end, preferencialmente em indústrias de aftermarket e/ou e-commerce


Forte conhecimento em gestão de fretes (pricing, tabelas, negociação e auditoria de fretes)


Experiência em freight audit / conferência de faturas de transporte


Vivência com gestão de transportadoras e contratos logísticos


Conhecimento avançado em documentação fiscal e transporte (CT-e, MDF-e, NF-e, POD)


Domínio avançado de Excel (Power Query, tabelas dinâmicas, análise de dados)


Experiência com Power BI ou ferramentas de BI para construção de indicadores


Capacidade analítica para gestão de custos logísticos e identificação de savings


Experiência com operações last mile e e-commerce (entrega fracionada, SLA curto, alto volume)",Vagas.com
Analista de Farmacovigilância Sênior,Biolab Farmacêutica,São Paulo / SP                                       A empresa aceita candidaturas de São Paulo e cidades próximas,SP,"Descrição
: 
Nesta oportunidade, você será responsável por atuar na manutenção dos sistemas de Farmacovigilância, Tecnovigilância, Cosmetovigilância, Nutrivigilância e Vigilância Animal, por meio da execução e monitoramento de processos regulatórios, operacionais e de qualidade, visando a assegurar a conformidade com requisitos internos e legislações aplicáveis, contribuir para o monitoramento da segurança dos produtos e minimizar riscos ao longo do ciclo de vida dos produtos.
O QUE ESPERAMOS DE VOCÊ:


Graduação completa em Farmácia, Farmácia Bioquímica, Biomedicina ou áreas correlatas da saúde. Desejável Pós-graduação em Farmacovigilância, Pesquisa Clínica, Assuntos Regulatórios, Vigilância Sanitária, Gestão da Qualidade ou áreas correlatas;


Experiência anterior em processamento e análise de casos de eventos adversos, MedDRA (Medical Dictionary for Regulatory Activities) e WHODrug, Pesquisa Clínica e Estudos de Bioequivalência;


Conhecimento em Boas Práticas de Farmacovigilância (BPFV/GVP), RDC 406/2020 (Farmacovigilância), Instrução Normativa IN n°63/2020, ICH Guidelines (E2A, E2B, E2C, E2D e correlatas);


Vivência em Auditorias e inspeções regulatórias (Nacionais e internacionais);


Domínio em Plano de Gerenciamento de Riscos (PGR/RMP), Relatório Periódico de Avaliação Benefício-Risco (RPBR/PBRER) e Análise de sinais de segurança (Signal Detection);


Imprescindível conhecimento dos Sistemas Anvisa (Vigimed, Notivisa, Solicita) e desejável conhecimento nos Sistemas SIS (Safety Information Solution); OFF-X (Clarivate); SE Suite;


Conhecimento avançado do Pacote Office (Word, Excel e Power Point) e desejável Power BI e elaboração de 
dashboards
;


Inglês nível avançado.


CONFIRA ABAIXO AS PRINCIPAIS ATIVIDADES DESTA POSIÇÃO:


Analisar relatórios extraídos do sistema SIS 
(Safety Information Solution)
, por meio da consolidação e interpretação de indicadores e dados estratégicos, visando apoiar decisões gerenciais e aprimorar a performance da área;


Aprimorar controles e indicadores da área, através da análise de performance operacional e identificação de oportunidades de melhoria, a fim de otimizar processos e aumentar a eficiência operacional;


Preparar apresentações estratégicas da área, a partir da consolidação de informações técnicas, regulatórias e indicadores de desempenho, de modo a apoiar reuniões gerenciais, auditorias e alinhamentos corporativos;


Conduzir o atendimento a auditorias e inspeções de parceiros e órgãos regulatórios, por meio da coordenação de evidências, respostas técnicas e planos de ação, buscando cumprir requisitos regulatórios e preservar a conformidade do sistema de Farmacovigilância;


Apoiar a coordenação nas atividades estratégicas da área, através do acompanhamento de indicadores, definição de prioridades e suporte técnico especializado, a fim de otimizar processos e contribuir para os resultados do departamento;


Desenvolver procedimentos operacionais padrão (POPs), instruções de trabalho e fluxos da área, a partir da revisão de processos e requisitos regulatórios aplicáveis, para padronizar atividades e manter a conformidade do sistema de qualidade;


Participar da elaboração e acompanhamento de CAPAs 
(Corrective and Preventive Actions)
, por meio da investigação de desvios e definição de planos de ação, visando a mitigar recorrências e fortalecer o sistema de qualidade;


Acompanhar atualizações regulatórias nacionais e internacionais, utilizando-se da consulta a órgãos sanitários e guias aplicáveis, de modo a implementar adequações e manter a aderência às legislações vigentes;


Executar atividades relacionadas a contratos e acordos de Farmacovigilância (SDEA/PVA), através da revisão de responsabilidades e alinhamento com parceiros e fornecedores, a fim de assegurar conformidade regulatória e clareza operacional entre as partes;


Orientar os analistas da área nas atividades técnicas e operacionais, por meio do acompanhamento contínuo e suporte especializado para promover desenvolvimento técnico e garantir a qualidade das entregas.


Idiomas
:
Inglês - Nível Avançado",Vagas.com
Analista de Sistemas II,FIESP,São Paulo / SP                                       A empresa aceita candidaturas de São Paulo e cidades próximas,SP,"Descrição
: 
• Manter-se atualizado em relação à tecnologia Totvs no que se refere ao sistema Totvs RH (Linha RM) e outras ferramentas integradas.
• Atender diretamente os usuários do sistema, especialmente da área de Recursos Humanos, pelos meios de contato existentes.
• Participar de reuniões para entendimento das demandas envolvendo a utilização dos sistemas.
• Registrar as solicitações de atendimento, andamentos, procedimentos executados e soluções aplicadas em sistema adotado pela entidade para essa finalidade.
• Manter inventário de software atualizado.
• Testar rotinas do sistema a partir de ocorrências relatadas e eventos previstos ou hipotéticos.  
• Orientar usuários para realização de testes em rotinas específicas. 
• Planejar, desenvolver, configurar e implantar novas rotinas em conjunto com a equipe de sistemas e usuários, a fim de automatizar processos, melhorar processos já suportados pelo sistema e sua usabilidade.
• Desenvolver consultas e relatórios, utilizando as ferramentas incluídas na tecnologia do sistema e outras, conforme as necessidades do negócio.
• Preparar documentação de apoio aos usuários para orientá-los na utilização das rotinas utilizando documentação do fornecedor, documentação interna e especificidades das rotinas.
• Desenvolver e ministrar treinamentos técnicos para os usuários, promovendo internamente as características e a utilização dos recursos do sistema Totvs RH (Linha RM).
• Elaborar e manter atualizada documentação técnica para uso na Gerência de Sistemas e Informação.
• Analisar informações coletadas nos levantamentos de necessidades, verificando a possibilidade de aplicação com recursos existentes disponíveis e no mercado, juntamente com o impacto e viabilidade.
• Analisar documentação disponibilizada pelo fornecedor quanto a novidades no sistema, mudanças em legislação, compartilhar com partes interessadas e avaliar aplicação.
• Preparar ambiente de testes de sistemas com colaboração de outros analistas de sistemas e infraestrutura.
• Atualizar o sistema e seus componentes em ambiente de produção conforme procedimentos estabelecidos.
• Interagir com analistas de infraestrutura para correções e melhorias no ambiente computacional em que o sistema está inserido.
• Configurar e implementar novas releases/patches, bem como executar testes no sistema para eliminação de erros.
• Manter rotinas customizadas existentes nos sistemas buscando adequação e melhoria nos processos.
• Analisar novas ferramentas, identificando possíveis benefícios para as áreas e para a entidade.
• Analisar e propor melhorias nos sistemas, a fim de melhorar o desempenho para as áreas usuárias.
• Desenvolver relatórios de indicadores, para melhor análise de resultados, utilizando tecnologias da Totvs como SmartView e outras como Microsoft PowerBI.
• Manter-se atualizado em relação às tendências e inovações tecnológicas da área de atuação para que não fique desatualizado referente ao sistema.
• Suporte e manutenção da integração com o sistema Kairós da Dimep.
• Apoio no suporte aos usuários do sistema Totvs Backoffice (Linha Protheus).
Outros requisitos
: 
Ensino Superior completo em:
 Análise e Desenvolvimento de Sistemas, Ciências da Computação, Sistemas de Informação ou áreas correlatas.
Conhecimentos e habilidades exigidos:


Totvs RH (Linha RM) módulos Folha de Pagamento, Automação de Ponto, Gestão de Pessoas/SST, Aprovações e Atendimento, Portais RM (Portal RH e Meu RH);


Fórmulas;


SQL (queries, stored procedures, functions e views);


Tabelas e estrutura dos bancos de dados do sistema Totvs RH (Linha RM);


Conhecimento em e-Social;


Conhecimento nas regras de negócio da Folha de Pagamento, Encargos, Férias e Ponto Eletrônico;


Conhecimento em Gestão de Pessoas e SESMT;


Gerador de relatórios TOTVS RM Reports e SmartView;


Conceito (ETL) e Fórmulas Visuais;


Noções de ADVPL e C# (a ser utilizado em fórmulas visuais).


Desejável: 


Conhecimentos em sistemas de ponto eletrônico - Dimep Kairós;


TAE - TOTVS Assinatura Eletrônica;


TOTVS Avaliação e Pesquisa;


TOTVS Banco de Talentos;


TOTVS Integração;


Noções de Backoffice TOTVS Linha Protheus;


Programação em Dot Net;


PowerBI;


PO UI.",Vagas.com
Analista de Processos Sr,Biolab Farmacêutica,São Paulo / SP                                       A empresa aceita candidaturas de qualquer cidade do Brasil,SP,"Descrição
: 
Nesta oportunidade, você será responsável por promover a melhoria contínua, a governança e a transformação organizacional por meio da análise, estruturação, revisão e otimização de processos, documentos normativos, estruturas organizacionais, projetos estratégicos e soluções corporativas, contribuindo para o aumento da eficiência operacional e o alcance dos objetivos do negócio.
O QUE ESPERAMOS DE VOCÊ:




Graduação completa
 em Engenharia, Administração de Empresas, Qualidade, Tecnologia ou áreas correlatas. Desejável 
Pós Graduação/ Especialização/ MBA 
em Gestão de Processos de Negócio (BPM), Excelência Operacional, Governança Corporativa, Transformação Digital ou áreas correlatas; 


Conhecimento avançado em 
Gestão de Processos de Negócio (BPM), Governança de Processos, Arquitetura de Processos e Indicadores de Processos, Metodologias de Melhoria Contínua
 (Lean, Kaizen, PDCA, DMAIC e Six Sigma), 
Modelagem, análise e redesenho de processos (BPMN)
, 
Ferramentas de modelagem de processos
 (Bizagi, Visio, Aris ou similares),


Conhecimento intermediário em 
Metodologias de gestão de projetos
 (PMI, Ágil, Scrum, Kanban ou similares), 
Governança documental e elaboração de documentos normativos
, 
Ferramentas de 
Business Intelligence
 (Power BI, SharePoint ou similares), 
Diagnóstico organizacional, estrutura organizacional, modelos operacionais e definição de papéis e responsabilidades
;




Domínio em Automação e Transformação Digital
 (Ferramentas de workflow e automação de processos (Pipefy, Power Automate ou similares),
 Levantamento e especificação de requisitos e Transformação digital aplicada a processos;






Análise crítica de processos, informações, dados e indicadores
 ao nível avançado;




Microsoft Office
 (Excel, Word e PowerPoint) ao nível intermediário;


Experiência anterior em 
Gestão da mudança organizacional
 
(Change Management).




CONFIRA ABAIXO AS PRINCIPAIS ATIVIDADES DESTA POSIÇÃO:


Conduzir projetos e iniciativas de transformação organizacional, melhoria contínua, reestruturação organizacional e otimização de processos corporativos, por meio da definição de estratégias, metodologias e planos de trabalho, visando atingir os objetivos de eficiência e desempenho organizacional;


Desenvolver abordagens, metodologias e direcionamentos técnicos para diagnósticos, modelagem, redesenho e implementação de processos, através da aplicação de melhores práticas e conhecimentos especializados, para promover a maturidade da gestão por processos;


Analisar processos, estruturas organizacionais, indicadores, capacidade operacional e práticas de governança corporativa, utilizando-se de avaliações e estudos aprofundados, buscando identificar oportunidades para otimizar o desempenho organizacional;


Orientar e capacitar profissionais da área, a partir do compartilhamento de conhecimento, acompanhamento técnico e suporte especializado, em prol do desenvolvimento de competências e para promover a qualidade das entregas;


Liderar iniciativas de arquitetura de processos, governança documental, definição de papéis e responsabilidades e estruturação de modelos operacionais, por meio da condução técnica dos projetos e alinhamento com as áreas envolvidas, buscando estabelecer modelos organizacionais eficientes e sustentáveis;


Desenvolver modelos organizacionais, estruturas de governança e matrizes de responsabilidade, por meio da análise das necessidades do negócio e dos processos corporativos, visando a estabelecer papéis claros e otimizar a operação;


Implementar soluções tecnológicas, automações e fluxos digitais de trabalho, a partir da definição de requisitos, validação das funcionalidades e acompanhamento da implantação, visando a maximizar a eficiência operacional e facilitar a execução dos processos;


Conduzir o alinhamento com stakeholders estratégicos, por meio da apresentação de análises, recomendações e avaliações de impacto, para obter direcionamentos e contribuir para a tomada de decisão relacionada aos projetos e iniciativas da área.


Analisar indicadores de desempenho dos processos, por meio do acompanhamento de métricas, elaboração de relatórios e identificação de tendências, visando a monitorar resultados e promover melhorias contínuas;


Avaliar os resultados das iniciativas implementadas, por meio da mensuração de ganhos operacionais, financeiros e qualitativos, visando a comprovar benefícios e promover a melhoria contínua;


Para saber mais sobre nós, acesse www.biolabfarma.com.br e siga nossas redes sociais.
Outros requisitos
:",Vagas.com
