titulo,empresa,localizacao,uf,descricao,fonte
Analista Médico Cientifico Jr,Marjan Farma,São Paulo / SP                                       A empresa aceita candidaturas de qualquer cidade do Brasil,SP,"Descrição
: 
Atribuições do cargo:


- Realizar levantamento bibliográfico em bases de dados nacionais ou internacionais;

- Fornecer suporte aos setores e departamentos da empresa quanto à busca de informações técnico-científicas dos produtos através da realização de pesquisas bibliográficas;

- Elaborar cartas de resposta às solicitações provenientes dos profissionais de saúde referentes às informações científicas dos produtos da empresa;

- Participar de Congressos Científicos com objetivo de acompanhar os lançamentos da empresa, analisar as tendências das especialidades em questão e/ou dos concorrentes;

- Sob supervisão atuar como um consultor científico para viabilizar a ligação entre a empresa e os médicos, formadores de opinião e/ou outros profissionais de saúde;

- Apoiar na elaboração e/ou revisão de informações científicas dos produtos em materiais promocionais, como VAS, lâminas, Medical News, etc;

- Apoiar na elaboração e/ou revisão de relatórios de segurança e eficácia, bulas dos produtos.
Idiomas
:
Inglês - Nível Avançado
Outros requisitos
: 
• Formação superior completa ou cursando o último ano em Farmácia, Biomedicina ou áreas afins;


• Experiência anterior no segmento farmacêutico;


• Pacote Office intermediário.",Vagas.com
11003 - Analista Desenvolvedor .net,Talent Group,N/A,N/A,"Descrição
: 
Que tal trabalhar como desenvolvedor.Net, em uma das maiores operadoras de saúde do Brasil?
Profissional atuará com desenvolvimento de novos projetos, criação de ápis, manutenção, sustentação e melhorias com foco em .Net.
Sólida experiência com .NET Framework (Core, C#, MVC, Entity).
Experiência com Asp clássico, para ajudar na manutenção dos sistemas legados.
Domínio em desenvolvimento e otimização de procedures, functions, packages e triggers em Oracle.
Experiência com sistemas de alto volume de dados e alta complexidade.
Conhecimento em iReport (JasperReports).
Capacidade de atuar de forma autônoma na resolução de incidentes críticos.
Conhecimento em Kubernetes, Docker ou RabitMQ
Atuação de Incidentes/Requisições e processo ITSM.
Git e pipelines de CI/CD (preferencialmente Azure DevOps).
TortoiseGit.
Serviços SOAP e REST
Contratação: PJ com base em 44 horas semanais (Hora fechada).
Local: Zona Sul/SP.
Superior Completo ou Cursando
""ATENÇÃO""
Profissionais que residem em SP, atuarão 1x na semana presencial.
Profissionais que residem em outras regiões fora do Estado/Cidade de SP, atuarão 100% home office.",Vagas.com
11006 - Analista Desenvolvedor .net,Talent Group,N/A,N/A,"Descrição
: 
Que tal trabalhar como desenvolvedor.Net, em uma das maiores operadoras de saúde do Brasil?
Profissional atuará com desenvolvimento de novos projetos, criação de ápis, manutenção, sustentação e melhorias com foco em .Net.
Sólida experiência com .NET Framework (Core, C#, MVC, Entity).
Experiência com Asp clássico, para ajudar na manutenção dos sistemas legados.
Domínio em desenvolvimento e otimização de procedures, functions, packages e triggers em Oracle.
Experiência com sistemas de alto volume de dados e alta complexidade.
Conhecimento em iReport (JasperReports).
Capacidade de atuar de forma autônoma na resolução de incidentes críticos.
Conhecimento em Kubernetes, Docker ou RabitMQ
Atuação de Incidentes/Requisições e processo ITSM.
Git e pipelines de CI/CD (preferencialmente Azure DevOps).
TortoiseGit.
Serviços SOAP e REST
Contratação: PJ com base em 44 horas semanais (Hora fechada).
Local: Zona Sul/SP.
Superior Completo ou Cursando
""ATENÇÃO""
Profissionais que residem em SP, atuarão 1x na semana presencial.
Profissionais que residem em outras regiões fora do Estado/Cidade de SP, atuarão 100% home office.",Vagas.com
Analista de Atendimento ao Cliente Jr,Confidencial,São Bernardo do Campo / SP                                       A empresa aceita candidaturas de São Bernardo do Campo e cidades próximas,SP,"Descrição
: 


Garantir uma experiência positiva para os clientes, fornecendo suporte eficiente, resolvendo problemas de forma rápida e eficaz, e mantendo comunicação clara e consistente entre cliente e empresa;


Respeitar os valores de saúde, segurança e meio ambiente da companhia;


Atendimento aos cliente da SGS, respondendo a consultas, reclamações e solicitações por telefone, e-mail, chat ou pessoalmente;


Realizar o acompanhando de todo processo do cliente SGS, iniciando após aprovação de proposta até a emissão de nota fiscal ao cliente;


Suporte técnico de nível inicial para clientes que enfrentam problemas para enviar uma amostra, agendar uma operação ou receber algum resultado;


Registrar e documentar interações com os clientes, identificar e resolver problemas dos clientes de maneira eficaz e eficiente;


Colaborar com interface entre cliente e SGS com outras equipes internas como comercial, recebimento de amostras, laboratório, operações e OI, afins de apoio de duvidas de clientes, revisão de propostas e dados relacionados entre cliente e empresa;


Outros requisitos
: 
Superior cursando - Química, Meio Ambiente ou Ambiental;",Vagas.com
Analista Econômico Financeiro,MSA Recursos Humanos,Belo Horizonte / MG                                       A empresa aceita candidaturas de Belo Horizonte e cidades próximas,MG,"Descrição
: 
 Principais Responsabilidades:
- Realizar análises orçamentárias e econômicas, identificando oportunidades de otimização de custos e melhoria de performance.
- Monitorar indicadores de desempenho físico e financeiro, propondo estratégias para alavancar os resultados.
- Consolidar e acompanhar o orçamento gerencial e de investimentos, avaliando variações entre valores reais e previstos.
- Elaborar relatórios gerenciais e estudos de viabilidade econômica para subsidiar decisões estratégicas.
- Apoiar a gestão no planejamento orçamentário plurianual e na elaboração de orçamentos trimestrais, semestrais e anuais.
- Promover boas práticas de segurança, sustentabilidade e organização patrimonial.
Idiomas
:
Inglês - Nível Intermediário
Outros requisitos
: 
Requisitos:
- Formação superior em Administração, Economia, Engenharia ou áreas correlatas.
- Experiência prévia com elaboração e gestão de orçamentos.
- Vivência em extração e análise de dados financeiros.
- Conhecimento prático em Power BI para construção de dashboards e visualização de indicadores.
- Excel avançado e domínio de ferramentas de análise financeira
Diferencial:
Experiência prévia com elaboração e gestão de orçamentos, análise de indicadores e estudos de viabilidade econômica.
Local de trabalho: Belo Horizonte
Modelo de Trabalho: Híbrido",Vagas.com
Analista de Departamento Pessoal Jr.,Parceria Consultoria,Rio de Janeiro / RJ                                       A empresa aceita candidaturas de Rio de Janeiro e cidades próximas,RJ,"Descrição
: 
Responsabilidades e atribuições:
•	Administração dos benefícios: vale-refeição, vale-alimentação, vale-transporte, assistência médica e odontológica, seguro de vida e Wellhub.
•	Atendimento a colaboradores para esclarecimento de dúvidas sobre benefícios.
•	Lançamentos e conferência de dados no sistema de folha LG Nuvem.
•	Interface com fornecedores, especialmente Alelo, para gestão de cartões e ajustes.
•	Apoio em processos de admissão e desligamento no que tange aos benefícios.
•	Lançamento de pagamentos diversos no sistema SAP.
Requisitos e qualificações:
•	Experiência comprovada na área de benefícios.
•	Domínio dos processos relacionados aos benefícios mencionados.
•	Conhecimento prático da plataforma Alelo.
•	Vivência com o sistema de folha LG Nuvem.
•	Boa comunicação e organização.
•	Agilidade e proatividade para atuar em ambientes dinâmicos.
VAGA TEMPORÁRIA DE 3 MESES, com chances de efetivação!
Local de Trabalho: Holding RJ – Tijuca;
Modelo de Trabalho: Híbrido (Três vezes por semana presencial e duas vezes remoto);
Escala: De Seg. à Sex. das 09:00hs às 18:00hs.",Vagas.com
Analista de Excelencia Operacional  Senior,UNIÃO QUÍMICA,Guarulhos / SP                                       A empresa aceita candidaturas de qualquer cidade do Brasil,SP,"Descrição
: 
•	Acompanhamento de processos produtivos;
•	Elaboração de KPIs;
•	Condução/ Gestão de atividades como: Gemba, programas de melhoria e treinamentos;
•	Implementação de ações de melhoria;
•	Gestão dos pilares de qualidade, produtividade, custos e pessoas;
•	Análise de dados utilizando Power BI e SAP;
•	Inclusão/gestão de projetos no sistema SE SUITE;
•	Execução de SMED;
•	Execução de projetos DMAIC/PDCA;
•	Elaboração de apresentações estratégicas em PPT;
•	Cadastro/revisão de receitas de produção;
•	Abertura de controle de mudança (CM);
•	Análise estatística de processos;
•	Elaboração/ condução de matriz SWOT, Análise de risco (FMEA), entre outros;
•	Análise de ocupação e capacidade da fábrica;
Outros requisitos
: 
•	MBA/ Pós-Graduação em Lean Manufacturing e/ou formação Black Belt;
•	Conhecimento avançado em Excel (Macro, VBA);
•	Conhecimento avançado em Pacote Office;
•	Conhecimento sólido em SAP módulo PP;
•	Conhecimento em Power Bi (desenvolvimento de dashboards)
•	 Conhecimento em Minitab;
•	Conhecimento das ferramentas de qualidade (Ishikawa, 5W2H, Mapeamento de Processos, Gráfico de Pareto, 5 Porquês, etc) e da filosofia Lean Manufacturing;",Vagas.com
Analista de Gestão Fundiária Sr,Galvani Fertilizantes,Irecê / BA                                       A empresa aceita candidaturas de Irecê e cidades próximas,BA,"Descrição
: 
Missão do Cargo
Atuar no suporte técnico e estratégico às atividades fundiárias da companhia, assegurando segurança jurídica, regularização documental e acesso às terras necessárias para a implantação de projetos e operações. A posição tem escopo abrangente, com atuação transversal junto a todas as unidades da empresa, com base em Irecê/BA.
Principais Atividades


Regularização fundiária e licenciamento ambiental


Negociação com proprietários e terceiros


Gestão de contratos (arrendamento, compra e venda, servidão, etc.)


Apoio em vistorias, marcações e validação de titularidade


Consultas em registros públicos e cadastros rurais (SIGEF, SNCR, CAR, etc.)


Condução de diligências fundiárias e análise de riscos (ônus, litígios, restrições)


Atualização de bases de dados (planilhas, SharePoint, Planner)


Organização de documentos e elaboração de pareceres/dossiês fundiários


Relacionamento com superficiários, cartórios, prefeituras e órgãos públicos


Outros requisitos
: 
Mandatório:
Graduação completa (obrigatória)
CNH
Disponibilidade para viajar
Conhecimentos Desejáveis
Pacote Office (especialmente Excel, Word e PowerPoint)
Sistemas de cartórios (RI Digital)
Portais fundiários: SNCR, SIGEF, INCRA
Ferramentas corporativas: SharePoint, Planner, Espaider, Linte, entre outros
Área de Atuação
Meio Ambiente
Gestão Fundiária",Vagas.com
Analista de Educacao Continuada II,Ânima,N/A,N/A,"Descrição
: 
Seja um educador ou educadora no Ecossistema Ânima e venha transformar o país pela educação. 
ANALISTA DE EDUCACAO CONTINUADA II - ANIMA HOLDING
Essa posição é para atuar na 
Ânima
, o maior e o mais inovador ecossistema de ensino de qualidade do país, com instituições espalhadas por todo o Brasil. Somos uma empresa em constante evolução, que enxerga em cada detalhe novas formas de promover a educação. Por sinal, essa é a essência que nos faz ser diferentes.
Ah! Independente de cor, idade, gênero, orientação sexual, origem, religião ou qualquer outra característica, ou particularidade que tenha, se você tem desejo e energia para contribuir para a transformação de vidas por meio da Educação, aqui é o seu lugar!
Confira mais sobre a nossa oportunidade.
Do que você precisa para concorrer à vaga:
•	Graduação completa em Administração, Marketing, Economia ou áreas correlatas
•	Experiência prévia com análise de portfólio, pesquisa de mercado e indicadores de performance, preferencialmente no setor educacional;
•	Vivência com análises quantitativas (taxa de matrícula, evasão, NPS) e elaboração de dashboards.
•	Perfil comportamental com boa comunicação, relacionamento interpessoal e capacidade de colaboração entre áreas. Organização, atenção aos detalhes e habilidade para gerenciar prazos e entregas;
Como será seu dia a dia como educador ou educadora: 
•	Apoiar na coleta, consolidação e análise de dados de desempenho de cursos, programas e serviços da Ânima;
•	Elaborar relatórios e dashboards de performance, com foco em indicadores-chave como matrícula, evasão e NPS;
•	Contribuir com pesquisas de mercado e estudos de concorrência, auxiliando na tabulação, análise e geração de insights;
•	Monitorar tendências educacionais e produzir resumos estratégicos para apoio à tomada de decisão;
•	Colaborar com as áreas de marketing, vendas e produto na execução de campanhas e ações de melhoria;
•	Participar de reuniões de acompanhamento, registrando insights, resultados e encaminhamentos;
Apoiar projetos e iniciativas voltados à educação continuada, garantindo padronização e consistência nas entregas.
Conhecimentos necessários para essa posição
•	Domínio do pacote Office (especialmente Excel e PowerPoint) e conhecimentos em Power BI.
•	Conhecimento em técnicas de pesquisa de mercado, coleta e organização de dados;
Modalidade de atuação e horário de trabalho: 
•	Remoto - de segunda a sexta, das 8h30 às 18h30, com 1h12 de intervalo.
Veja o que já vai encontrar no nosso Ecossistema Ânima
•	Bolsas de Estudos
•	Indicação de 2 Bolsas de Estudos para quem preferir
•	Programa de Bem-estar e Qualidade de Vida
•	Wellhub
•	ECOA – Escola Corporativa Ânima, com + de 100 cursos livres e gratuitos
•	Day-off no aniversário
•	Abono de meio-período no aniversário do(a) filho(a) com até 16 anos
•	Programa Valor das Pessoas: vale-presente para os educadores em fases marcantes de suas vidas, como casamento, nascimento e até mesmo uma nova titulação.
Fique atento às etapas do processo seletivo, que acontece de forma 100% remota:
1. Análise dos currículos;
2. Avaliação técnica;
3. Entrevista com nosso time de Recrutamento e Seleção;
4. Entrevista com a liderança
Boa sorte!
#SejaÂnima",Vagas.com
Analista de RH Pl,Confidencial,Goiânia / GO                                       A empresa aceita candidaturas de Goiânia e cidades próximas,GO,"Descrição
: 
Analista de RH Pleno – Atração e Seleção
Ramo de atuação: Saúde
Principais atividades:
Realizar todas as etapas dos processos seletivos interno e externo de baixa e média complexidade das áreas corporativas e operações da empresa, através de técnicas e ferramentas de Atração e Seleção garantindo o encaminhamento de candidatos em alinhamento ao perfil solicitado pelas áreas demandantes;
Fortalecer o relacionamento com cliente interno através de Briefing e Follow up;
Aplicação de ferramentas de assessments e elaboração de parecer que registrem a análise de competências e subsidiem o processo de tomada de decisão;
Atualizar as ferramentas de gestão de vagas, garantindo a precisão dos status e informações, para facilitar a compilação de dados e a geração de indicadores;
Fornecer retorno as pessoas participantes dos processos seletivos com objetivos de gerar oportunidades de desenvolvimento e garantir uma melhor experiência;
Construir conexões com áreas parceiras, por meio de uma comunicação fluida garantindo eficiência, agilidade e uma visão integrada dos processos;
Entre outras...
Modelo de trabalho: Híbrido
Local de trabalho: Goiânia - GO
Carga horária mensal: 220 horas
Horário: 08h00 às 18h00 (segunda a sexta-feira)
Requisitos:
Curso superior completo em Psicologia, Gestão de RH, Administração e afins
Remuneração compatível com o mercado e benefícios para o titular e dependente.",Vagas.com
Analista Inteligência Mercado,bp bioenergy,São Paulo / SP                                       A empresa aceita candidaturas de qualquer cidade do Brasil,SP,"Descrição
: 
Principais Responsabilidades:


Realizar a coleta de dados, análise de informações internas e de mercado, criando inteligência nas recomendações de forma a suportar a tomada de decisão;


Interagir com demais áreas da empresa criando relacionamentos e redes internas de fluxo de informações necessárias para o desenvolvimento das atividades;


Construção e manutenção dos modelos de oferta e demanda, com sensibilidade a variáveis como clima, câmbio, preços internacionais e políticas regulatórias;


Aprofundar conhecimento do setor sucroenergético através do monitoramento do mercado, bem como seus drivers, players, tecnologias e melhores práticas e benchmarking;


Suportar o atendimento das demandas periódicas e ad hoc das áreas clientes, em assuntos que tenham sinergia com o escopo de inteligência atendendo aos interesses da empresa;


Assegurar que todas as suas atividades e comportamento atendam o Código de Conduta da empresa, além de estar em compliance com os procedimentos e normas da Cia.


Idiomas
:
Inglês - Nível Fluente
Outros requisitos
: 
Requisitos Necessários:


Ensino Superior Completo (Desejável Administração, Economia e/ou Engenharias);


Conhecimento em Analise de Mercado de comodities Agrícola, Construção de cenários e projeções e Modelagem Estatística;


Inglês Fluente;


Necessário experiência no segmento sucroenergético;


Pacote Office: Avançado;


Disponibilidade para atuar no escritório de São Paulo (Região Brooklin).


Desejável:
Habilidades com Phyton, R;",Vagas.com
Analista Comercial Interno Pl,Grupo Dislub Equador,Recife / PE                                       A empresa aceita candidaturas de Recife e cidades próximas,PE,"Descrição
: 
Estamos em busca de um Analista Comercial Interno Pleno para se juntar à nossa equipe. Se você é uma pessoa proativa, organizada e com habilidades de comunicação excepcionais, essa vaga é para você!
Principais Responsabilidades


Analisar o desempenho das lojas de conveniência, acompanhando indicadores de vendas, mix de produtos e rentabilidade;


Realizar estudos de mercado e benchmarking para identificar oportunidades de expansão e inovação;


Apoiar negociações e a gestão de fornecedores estratégicos, garantindo alinhamento de campanhas, precificação e promoções;


Preparar e consolidar materiais e relatórios de performance para reuniões do Conselho de Clientes;


Transformar dados em insights práticos para fortalecer o relacionamento com a rede de revendedores;


Mapear a jornada do cliente, propondo melhorias que aumentem engajamento e fidelização;


Contribuir na execução de projetos estratégicos que impactem diretamente a experiência e retenção de clientes finais.


Requisitos:


Desejável experiência prévia na área comercial, canais de distribuição ou projetos de experiência do cliente;


Boa comunicação verbal e escrita;


Habilidade para negociação;


Ensino Superior completo em Administração, Marketing, Economia, Engenharia ou áreas correlatas.


Se você se encaixa no perfil e deseja fazer parte de uma equipe dinâmica e inovadora, candidate-se agora mesmo!",Vagas.com
Analista de Treinamento e Desenvolvimento  Sr.,Santista Têxtil,Tatuí / SP                                       A empresa aceita candidaturas de Tatuí e cidades próximas,SP,"Descrição
: 
•	Elaborar programas de treinamento, com base no levantamento de necessidades de treinamento realizado junto aos gestores.
•	Gerenciar a logística dos treinamentos, incluindo cronogramas, salas, equipamentos e fornecedores.
•	Lançar no sistemas treinamentos e toda operacionalização dos treinamentos obrigatórios.
•	Acompanhar o período de experiência de novos funcionários.
•	Monitorar e reportar indicadores de eficácia dos treinamentos (reação, aprendizado, aplicação e impacto).
•	Garantir a realização do programa de estágios da unidade, visando compatibilizar as necessidades organizacionais e individuais.
•	Planejar e executar programas de treinamento técnico e garantir os treinamentos obrigatórios.
•	Acompanhar o ciclo de avaliação de desempenho e apoiar na construção de PDI’s, plano de sucessão junto a área de Gente corporativa.
•	Promover ações de engajamento, integração e cultura organizacional.
•	Acompanhar indicadores de desenvolvimento e elaborar relatórios gerenciais.
•	Atuar em parceria com áreas como Qualidade, Segurança e Excelência Operacional para garantir alinhamento das ações.
Atualizar e criar políticas e procedimentos.
•	Dar suporte aos treinadores das unidades operacionais.
.
Outros requisitos
: 
Experiência sólida em DHO e T&D.
Conhecimento em metodologias de aprendizagem.
Ferramentas de assessment (DISC, MBTI etc.).
Desejável experiência em sistemas como Softexpert.
Domínio do pacote Office e ferramentas de análise de dados.",Vagas.com
Analista Administrativo Pleno - Comercial,Trasmontano Saúde,São Paulo / SP                                       A empresa aceita candidaturas de São Paulo e cidades próximas,SP,"Descrição
: 
PRINCIPAIS ATIVIDADES
1.	Monitorar tendências de mercado, realizar análises de concorrência e identificar oportunidades para o fortalecimento da atuação comercial da empresa;
2.	Analisar e interpretar dados de vendas, indicadores de desempenho e tendências setoriais, identificando oportunidades de crescimento e melhorias nos resultados;
3.	Prestar suporte operacional, administrativo e estratégico à equipe de vendas, abrangendo o processamento de pedidos, elaboração de relatórios, acompanhamento de metas, gestão de materiais de apoio e controle de indicadores;
4.	Elaborar relatórios de desempenho comercial e marketing, apresentando análises e recomendações sobre resultados, retorno sobre investimento, eficácia das estratégias implementadas;
5.	Apoiar na elaboração, revisão e acompanhamento de contratos comerciais com clientes, fornecedores e parceiros;
6.	Participar do planejamento e monitoramento do orçamento comercial, assegurando o uso eficiente dos recursos e o cumprimento das metas estabelecidas;
7.	Apoiar o relacionamento com clientes, contribuindo para a resolução de demandas, fornecimento de informações sobre produtos e serviços e promoção da satisfação do cliente, inclusive em eventos e treinamentos presenciais.
Todas as nossas posições podem ser afirmativas para a inclusão de mulheres, pessoas negras, profissionais com deficiência, pessoas LGBTQIAPN+ e pessoas 50+
Outros requisitos
: 
Ensino superior cursando em áreas da Comunicação, Marketing e Vendas.",Vagas.com
