titulo,empresa,localizacao,uf,descricao,fonte
Analista de RH Júnior – Atração e Seleção,Grupo Fleury,Vitória / ES                                       A empresa aceita candidaturas de Vitória e cidades próximas,ES,"Descrição
: 
Quais são os desafios da área e do cargo:
Esta pessoa terá como objetivo atuar de forma alinhada à visão estratégica de Negócios do Grupo Fleury, contribuindo para a construção de um ecossistema de Saúde integrado, preventivo e híbrido, tendo como principal foco o cuidado com as pessoas.
Se você tem interesse em fazer parte desse propósito e deseja estar sempre um passo a frente do mercado, vem com a gente!
Sobre a área: 
Executar processos seletivos de baixa e média complexidade das áreas corporativas e operações, alinhados a política e competências corporativas do Grupo, a fim de apresentar pessoas conectadas aos objetivos estratégicos da empresa, buscando não só as competências técnicas, mas o alinhamento de valores e propósito.
Principais atividades: 
•	Realizar todas as etapas dos processos seletivos interno e externo de baixa e média complexidade das áreas corporativas e operações do Grupo Fleury, através de técnicas e ferramentas de Atração e Seleção garantindo o encaminhamento de candidatos em alinhamento ao perfil solicitado pelas áreas demandantes;
•	Fortalecer o relacionamento com cliente interno através de Briefing e Follow up;
•	Aplicação de ferramentas de assessments e elaboração de parecer que registrem a análise de competências e subsidiem o processo de tomada de decisão;
•	Atualizar as ferramentas de gestão de vagas, garantindo a precisão dos status e informações, para facilitar a compilação de dados e a geração de indicadores;
•	Fornecer retorno as pessoas participantes dos processos seletivos com objetivos de gerar oportunidades de desenvolvimento e garantir uma melhor experiência;
•	Promover a marca empregadora, disseminando o eco sistema integrado de saúde e a cultura organizacional;
•	Construir conexões com áreas parceiras, por meio de uma comunicação fluida garantindo eficiência, agilidade e uma visão integrada dos processos;
•	Realizar entrevistas de desligamento, preenchendo o formulário padrão de maneira clara e objetiva, bem como compartilhar as informações relevantes ou reincidentes;
•	Analisar problemas atreladas a jornada de contratação de pessoas e promoção e sugerir alternativas viáveis para solução.
Buscamos alguém que apresente: 
•	Necessário graduação completa;
•	Necessário experiência prévia de estágio ou na assessoria a processos de Atração e Seleção;
•	Pacote Office intermediário.
Antes da inscrição na vaga, é importante verificar se você atende aos requisitos e se conecta com nosso propósito.
Nossa essência inspira o dia a dia, por isso, buscamos pessoas apaixonadas pelo que fazem, e que:
•	Estimulem um ambiente de troca de conhecimentos, compartilhando experiências, possibilitando a interdependência entre os times;
•	Estejam em constante movimento, investindo em autodesenvolvimento e atuando como facilitadora no desenvolvimento das outras pessoas;
•	Busquem consciência social de diversidade e inclusão, cooperando com a construção de um ambiente colaborativo;
•	Identifiquem e antecipem as necessidades dos clientes, agindo prontamente para encontrar soluções adequadas e personalizadas;
•	Planejem e executem o trabalho com excelência a fim de atingir os resultados esperados, com a visão de inovação e agilidade;
•	Gerem e implementem novas ideias, buscando constantemente por melhorias para a experimentação de novas abordagens e a adaptação às mudanças do mercado.
Modelo de Trabalho: Híbrido
Carga horária: 220h
Local: Vila Velha / Espirito Santo
Cuidamos de você em cada etapa da sua jornada! 
Saúde e Bem-estar:


Assistência médica e odontológica para você e sua família;


Ambulatório com clínica médica ou atendimento por telemedicina;


Linhas de cuidado especializadas: gestantes, adoção, obesidade, oncologia, entre outras;


Acesso à plataforma OrienteMe para sessões de terapia e orientação nutricional;


Licença maternidade e paternidade estendidas;


Acesso ao Wellhub para práticas esportivas e qualidade de vida.


Proteção e estabilidade:


Previdência privada;


Seguro de vida.


Facilidades para o dia a dia:


Vale-Alimentação;


Vale-Refeição;


Vale-Transporte;


Auxílio-Creche;


Desenvolvimento e educação:


Plataforma de ensino;


Parcerias educacionais com descontos em cursos e instituições.


Aqui, o cuidado vai além dos benefícios — ele está presente em cada momento da sua trajetória.
Promovemos uma cultura inclusiva, focada na equidade e na valorização das diferenças. 
Nossas vagas são abertas para todos os públicos e, simbolizando a nossa intencionalidade, oferecemos oportunidades afirmativas.
Nosso compromisso vai além do cumprimento das legislações que incentivam a diversidade e inclusão. 
Trabalhamos ativamente para ampliar a representatividade de nossas pessoas, pensando em raça, etnia, gênero, gerações, pessoas com deficiência e LGBTQIAPN+
 em nosso time, além de fortalecer a representatividade de mulheres negras, indígenas, chefes de família.
Para conhecer mais sobre o Grupo Fleury, acesse o site: 
https://carreiras.grupofleury.com.br/ 
O Grupo Fleury informa que a participação em seus processos seletivos é gratuita e nenhuma empresa terceira está autorizada a cobrar valores para a candidatura às vagas, ao treinamento, ao material didático ou qualquer outra despesa relacionada.",Vagas.com
Analista Técnico de Atendimento - Customer Service,Grupo Fleury,N/A,N/A,"Descrição
: 
Sobre a Marca:
O 
Hermes Pardini
 atua há mais de 65 anos em 
Minas Gerais
, sendo referência em 
Análises Clínicas, Exames de Imagem e Vacinas
. Sua trajetória é marcada por oferecer atendimento com precisão, responsabilidade e rigor técnico. Com unidades em 
Belo Horizonte, Nova Lima, Betim, Caeté, Contagem, Ibirite, Lagoa Santa, Pedro Leopoldo, Ribeirão das Neves, Sabará, Santa Luzia, Sete Lagoas, Vespasiano - MG
, o Hermes Pardini é integrante do 
Grupo Fleury
, uma das 
mais respeitadas empresas de medicina diagnóstica e saúde do Brasil
, fortalecendo seu compromisso com excelência, inovação e cuidado com as pessoas.
Quais são os desafios da área e do cargo:
Esta pessoa terá como objetivo atuar de forma alinhada à visão estratégica de Negócios do Grupo Fleury, contribuindo para a construção de um ecossistema de Saúde integrado, preventivo e híbrido, tendo como principal foco o cuidado com as pessoas.
Se você tem interesse em fazer parte desse propósito e deseja estar sempre um passo a frente do mercado, vem com a gente!
Principais atividades:


Responsável por analisar e esclarecer dúvidas das equipes de atendimento interno, executivos de vendas, laboratórios conveniados e os médicos prescritores, visando a compreensão dos métodos dos exames de alta complexidade das marcas do Grupo Fleury;


Orientar laboratórios conveniados sobre métodos de análise e orientação de exames da especialidade atendida, através de contatos telefônicos e meios digitais;


Minimizar as dúvidas das equipes das lojas de atendimento sobre dúvida de cadastros e análise de pedidos de exames da especialidade atendida, através da atualização contínua do help de exames de todos os setores técnicos e de esclarecimentos por telefone;


Suportar a equipe de assessores técnicos e executivos de vendas, através de esclarecimento de dúvidas sobre os exames de alta complexidade prestados aos laboratórios conveniados;


Analisar o fluxo de atendimento da especialidade acompanhada e propor melhorias para a experiência do cliente;


Contribuir nos projetos de melhoria contínua no atendimento dos laboratórios conveniados e cliente internos, seguindo as estratégias definidas pela empresa;


Garantir o conhecimento das equipes do Customer Service e demais clientes internos, através de treinamentos técnicos;


Suportar a gestão do conhecimento interno e externo, através da revisão e atualização de manuais, lâminas de produtos e demais materiais de divulgação em campanhas comerciais;


Apoiar na orientação ativa de pré-analítico, quando necessário;


Realizar a retificação de dados demográficos, quando solicitado por clientes L2L, de acordo com as diretrizes definidas no documento pertinente.


Buscamos alguém que apresente: 


Superior completo em Farmácia Bioquímica, Biomedicina ou Ciências Biológicas.


Experiência na área laboratorial;


Pacote Office – Intermediário;


Inglês – Básico;


Conhecimento em exames de análises clínicas, anatomia patológica, biologia molecular – Avançado;


Boa escuta, flexibilidade, dinamismo, proatividade, boa comunicação.


Antes da inscrição na vaga, é importante verificar se você atende aos requisitos e se conecta com nosso propósito.
Nossa essência inspira o dia a dia, por isso, buscamos pessoas apaixonadas pelo que fazem, e que:
•	Estimulem um ambiente de troca de conhecimentos, compartilhando experiências, possibilitando a interdependência entre os times;
•	Estejam em constante movimento, investindo em autodesenvolvimento e atuando como facilitadora no desenvolvimento das outras pessoas;
•	Busquem consciência social de diversidade e inclusão, cooperando com a construção de um ambiente colaborativo;
•	Identifiquem e antecipem as necessidades dos clientes, agindo prontamente para encontrar soluções adequadas e personalizadas;
•	Planejem e executem o trabalho com excelência a fim de atingir os resultados esperados, com a visão de inovação e agilidade;
•	Gerem e implementem novas ideias, buscando constantemente por melhorias para a experimentação de novas abordagens e a adaptação às mudanças do mercado.
Informações da vaga:
Modelo de Trabalho: Home Office.
Carga Horária: 220hs
Escala: Segunda a sexta feira.
Horário de Trabalho: 08:00h as 17:12h
Cuidamos de você em cada etapa da sua jornada! 
Saúde e Bem-estar:


Assistência médica e odontológica para você e sua família;


Ambulatório com clínica médica ou atendimento por telemedicina;


Linhas de cuidado especializadas: gestantes, adoção, obesidade, oncologia, entre outras;


Acesso à plataforma OrienteMe para sessões de terapia e orientação nutricional;


Licença maternidade e paternidade estendidas;


Acesso ao Wellhub para práticas esportivas e qualidade de vida.


Proteção e estabilidade:


Previdência privada;


Participação nos lucros;


Seguro de vida.


Facilidades para o dia a dia:


Vale-Alimentação;


Vale-Refeição;


Vale-Transporte;


Auxílio-Creche;


Clube de Descontos com lojas, farmácias, viagem, beleza, cultura, lazer, entre outros serviços.


Desenvolvimento e educação:


Plataforma de ensino;


Parcerias educacionais com descontos em cursos e instituições.


Aqui, o cuidado vai além dos benefícios — ele está presente em cada momento da sua trajetória.
Promovemos uma cultura inclusiva, focada na equidade e na valorização das diferenças. 
Nossas vagas são abertas para todos os públicos e, simbolizando a nossa intencionalidade, oferecemos oportunidades afirmativas.
Nosso compromisso vai além do cumprimento das legislações que incentivam a diversidade e inclusão. 
Trabalhamos ativamente para ampliar a representatividade de nossas pessoas, pensando em raça, etnia, gênero, gerações, pessoas com deficiência e LGBTQIAPN+
 em nosso time, além de fortalecer a representatividade de mulheres negras, indígenas, chefes de família.
Para conhecer mais sobre o Grupo Fleury, acesse o site: 
https://carreiras.grupofleury.com.br/ 
O Grupo Fleury informa que a participação em seus processos seletivos é gratuita e nenhuma empresa terceira está autorizada a cobrar valores para a candidatura às vagas, ao treinamento, ao material didático ou qualquer outra despesa relacionada.",Vagas.com
Analista de Business Intelligence (Vaga Exclusiva - Pcd),Atlas Copco Brasil,Barueri / SP                                       A empresa aceita candidaturas de Barueri e cidades próximas,SP,"Descrição
: 
Sua função
Apoiar a Companhia na transformação de dados em informações claras e acessíveis, contribuindo para análises, automações e soluções que aprimorem a eficiência operacional e apoiem a tomada de decisões estratégicas.
Você irá:


Apoiar na análise, tratamento e modelagem de dados, gerando 
insights 
que subsidiem a tomada de decisão;


Participar da criação e manutenção de processos de ETL, utilizando ferramentas de integração e 
Power Platform
, quando necessário;


Desenvolver e atualizar 
dashboards 
e relatórios em 
Power 
BI;


Monitorar o desempenho das soluções de BI, realizando ajustes e sugerindo melhorias;


Auxiliar na automação de fluxos de trabalho com 
Power Automate
 e no desenvolvimento de aplicativos com 
Power Apps
;


Realizar consultas em bases de dados (SQL) e apoiar na organização e estruturação das fontes de informação.


 
Para ter sucesso você precisará
Recomendamos que você se inscreva mesmo que não atenda a todos os requisitos. Valorizamos experiências e perspectivas diversas e estamos ansiosos para ver o que você pode oferecer para a função.


Formação superior em áreas como Tecnologia da Informação, Ciência de Dados, Engenharia, Estatística, Administração, Marketing ou áreas correlatas;


Conhecimento em Pacote Office;


Vivência com ferramentas de BI (como Power BI) será um diferencial;


Inglês será considerado um diferencial;


Boa comunicação e facilidade para interagir com diferentes áreas.


 
Em troca nós oferecemos


Cultura de confiança e responsabilidade;


Aprendizado contínuo e perspectiva de carreira;


Inovação com diferentes tecnologias;


Remuneração e benefícios abrangentes.


 
Informações adicionais


Atuação em Barueri/SP (a Atlas Copco Brasil – Unidade Compressores tem previsão de mudança para a região de Sorocaba/SP em 2027.)


Esta oportunidade é destinada exclusivamente a Pessoas com Deficiência (PcD)


Idiomas
:
Inglês - Nível Básico e Inglês - Nível Intermediário",Vagas.com
Analista de Qualidade - Qualidade Dedicada - Hospital Vivalle,Rede D'Or,São José dos Campos / SP                                       A empresa aceita candidaturas de qualquer cidade do Brasil,SP,"Descrição
: 
Requisitos:
• Ensino Médio Completo;
Atividades:
•	Participar das auditorias externas, realizar auditorias internas e acompanhar o pós-auditoria do no Grupo VIVALLE e Terceiros;
•	Emitir relatórios de Auditorias Interna e Não Conformidades apontadas;
•	Garantir o lançamento das informações na base de dados dos indicadores, interação de processos e não conformidades;
•	Auxiliar na elaboração de Regimentos, Normas, Políticas, POPS e Fluxos;
•	Realizar a gestão dos documentos administrativos (elaboração, revisão, validação e aprovação).
•	Manter atualizado a base de dados de gestão de documentos;
•	Acompanhar as ações de melhorias propostas e o impacto nos resultados dos indicadores;
•	Acompanhar a manutenção das ações e melhorias implantadas;
•	Auxiliar nos Mapeamentos de Processos Institucionais;
•	Auxiliar no desenvolvimento de indicadores alinhados aos resultados dos processos;
•	Oferecer suporte na organização dos eventos relacionados à qualidade (treinamentos, reuniões, etc);
•	Realizar treinamentos relacionados à qualidade;
•	Realizar processo de Integração de Novos Colaboradores e Terceiros;
•	Acompanhar avaliação de fornecedores realizados pelas áreas;
•	Realizar a gestão de contratos (disponibilização no sistema tasy, controle de vencimento, bem como acompanhar a avaliação dos serviços prestados);
•	Aprendizagem de atividades relacionada a rotinas internas do escritório de qualidade para backup e cobertura de férias;
Outras informações:
• Local de trabalho: São José dos Campos/SP;",Vagas.com
Analista de Operações Jr (Implantação Pme - Saúde/Odonto),SulAmérica,São Paulo / SP                                       A empresa aceita candidaturas de São Paulo e cidades próximas,SP,"Descrição
: 
Para o match perfeito acontecer precisa de PESSOAS, com as mais diversas experiências e pontos de vista, para que possamos continuar evoluindo enquanto empresa.
Por isso, aqui na SulAmérica, incentivamos a candidatura de pessoas de todas as raças/etnias, orientações sexuais, identidades de gênero, gerações, com ou sem deficiência, para todas as nossas vagas. Afinal, as nossas diferenças é o que nos complementam!
#LGBTI+ #PessoasNegras #PcD #50+ #Gerações #PessoasComDeficiência
Missão do cargo: 
Atuar de forma analítica e resolutiva nos processos operacionais de implantação, dando suporte ao corretor, garantindo agilidade, precisão e conformidade regulatória nas entregas, com foco na experiência do cliente e na eficiência operacional.
Principais Responsabilidade: 
Executa e controla os processos de implantação com foco em clientes PME. É responsável por controlar e aperfeiçoar processos operacionais relacionados à jornada do beneficiário, com foco na implantação da proposta, atuando com visão crítica, domínio técnico e capacidade de resolução de problemas. Contribui para a integridade dos dados, conformidade regulatória e fluidez dos processos.
Gestão de Implantação e Processos:




Controle de Implantação: 
Executa e monitora os processos de entrada de novos clientes, com foco no segmento PME.




Análise Documental:
 Interpreta e valida documentos contratuais para garantir a conformidade jurídica e operacional.




Gestão de Indicadores:
 Acompanha KPIs operacionais e assegura o cumprimento dos prazos de entrega (SLAs).




Melhoria Contínua:
 Identifica falhas nos fluxos de trabalho e propõe soluções para otimizar a operação.




Controle de Produtividade:
 Organiza e monitora o desempenho individual das etapas da ""esteira"" de implantação.




Interface com Corretoras: 
Mantém uma rotina de reuniões semanais para sanar dúvidas e alinhar processos com os parceiros.




Capacitação Técnica:
 Realiza eventuais treinamentos e visitas presenciais a corretores para oferecer suporte prático e técnico.




Colaboração Interna:
 Interage com as áreas de Comercial, Relacionamento, Jurídico, Fraude e TI para resolver pendências de forma ágil.




Manipulação de Dados: 
Processa informações e elabora apresentações de resultados para os corretores parceiros.




Integridade de Dados:
 Garante que todas as informações inseridas nos sistemas internos estejam consistentes e atualizadas.


Requisitos e Qualificações:




Formação: 
Direito, T.I, Gestão da Qualidade, Processos Gerenciais, Engenharia de Produção (Áreas correlatas).




Diferencial:
 Pós graduação/MBA.




Pacote Office
 (Excel Intermediário, PowerPoint Intermediário);




Implantação PME: 
Desejável experiência em implantação de clientes PME (setor seguradora/saúde).




Comportamental:
 Perfil analítico, protagonista, maduro, com foco, constância, boa comunicação, conhecimento de gramática (oral e escrita). Mindset voltado a IA;",Vagas.com
Pessoa Analista Sistemas Sênior- Funcional -  Tecnologia da Informação,Grupo Águas do Brasil,Niterói / RJ                                       A empresa aceita candidaturas de qualquer cidade do Brasil,RJ,"Descrição
: 
Foco em Suprimentos
Requisitos:
Formação superior completa em  Ciências da Computação ou Análise e Desenvolvimento de Sistemas (bacharelado ou tecnólogo).
Área do conhecimento: Engenharia de software
 Conhecimentos Específicos:
. Técnicas para Elicitação e Análise de Requisitos de sistemas;
. Metodologias de desenvolvimento de sistemas ( Modelo cascata e Métodos Ágeis )
. Gestão de projetos;
. Microsoft Office
Responsabilidades do Cargo:
. Realizar o levantamento dos requisitos que precisarão ser atendidos com o suporte de sistemas, realizando entrevistas e workshops com as partes interessadas para entender o problema e/ou os objetivos que deverão ser alcançados que agregarão valor ao negócio;
. Realizar a análise, negociação e especificação dos requisitos, trabalhando cenários e construindo protótipos das mudanças nos sistemas, mapeando processos e modelagem de dados, avaliando a integração entre os diversos sistemas da empresa, com o objetivo de projetar um novo sistema ou adaptações em sistemas existentes;
. Acompanhar e suportar a etapa de construção dos sistemas, esclarecendo dúvidas da equipe de desenvolvedores e complementando a especificação quando necessário, com o objetivo de garantir a implementação correta do projeto de sistema;
. Planejar e realizar testes para avaliar o funcionamento dos sistemas, checando o atendimento aos requisitos de negócio e padrões de qualidade;
. Apoiar a validação do projeto de sistema pelas partes interessadas, acompanhando a realização dos testes de aceitação e gerindo a realização de eventuais ajustes, com o objetivo de garantir uma entrega de qualidade;
. Gerir a implantação do sistema, planejando e acompanhando a sua instalação e a migração de dados quando necessário, para garantir uma mudança bem-sucedida nas rotinas e processos operacionais da empresa;
. Acompanhar o uso do sistema entregue, suportando os seus usuários,  para identificar e tratar  a ocorrência de eventuais erros e melhorias que possam surgir.",Vagas.com
Analista de Merchandising Sr - Exclusivo para Profissionais com Deficiência,Essilorluxottica,São Paulo / SP                                       A empresa aceita candidaturas de São Paulo e cidades próximas,SP,"Descrição
: 
Descrição da vaga:
Buscamos um(a) Analista de Merchandising Sênior para atuar no desenvolvimento e acompanhamento de estratégias de trade marketing e merchandising.
Essa pessoa será responsável por analisar a performance das ações, apoiar no planejamento estratégico e atuar em parceria com áreas internas, garantindo a execução das iniciativas e propondo melhorias contínuas.
Responsabilidades:
Desenvolver e acompanhar estratégias de merchandising
Analisar indicadores e performance das ações
Apoiar no planejamento de campanhas e iniciativas
Atuar em interface com áreas internas
Propor melhorias com base em dados e resultados
Requisitos:
Experiência sólida em merchandising ou trade marketing
Vivência com análise de indicadores e performance
Perfil analítico e com autonomia
Diferenciais
:
Experiência em empresas de grande porte ou multinacionais
Inglês intermediário/avançado
Vivência com contato com times globais",Vagas.com
Analista - Ouvidoria - Central Sul (Capão Redondo),Rede D'Or,São Paulo / SP                                       A empresa aceita candidaturas de São Paulo e cidades próximas,SP,"Descrição
: 
Requisitos:
- Formação: Ensino superior completo.
- Experiência: Atendimento ao cliente, ouvidoria ou SAC.
Atividades:
Registro, análise e elaboração de pareceres de processos de Ouvidoria;
Contato com clientes e áreas técnicas;
Suporte a equipe de atendimento;
Influenciar e colaborar com Supervisor/Líder de Atendimento com as equipes multi para aumentar a satisfação dos clientes;
Classificação e analise de depoimentos da pesquisa e das reclamações.
Apresentação de resultados mensais e análises técnicas de jornadas, processos para busca de melhoria;
Visita as unidades hospitalares e relacionamento com a média e alta gerência;
Monitoramento dos resultados das unidades e central de atendimento;
Atendimento a clientes externos via telefone/e-mail;
Levantamento de dados da pesquisa e ouvidoria para participação nos comitês de melhoria;
Outras informações:
- Local de trabalho: Região de Capão Redondo - Zona Sul-SP.
- Escala de trabalho: 220 - (5X2) - 2º A 5º - 08:00 12:00 13:00 18:00/ 6° 08:00 12:00 13:00 17:00
- Disponibilidade para treinamento.",Vagas.com
Analista de Tesouraria Sr (Latam) - Espanhol Avançado a Fluente,Saint-Gobain,São Paulo / SP                                       A empresa aceita candidaturas de São Paulo e cidades próximas,SP,"Descrição
: 
Rotinas de Tesouraria relacionadas a:


Operações de câmbio;


Hedge e cobertura cambial;


Empréstimos intercompany;


Garantias bancárias;


Linhas de crédito, risco sacado e demais instrumentos financeiros;


Relacionamento com instituições financeiras.


Atuar como ponto focal LATAM:
Participar e liderar reuniões em espanhol;
Garantir fluidez na comunicação e alinhamento entre países.
Elaborar e aprimorar análises financeiras utilizando Excel avançado e/ou Power BI. Interpretar dados, gerar insights relevantes e propor melhorias com visão crítica. Contribuir para otimizações de processos e iniciativas de automação dentro da área.
Requisitos:


Formação superior completa em Administração, Contabilidade, Economia ou Engenharia.


Espanhol avançado, capaz de conduzir reuniões e interações na língua.


Experiência sólida, atuando diretamente em Tesouraria, com foco em operações financeiras corporativas.


Vivência prévia em empresas multinacionais de médio/grande porte.


Excel avançado e experiência prática com análise de dados.


Experiência prévia ou forte familiaridade com Power BI ou ferramentas de automação.


Idiomas
:
Espanhol - Nível Avançado
Outros requisitos
: 


Desenvoltura para falar em público e em outros idiomas;


Perfil analítico, crítico e com visão de negócio;


Maturidade profissional e autonomia;


Organização e capacidade de priorização;


Postura colaborativa e espírito de dono.",Vagas.com
