titulo,empresa,localizacao,uf,descricao,fonte
Analista de Desenvolvimento e Validação de Métodos Pl,Marjan Farma,São Paulo / SP                                       A empresa aceita candidaturas de qualquer cidade do Brasil,SP,"Descrição
: 
- Operar os equipamentos da área, seguindo os procedimentos de operação;
- Elaborar os métodos de análise, procedimentos, protocolos e relatórios de validação de métodos, além de conhecimentos de pesquisa e dados científicos;
- Executar a padronização das matérias-primas, a fim de utilizá-las nas análises de produto acabado e estudos de estabilidade;
- Executar as análises de qualitativas, quantitativas e testes físicos, de matérias-primas e produtos acabados, seguindo as normas de boas práticas de fabricação e legislações vigentes, para realização de estudos de estabilidade e de liberação de materiais para a fabricação de lotes piloto;
- Desenvolver e validar métodos, de média ou alta complexidade, métodos indicativos de estabilidade, visando atender as exigências da área da Qualidade e Projetos;
- Realizar avaliação estatística dos parâmetros de validação de métodos e análises de estabilidade;
- Apoiar a formatação da metodologia de análise validada para o modelo oficial (matéria-prima e produto acabado), a fim de que o mesmo atenda as exigências da área da Qualidade;
- Apoiar a revisão da metodologia e certificado de análise, elaborar os métodos gerais mediante necessidade, visando atender as exigências da área da Qualidade;
- Conferir a documentação analítica da área.
Outros requisitos
: 
- Formação superior completa em Farmácia, Engenharia Química ou Química
- Conhecimentos em técnicas analíticas clássicas e instrumentais, tais como: HPLC - Cromatografia líquida de alta eficiência, Absorção Atômica e GC -Cromatografia Gasosa;

- Experiência em laboratório de desenvolvimento analítico, realizando análises quantitativas e qualitativas de produtos ou insumos farmacêuticos;

- Experiência nos procedimentos de validação de métodos.",Vagas.com
10982 - Analista Desenvolvedor Full Stack,Talent Group,Rio de Janeiro / RJ                                       A empresa aceita candidaturas de qualquer cidade do Brasil,RJ,"Descrição
: 
Conhecimentos Técnicos:


Experiência comprovada com C# e .NET Framework/Core;


Domínio em SQL Server, incluindo construção e otimização de queries;


Conhecimento sólido em JavaScript;


Vivência com análise crítica de código e Code Review;


Perfil analítico com capacidade de identificar falhas, inconsistências e propor soluções escaláveis;


Boa comunicação para interações técnicas com o time.


Desejáveis:


Conhecimento em ferramentas de versionamento (Git);


Noções de arquitetura de software e boas práticas de desenvolvimento;


Vivência com metodologias ágeis.


Responsabilidades e Atribuições: 


Desenvolver soluções Full Stack escaláveis e de alta complexidade, utilizando boas práticas de desenvolvimento;


Identificar e propor refatorações de código, melhorias de performance e oportunidades de automação;


Orientar e apoiar tecnicamente outros desenvolvedores, promovendo a troca de conhecimento dentro do time;


Participar ativamente das cerimônias ágeis, colaborando na definição de soluções técnicas para os desafios dos projetos;


Integrar-se com equipes multidisciplinares para entender requisitos, alinhar expectativas e entregar valor com eficiência.


Atuará com diversos tipos de integrações de APIs RESTful e SOAP, banco de dados SQL em diversos tipos de SGBDs, em um ambiente dinâmico e orientado a entregas. É essencial ter experiência em desenvolvimento com C#, ASP.NET e/ou .NET Core, pois estas são as principais tecnologias utilizadas na construção e integração dos nossos sistemas.


Será responsável por criar formulários e páginas responsivas voltadas para produtos de processos administrativos, utilizando JavaScript e aplicando a estilização fornecida pelo Bootstrap, garantindo uma boa experiência de uso e compatibilidade entre diferentes dispositivos.",Vagas.com
10959 - Analista de Suporte a Sistemas (Sustentação),Talent Group,São Paulo / SP                                       A empresa aceita apenas candidaturas de São Paulo,SP,"Descrição
: 
Buscamos profissionais especializados em sustentação de aplicações .NET, com experiência em ambientes de meios de pagamento e adquirência, responsáveis por garantir a disponibilidade, estabilidade e performance das soluções críticas que suportam transações financeiras em tempo real.
O profissional atuará diretamente na investigação e resolução de incidentes, execução de melhorias contínuas, além de colaborar com equipes de desenvolvimento, infraestrutura e negócios para assegurar a resiliência e conformidade das aplicações.
Requisitos Técnicos:


Experiência prática em .NET (Framework/Core).


Conhecimento em bancos de dados SQL Server e PostgreSQL (consultas, SPs, troubleshooting).


Vivência em ambientes de adquirência: captura, autorização, conciliação e integração com bandeiras/emissores.


Experiência em mensageria (RabbitMQ, Kafka, MSMQ).


Conhecimentos em ferramentas de monitoria (Datadog, App Insights, Grafana, Zabbix).


Noções de infraestrutura (IIS, Windows Server, Linux containers).


Desejável: GCP para aplicações distribuídas.


Diferencial: conhecimento em padrões de segurança para meios de pagamento (PCI DSS).


 Atividades Principais:


Monitoramento e sustentação de aplicações .NET Core / Framework em ambientes críticos de adquirência.


Atendimento e resolução de incidentes (N2/N3), garantindo SLA e disponibilidade.


Análise de logs, troubleshooting de erros em tempo real e integração com sistemas de monitoria (ex: Datadog, Grafana, App Insights).


Gestão de filas e mensageria (RabbitMQ, Kafka, MSMQ) em fluxos transacionais.


Atuação em melhorias de performance (tempo de resposta, consumo de APIs, otimização de queries SQL).


Apoio em auditorias e conformidade (PCI DSS, LGPD, ISO 27001).


Colaboração com áreas de negócio em incidentes críticos relacionados a captura, autorização e liquidação de transações.


Documentação de procedimentos e gestão de conhecimento.",Vagas.com
10958 - Analista de Suporte a Sistemas (Sustentação),Talent Group,São Paulo / SP                                       A empresa aceita apenas candidaturas de São Paulo,SP,"Descrição
: 
Buscamos profissionais especializados em sustentação de aplicações .NET, com experiência em ambientes de meios de pagamento e adquirência, responsáveis por garantir a disponibilidade, estabilidade e performance das soluções críticas que suportam transações financeiras em tempo real.
O profissional atuará diretamente na investigação e resolução de incidentes, execução de melhorias contínuas, além de colaborar com equipes de desenvolvimento, infraestrutura e negócios para assegurar a resiliência e conformidade das aplicações.
﻿Requisitos Técnicos:


Experiência prática em .NET (Framework/Core).


Conhecimento em bancos de dados SQL Server e PostgreSQL (consultas, SPs, troubleshooting).


Vivência em ambientes de adquirência: captura, autorização, conciliação e integração com bandeiras/emissores.


Experiência em mensageria (RabbitMQ, Kafka, MSMQ).


Conhecimentos em ferramentas de monitoria (Datadog, App Insights, Grafana, Zabbix).


Noções de infraestrutura (IIS, Windows Server, Linux containers).


Desejável: GCP para aplicações distribuídas.


Diferencial: conhecimento em padrões de segurança para meios de pagamento (PCI DSS).


Atividades Principais:


Monitoramento e sustentação de aplicações .NET Core / Framework em ambientes críticos de adquirência.


Atendimento e resolução de incidentes (N2/N3), garantindo SLA e disponibilidade.


Análise de logs, troubleshooting de erros em tempo real e integração com sistemas de monitoria (ex: Datadog, Grafana, App Insights).


Gestão de filas e mensageria (RabbitMQ, Kafka, MSMQ) em fluxos transacionais.


Atuação em melhorias de performance (tempo de resposta, consumo de APIs, otimização de queries SQL).


Apoio em auditorias e conformidade (PCI DSS, LGPD, ISO 27001).


Colaboração com áreas de negócio em incidentes críticos relacionados a captura, autorização e liquidação de transações.


Documentação de procedimentos e gestão de conhecimento.",Vagas.com
Analista de Negócios / Inteligência de Mercado,Reggiani Hunting,Belo Horizonte / MG                                       A empresa aceita candidaturas de Belo Horizonte e cidades próximas,MG,"Descrição
: 
🔍 Estamos em busca de um Analista de Negócios / Inteligência de Mercado
Local: Belo Horizonte (MG) ou Campo Grande (MS)
Modelo: Presencial | Disponibilidade para viagens
Sobre a oportunidade:
Você gosta de construir o novo, de atuar próximo à alta gestão e de participar de decisões estratégicas que impulsionam o crescimento de uma empresa?
Esta é a sua chance de integrar uma área em fase de estruturação, com atuação direta junto ao proprietário e aos acionistas, contribuindo para projetos de expansão, fusões, aquisições e operações societárias.
Como Analista de Negócios você será peça-chave na modelagem financeira, estruturação de investimentos e desenvolvimento de simuladores de análise de viabilidade, apoiando decisões que impactam o futuro da companhia.
Principais desafios:
•	Apoiar o desenvolvimento de estudos e projetos estratégicos de investimento, expansão e M&A;
•	Elaborar modelos financeiros e simuladores para análise de cenários e tomada de decisão;
•	Estruturar e acompanhar operações societárias e de reestruturação corporativa;
•	Atuar em sinergia com o conselho administrativo e a alta direção.
O que buscamos:
•	Formação superior em Administração, Economia, Engenharia, Finanças ou áreas correlatas;
•	Experiência consolidada em modelagem financeira, valuation, planejamento estratégico ou M&A; com Excel avançado e Power BI.
•	Visão analítica, pensamento estratégico e capacidade de transformar dados em insights de negócio;
•	Perfil protagonista, com autonomia e interesse em atuar em um ambiente de construção e crescimento.
Por que esta é uma oportunidade diferenciada:
•	Atuação direta com a alta liderança e acionistas;
•	Participação ativa na estruturação de uma nova área estratégica;
•	Ambiente dinâmico, de alto impacto",Vagas.com
Analista de Gestão e Operações de Fidc Pleno,Ecoagro,São Paulo / SP                                       A empresa aceita candidaturas de São Paulo e cidades próximas,SP,"Descrição
: 
Venha fazer parte do time Ecoagro!
O Grupo Ecoagro desenvolve e estrutura operações financeiras adequadas tanto às necessidades de rentabilidade e segurança de investidores quanto à demanda de recursos para produtores e empresas rurais.
🌱 
Nossos Valores
Ética e transparência: Agimos com integridade, respeitamos as leis, os princípios morais, e comunicamos nossas políticas e resultados de forma clara.
Espírito de criatividade: Buscamos novas oportunidades de ação e soluções inovadoras diante das necessidades que se apresentam, assegurando a execução de estratégias que visam o crescimento da Ecoagro.
Excelência de desempenho: Buscamos melhoria contínua e o controle dos resultados por indicadores de desempenho reconhecidos como referência das melhores práticas.
Responsabilidade econômica, social e ambiental: Reconhecemos e agimos no sentido de que estas dimensões estejam sempre em equilíbrio, de modo a promover o desenvolvimento e garantir a sustentabilidade.
🟩 Valorizamos a diversidade e queremos você com a gente nessa jornada, se você se identifica com o nosso propósito, venha fazer parte do nosso time!
🔎 
Oportunidade:
 Analista de Gestão de FIDC Pleno
Execução dos processos operacionais dos fundos de investimento geridos pela instituição;
Simulação de cenários: análise dos impactos na movimentação dos fundos.
Construção e manutenção de planilhas com a posição dos fundos;
Organização de processos operacionais;
Suporte operacional na estruturação de novos fundos de investimento;
Suporte na implantação de novos processos/controles e implantação dos novos fundos;
Suporte no acompanhamento dos controles internos e controles dos fundos;
Suporte aos demais colaboradores da área;
Identificação, mapeamento e desenho de processos, bem como, atuar para sua melhoria contínua dos processos;
Controle e acompanhamento das operações do dia;
Responsável pelo fechamento diário das operações;
Suporte e acompanhamento em projetos/processos da área;
Suporte às demais áreas referentes aos processos operacionais conduzidos;
Atender clientes e parceiros externos com responsabilidade, garantindo a excelência nos processos operacionais estabelecidos pela empresa;
Atuar para que todas as solicitações sejam realizadas dentro do prazo, com qualidade, seguindo as normas estabelecidas em cada atribuição;
Desenvolver, consolidar e preencher planilhas, relatórios, manuais, documentos e afins.
Requisitos:
Graduação: Superior completo em Economia, Estatística, Engenharia, Matemática, Administração, física, Gestão de Agronegócios, ou áreas afins.
Conhecimento necessário: Domínio do pacote office, principalmente com Excel voltado a análise de dados e otimização. Ter experiência prévia no mercado financeiro: gestoras, administradores e/ou custodiantes.
Experiência prévia com gestão de FIDC. 
Conhecimento desejável: Domínio em linguagens de programação, de banco de dados e ferramentas de BI será um diferencial (R, Python, SQL, Power BI, entre outros) – não obrigatório. 
Desejável conhecimento em estrutura de hedge de IDI, cambial 
Certificações desejáveis: CPA10, CPA20, CEA.
✨ 
Nossos Benefícios
Na Ecoagro, valorizamos o bem-estar e o crescimento dos nossos colaboradores, pensando nisso oferecemos:
Plano de saúde Porto Seguro: 100% coberto pela empresa
Plano odontológico Porto Seguro: 100% coberto pela empresa
Seguro de Vida
Semana de Folga no Final do Ano
Wellhub/Gympass e TotalPass
Cartão Multibenefícios Flash para utilização em diversas categorias: o vale refeição flexível: podendo ser utilizado em alimentação, transporte, lazer e muito mais.
Bônus anual (condicionado ao resultado da empresa).
Conheça o nosso negócio
Desde 2009 a Ecoagro está à frente no mercado como maior securitizadora em emissão de CRA no Brasil. São mais de 75 bilhões de emissões de CRA e 6.5 bilhões de fundos sob gestão.
O Grupo Ecoagro desenvolve e estrutura operações financeiras adequadas tanto às necessidades de rentabilidade e segurança de investidores quanto à demanda de recursos para produtores e empresas rurais.
Se você se identifica com o nosso propósito, venha fazer parte do nosso time! 🌱
Saiba mais sobre a Ecoagro em:
 www.ecoagro.agr.br.",Vagas.com
Analista de Atração de Talentos Sênior (Temporário),JLL,São Paulo / SP                                       A empresa aceita candidaturas de qualquer cidade do Brasil,SP,"Descrição
: 
Faça parte de uma das maiores empresa de serviços imobiliários corporativos do mundo!
📍 São Paulo – SP (Vila Olímpia) | Modelo híbrido
Atividades:
- Liderar processos de recrutamento externos e internos de ponta a ponta, desenvolvendo estratégias personalizadas de atração de talentos
- Gerenciar processos seletivos simultâneos para diferentes áreas e níveis hierárquicos
- Assegurar SLAs de qualidade, mantendo 
time-to-hire 
otimizado e experiência positiva de candidatos
- Acompanhar, atualizar e desenvolver indicadores e relatórios
- Impulsionar marca empregadora, liderando iniciativas que posicionem a JLL como referência no mercado imobiliário
- Potencializar diversidade e inclusão nos processos seletivos, contribuir com atingimento de cotas legais, além de desenvolver projetos de atração que garantam processos equitativos e representativos
- Identificar e estabelecer parcerias estratégicas com consultorias, instituições de ensino e novas fontes de recrutamento
- Propor e atuar em iniciativas de melhoria contínua de processos, projetos e inovação da área
- Colaborar com 
stakeholders 
globais, BP's de RH e lideranças em processos seletivos e projetos visando credibilidade e experiência positiva a todos os envolvidos
Requisitos:
- Ensino Superior completo
- Sólida experiência em recrutamento
 end-to-end
 para diferentes áreas e níveis hierárquicos
- Vivência com gestão de alto volume de vagas
- Facilidade com Excel e análise de dados
- Desejável experiência em empresas de serviços e/ou consultorias de recrutamento
- Inglês avançado/fluente (requisito obrigatório - interação constante com time global e gestores de contratação estrangeiros)
A JLL tem uma cultura diversa e inclusiva. Estamos comprometidos em criar um ambiente em que todos se sintam valorizados e capacitados para atingir o seu potencial, independentemente de deficiência, raça, etnia, idade, religião, sexo biológico, identidade de gênero, orientação sexual, expressão de gênero ou biotipo. 
Conheça mais sobre nossas iniciativas de Diversidade e Inclusão em: 
https://www.jll.com.br/pt/carreiras/diversidade-e-inclusao
 
Idiomas
:
Inglês - Nível Avançado",Vagas.com
Analista de Garantia de Qualidade Operacional,The Adecco Group,Guarulhos / SP                                       A empresa aceita candidaturas de Guarulhos e cidades próximas,SP,"Descrição
: 
A Adecco em parceria com multinacional do setor farmacêutico, busca profissionais com expertise e interesse no cargo de 
Analista de Garantia de Qualidade Operacional 
para atuação em Projeto.
 
Atribuições: 
Garantir a qualidade dos produtos nos centros de distribuição, acompanhando operações internas e de operadores logísticos;
Divulgar e implementar diretrizes de qualidade em processos internos e externos, por meio de treinamentos e procedimentos;
Monitorar desvios de qualidade, mudanças, auditorias e CAPAs, propondo melhorias para alcance de metas;
Consolidar dados de qualidade para relatórios internos e órgãos regulatórios;
Auditar clientes, fornecedores e transportadoras, propondo e acompanhando ações corretivas;
Realizar auditorias internas, acompanhar auditorias externas e assegurar conformidade com exigências regulatórias e globais;
Elaborar, revisar e implementar procedimentos, garantindo aderência às políticas e legislações;
Gerir produtos retornados e processos de recall, assegurando qualidade e destinação adequada;
Garantir conformidade com processos de Cold Chain e apoiar operações relacionadas;
Registrar e gerenciar reclamações e dúvidas técnicas sobre qualidade;
Preparar relatórios de desempenho do departamento de qualidade;
Praticar rigorosamente políticas de qualidade e HSE, identificando e corrigindo riscos;
Validar sistemas computadorizados e planilhas críticas;
Apoiar campanhas nacionais de distribuição e qualificações de rotas de produtos sensíveis;
Acompanhar estudos de estresse de produtos biológicos conforme requisitos locais.
Idiomas
:
Inglês - Nível Intermediário
Outros requisitos
: 
Ensino superior completo em Farmácia e/ou em áreas correlatas, como Química ou Engenharia Química.
Vivência em operações logísticas e Supply Chain, preferencialmente no setor farmacêutico;
Experiência em distribuição de medicamentos;
Conhecimento em monitoramento de temperatura;
Experiência com sistemas de gestão da qualidade, incluindo: Gestão de desvios; CAPAs; Controle de mudanças; Revisão de procedimentos; 
Vivência em Gerenciamento de atividades junto a operadores logísticos;
Conhecimento específico:
Sistema SAP (desejável)
Inglês intermediário-avançado será um diferencial.
Excel avançado.
Power BI.",Vagas.com
Analista de Suprimentos Junior Ou Pleno (anchieta-Ubu),Metacon Engenharia e Consultoria LTDA.,Anchieta / ES                                       A empresa aceita candidaturas de Anchieta e cidades próximas,ES,"Descrição
: 
Suportar os Eng. de Suprimentos no desenvolvimento e gestão de fornecedores de insumos, na análise de mercado e no processo de aquisição. Apoiar as rotinas de gestão de energéticos (energia elétrica, gás natural, diesel e combustíveis sólidos) para atender às demandas da área Operacional das unidades de mineração e pelotização. Apoiar, por fim, nas tomadas de decisão da equipe por meio do desenvolvimento de dashboards e análises avançadas no Power BI
Idiomas
:
Inglês - Nível Básico
Outros requisitos
: 
1.	Suportar o planejamento e controle dos estoques de insumos e materiais operacionais, contribuindo para o equilíbrio entre custos e demandas.
2.	Apoiar na análise de fornecedores quanto à capacidade de fornecimento e precificação, colaborando na preparação de processos concorrenciais.
3.	Dar suporte às negociações de compras de insumos, assegurando condições comerciais alinhadas às políticas da empresa.
4.	Colaborar no desenvolvimento de fornecedores e insumos alternativos, promovendo competitividade e redução de custos operacionais.
5.	ESPECÍFICO ENERGIA: Apoiar nas aquisições de energéticos, analisando aspectos técnicos e estratégicos para otimizar o custo-benefício das fontes.
6.	Auxiliar, sob orientação, na elaboração de escopos técnicos para contratação de energia elétrica, reunindo informações necessárias ao processo.
7.	Coletar informações de fornecedores para análises técnicas, fiscais e de compliance, repassando às áreas competentes.
8.	Apoiar no levantamento de tendências de mercado e projeções de preços, contribuindo com análises para decisões orçamentárias.
9.	Apoiar a análise da carteira de insumos no mercado e suas alternativas, em conjunto com a área de Operações, considerando desempenho técnico e custo para embasar negociações e ações corretivas.
10.	Realizar pesquisas de mercado para identificar e sugerir novos fornecedores que tragam competitividade e redução de custos, mantendo a qualidade dos produtos atuais.
11.	Planejar e executar atividades da função com o suporte de profissionais mais experientes ou do gestor imediato, visando a execução adequada e solução de eventuais problemas.
12.	Executar a implantação de planos de trabalho e procedimentos, acompanhando tecnicamente as ações para garantir o cumprimento das metas.
13.	Desenvolver e manter dashboards em Power BI voltados para o monitoramento de consumo, custo unitário, performance contratual e projeções de demanda. Automatizar rotinas de extração, tratamento e visualização de dados energéticos a partir de múltiplas fontes (ERP SAP, planilhas e bancos de dados).
 
Informações Complementares	
 
•	Usar adequadamente os EPI’s (Equipamentos de Proteção Individual), para preservar a sua integridade física, bem como cumprir as normas de segurança e saúde.
•	Atentar para condições inseguras ou descumprimento de regras de segurança por colegas e terceiros, alertando para sua adequação.
•	Se recusar ao exercício de atividades que represente risco à sua segurança e para a qual não tenha sido devidamente treinado(a).
•	Paralisar atividades realizadas por terceiros que não cumpram as premissas de segurança e ambientais da empresa, alertando o responsável para as providências necessárias.
•	Cumprir as normas e procedimentos relativos à gestão ambiental, zelando pelas condições de higiene e organização no ambiente de trabalho praticando o 5S.
•	Zelar pela própria saúde, realizando todos os exames ocupacionais estabelecidos nos prazos programados.
•	Assegurar a conduta ética nos relacionamentos internos e com parceiros do negócio, bem como o cumprimento das políticas de Compliance, evitando conflitos de interesse e zelando pela confidencialidade de informações, pelos interesses comuns e reputação da Empresa.
•	Participar regularmente das atividades de segurança programados.
_____________________________________________________________________________
HABILIDADES E CONHECIMENTOS:
•	Ver legenda específica para os níveis de conhecimento.
•	As habilidades de escopo interno não são pré-requisito de admissão podendo ser desenvolvidas após admissão. 
•	As habilidades poderão ser certificadas através de registros de treinamentos específicos, pela avaliação do gestor em relação à aprendizagem, equipamentos ou execução dos processos específicos da área (acompanhado e orientado por profissional experiente), testes de conhecimento, experiência anterior (currículo) ou formação acadêmica.
Formação	
Ensino superior completo ou graduação tecnológica
Engenharias
Administração 
Comércio Exterior
Habilidades e Conhecimentos	
 
Matriz de treinamento de Segurança-Conforme indicado documento
Processo de Governança Corporativa-Compreensão	
Negociação- Aplicação (básico)	
MRP-Aplicação (básico)	
SAP-Aplicação (básico)	
Negociação- Aplicação (básico)	
Planejamento-Aplicação (Intermediário)	
Gestão de estoques-Aplicação (Intermediário)	
Formação de preços-Aplicação (Intermediário)	
Pacote Office-Aplicação (avançado)
 
Power BI-Aplicação (avançado)
 
 
 
 
 
 
 
 
 
 
 
 
 
 
 
 
 
 
 
 
 
 
 
 
 
 
 
 
 
 
 
 
 
 
 
 
 
 
 
 
 
 
 
 
 
 
 
 
 
 
 
 
 
 
 
 
 
 
 
 
 
 
 
 
 
 
 
 
 
 
 
 
 
 
 
 
 
 
 
 
 
 
 
 
 
 
 
 
 
 
 
 
 
 
 
 
 
 
 
 
 
 
 
 
 
 
 
 
 
 
 
 
 
 
 
 
 
 
 
 
 
 
 
 
 
 
 
 
Pro",Vagas.com
