titulo,empresa,localizacao,uf,descricao,fonte
Analista Planejamento Financeiro Sênior,Confidencial,Santo André / SP                                       A empresa aceita candidaturas de Santo André e cidades próximas,SP,"Descrição
: 
Estamos em busca de um Analista de Planejamento Financeiro para se juntar à nossa equipe para atuar na análise, acompanhamento e execução das atividades de controladoria, incluindo orçamento, análise financeira, gestão de indicadores, controles internos e conformidade, com foco em apoiar a tomada de decisão e contribuir para a sustentabilidade financeira da empresa.
Se você é uma pessoa analítica, proativa e com habilidades em análise de dados financeiros, essa vaga é para você!
Responsabilidades:
• Participar da elaboração e acompanhamento do orçamento anual da empresa;
• Analisar indicadores de gestão, sugerindo melhorias e ações corretivas;
• Apoiar a implementação e manutenção de controles internos e compliance;
• Executar e acompanhar o fechamento mensal contábil junto ao time de controladoria;
• Identificar e avaliar riscos operacionais, propondo estratégias de mitigação;
• Participar de auditorias internas/externas, providenciando documentação e esclarecimentos;
• Colaborar no desenvolvimento de membros da equipe, compartilhando conhecimento técnico.
Requisitos:
• Formação superior em Ciências Contábeis, Administração, Economia ou áreas afins;
• Inglês avançado;
• Experiência comprovada em rotinas de controladoria e finanças (mínimo 5 anos na área – rentabilidade, controle de custos/despesas, inventário, relatórios gerenciais, etc.);
• Conhecimento avançado em sistemas ERP (SAP, preferencial);
• Experiência com utilização de Excel (intermediário/avançado) e pacote Office;
• Habilidades de comunicação, resolução de problemas e atuação colaborativa.
Se você se identifica com o perfil e está em busca de novos desafios, candidate-se agora mesmo! Clique no botão ""Candidate-se"" e envie seu currículo.
Idiomas
:
Inglês - Nível Avançado
Outros requisitos
: 
• Visão operacional e analítica;
• Proatividade e foco em resultados;
• Perfil comunicativo e conciliador;
• Organização, atuação prática (hands-on) e atenção aos detalhes.",Vagas.com
Analista de Segurança da Informação II,Grupo Fleury,N/A,N/A,"Descrição
: 
Quais são os desafios da área e do cargo: 
Atuar de forma estratégica na estruturação, manutenção e evolução da governança de Segurançada Informação, garantindo aderência a normas, regulamentações e políticas internas.
Sobre a área: 
A área de Segurança da Informação é responsável por proteger os dados e sistemas de uma organização contra acessos não autorizados, vazamentos, ataques cibernéticos e qualquer tipo de ameaça que possa comprometer a integridade das informações.
Seu foco principal está em garantir três pilares essenciais: confidencialidade (acesso apenas por pessoas autorizadas), integridade (dados corretos e não alterados indevidamente) e disponibilidade (informações acessíveis sempre que necessário). Para isso, envolve práticas como gestão de riscos, implementação de controles de segurança, monitoramento de incidentes, conformidade com normas e conscientização dos usuários.
Essa área atua de forma estratégica para proteger ativos digitais, assegurar a continuidade dos negócios e garantir a confiança de clientes e parceiros.
Principais atividades: 


Analisar e tratar incidentes de segurança de baixa e média complexidade


Executar e acompanhar análises de vulnerabilidades e planos de ação


Apoiar auditorias e garantir conformidade com normas e políticas


Apoiar tecnicamente analistas juniores e disseminar boas práticas


Atuar na melhoria contínua dos controles de segurança


Atuação analítica e operacional, com participação ativa em investigações, melhoria de controles, tuning de alertas e apoio técnico a analistas juniores.


Buscamos alguém que apresente: 


Ensino superior completo em TI ou áreas correlatas


Experiência comprovada em Segurança da Informação ou áreas correlatas


Conhecimentos: ISO 27001, NIST, LGPD, redes, sistemas, ferramentas de Segurança e Governançade TI/SI.


Ferramentas e Tecnologias
SIEM, EDR/XDR, IAM, DLP, soluções de e-mail security, ambientes on-premises e cloud, Governança de TI/SI.
Antes da inscrição na vaga, é importante verificar se você atende aos requisitos e se conecta com nosso propósito.
Informações da vaga:
Modelo de Trabalho (Home Office)
Carga Horária: 220h
Escala: Segunda á sexta - feira
Horário de Trabalho: 08h00 ás 17h00
Nossa essência inspira o dia a dia, por isso, buscamos pessoas apaixonadas pelo que fazem, e que:
•	Estimulem um ambiente de troca de conhecimentos, compartilhando experiências, possibilitando a interdependência entre os times;
•	Estejam em constante movimento, investindo em autodesenvolvimento e atuando como facilitadora no desenvolvimento das outras pessoas;
•	Busquem consciência social de diversidade e inclusão, cooperando com a construção de um ambiente colaborativo;
•	Identifiquem e antecipem as necessidades dos clientes, agindo prontamente para encontrar soluções adequadas e personalizadas;
•	Planejem e executem o trabalho com excelência a fim de atingir os resultados esperados, com a visão de inovação e agilidade;
•	Gerem e implementem novas ideias, buscando constantemente por melhorias para a experimentação de novas abordagens e a adaptação às mudanças do mercado.
Cuidamos de você em cada etapa da sua jornada! 
Ajustar os benefícios conforme vaga/localidade e apague esse trecho antes de publicar a vaga.
Saúde e Bem-estar:


Assistência médica e odontológica para você e sua família;


Ambulatório com clínica médica ou atendimento por telemedicina;


Linhas de cuidado especializadas: gestantes, adoção, obesidade, oncologia, entre outras;


Acesso à plataforma OrienteMe para sessões de terapia e orientação nutricional;


Licença maternidade e paternidade estendidas;


Acesso ao Wellhub para práticas esportivas e qualidade de vida.


Proteção e estabilidade:


Previdência privada;


Participação nos lucros;


Seguro de vida.


Facilidades para o dia a dia:


Vale-Alimentação;


Vale-Refeição;


Vale-Transporte;


Auxílio-Creche;


Clube de Descontos com lojas, farmácias, viagem, beleza, cultura, lazer, entre outros serviços.


Desenvolvimento e educação:


Plataforma de ensino;


Parcerias educacionais com descontos em cursos e instituições.


Aqui, o cuidado vai além dos benefícios — ele está presente em cada momento da sua trajetória.
Promovemos uma cultura inclusiva, focada na equidade e na valorização das diferenças. 
Nossas vagas são abertas para todos os públicos e, simbolizando a nossa intencionalidade, oferecemos oportunidades afirmativas.
Nosso compromisso vai além do cumprimento das legislações que incentivam a diversidade e inclusão. 
Trabalhamos ativamente para ampliar a representatividade de nossas pessoas, pensando em raça, etnia, gênero, gerações, pessoas com deficiência e LGBTQIAPN+
 em nosso time, além de fortalecer a representatividade de mulheres negras, indígenas, chefes de família.
Para conhecer mais sobre o Grupo Fleury, acesse o site: 
https://carreiras.grupofleury.com.br/ 
O Grupo Fleury informa que a participação em seus processos seletivos é gratuita e nenhuma empresa terceira está autorizada a cobrar valores para a candidatura às vagas, ao treinamento, ao material didático ou qualquer outra despesa relacionada.",Vagas.com
Analista Suporte Operação I,Grupo SERES,São Fidélis / RJ                                       A empresa aceita candidaturas de São Fidélis e cidades próximas,RJ,"Descrição
: 
O Grupo Seres, em parceria com empresa nacional do segmento de Saneamento, seleciona profissional para atuar na função de Analista Suporte Operação I. 
Atividades:
Apoiar a área de operações realizando análise de indicadores e metas contratuais, efetuando 
compras e controle de produtos químicos, realizando controle e lançamentos de medições de energia, também será responsável por monitorar a qualidade da água e esgoto, elaborar relatórios, analisar dados e apoiar melhorias operacionais.
Responsabilidades do cargo:
Auxiliar na avaliação dos resultados da qualidade da água produzida e do esgoto 
tratado através de relatórios e sistemas de controle operacional;
Apoiar no planejamento de ações necessárias para desenvolver a modelagem 
hidráulica do sistema de abastecimento, com intuito de reduzir pressões na rede e o 
volume perdido através de vazamentos;
 Dar suporte na verificação da execução dos serviços do setor operacional, verificando a evolução e eficiência dos controles estabelecidos;
? Apoiar na elaboração e análise dos indicadores da área, identificando necessidades de melhorias operacionais;
 Emitir relatórios de qualidade para órgãos fiscalizadores;
 Controlar contratos e medições de prestadores de serviços;
 Manter controles e relatórios analíticos, através de planos de ação e indicadores, 
avaliando os resultados, propondo melhorias e correções.
Horário de trabalho:
Horário: 08:00 AS 18:00 SEG A QUI E AS SEX 08:00 AS 17:00 C/ 1H INTERV REFEICAO
Modelo: Presencial
Local de trabalho:
PHILOTEIA P BRAGANCA, 48 - São Vicente de Paulo, São Fidélis - RJ, 28400-000
Requisitos:
Ensino superior completo em Engenharia de Produção, Química, Engenharia Ambiental 
e áreas correlatas;
 Conhecimento intermediário em Pacote Office e Power BI;
 
Desejável:
CNH B - definitiva
Benefícios:
- Seguro a faturar para o Cliente
- Seguro Colaborador Padrão
- Vale Transporte
Incentivamos candidaturas PCD, população negra, mulheres, LGBTQIAPN+.",Vagas.com
Analista Sistemas Pleno (SAP),Grupo Profarma | Rede d1000,Rio de Janeiro / RJ                                       A empresa aceita apenas candidaturas de Rio de Janeiro,RJ,"Descrição
: 
O PROPÓSITO DO GRUPO PROFARMA É ENTREGAR SAÚDE!
No Grupo Profarma, a cultura é viva e inspira a forma como a gente trabalha e se relaciona todos os dias.
Aqui, valorizamos quem é inconformado por natureza, faz acontecer, busca soluções criativas e está sempre em movimento para fazer melhor e encantar parceiros e clientes.
Se você se identifica com esse jeito de ser, confira a oportunidade abaixo e faça parte desse time!
Estamos em busca de um(a) 
Analista Sistemas Pleno (SAP)
 para atuar de 
forma híbrida na Barra da Tijuca/RJ.
Atividades; 


Traduzir demandas de negócio em especificações funcionais claras e detalhadas, apoiando o time de desenvolvimento e funcional.


Elaborar e manter a documentação de requisitos, fluxos de processos e soluções, garantindo rastreabilidade e suporte a auditorias.


Planejar e executar testes funcionais e integrados, validando cenários e garantindo a qualidade das entregas.


Atuar na validação de integrações e novas funcionalidades, assegurando que não impactem processos existentes.


Participar de reuniões de refinamento, sugerindo melhorias contínuas nos processos e no uso do ERP SAP.


Acompanhar implementações, homologações e interações com usuários-chave e time técnico.


Avaliar impactos de mudanças sistêmicas, apoiando a gestão de mudanças e comunicação com stakeholders.


Apoiar treinamentos e garantir a correta adoção das soluções implementadas.


Requisitos; 


Ensino superior completo: Análise e Desenvolvimento de Sistemas; Ciência da Computação ;Engenharia da Computação; Engenharia de Software ou áreas correlatas.


Experiência com ERP SAP, preferencialmente nos módulos FI, MM e/ou SD.


Conhecimentos técnicos; 
Pacote Office (Excel, PowerPoint, Word) – domínio
Análise e desenvolvimento de sistemas – domínio
SAP (módulos como FI, MM, SD) – domínio
Banco de dados – conhecimento
Node.js / Nest.js – conhecimento desejável
A diversidade e a inclusão são fundamentais para o nosso crescimento, por isso, todas as nossas vagas são afirmativas para PCDs e grupos minorizados. Acreditamos que, ao valorizar a diferença, criamos um ambiente mais inovador e colaborativo.
Idiomas
:
Inglês - Nível Intermediário",Vagas.com
Analista de Recrutamento e Seleção Sênior - 113969,Confidencial,São Gonçalo do Amarante / CE                                       A empresa aceita candidaturas de São Gonçalo do Amarante e cidades próximas,CE,"Descrição
: 
Esta vaga também é destinada a Pessoas com Deficiência (PCD). Valorizamos a diversidade e incentivamos a candidatura de profissionais de todos os perfil.
• Contribuir para o crescimento da região LATAM encontrando e garantindo talentos de serviços de campo altamente qualificados.
• Desenvolver e aprimorar nossos processos de contratação, utilizando ferramentas inovadoras e melhores práticas para atrair os melhores candidatos.
• Gerenciar todo o ciclo de recrutamento para cargos de serviços, garantindo uma experiência fluida e engajadora para o candidato.
• Colaborar com RH e liderança para criar estratégias de recrutamento que estejam alinhadas aos objetivos do negócio.
• Recrutar com sucesso para diversas posições de serviços, incluindo Técnicos de Serviços de Campo Elétrico e Térmico, Engenheiros de Comissionamento Elétrico e Mecânico e Gerentes de Centro de Serviços.
• Compartilhar insights e conhecimentos com a equipe de Talent Acquisition para promover um ambiente de recrutamento colaborativo e eficiente.
• Incentivar novas ideias e melhorias nos processos para elevar a experiência do candidato e os resultados de recrutamento.
• Atuar com profissionalismo e senso de responsabilidade, reconhecendo o impacto do cargo no sucesso da organização.
• Ajudar a definir e implementar programas que apoiem nossos objetivos de aquisição de talentos, utilizando uma abordagem consultiva para atender às necessidades do negócio.
• Utilizar dados e métricas para orientar e aprimorar estratégias de recrutamento, impulsionando resultados e melhoria contínua. Inglês Avançado
No ManpowerGroup, a sua carreira tem um novo rumo! Se você está em busca de crescimento, desafios e um ambiente que valoriza o seu potencial, venha fazer parte do nosso time. Aqui, cada talento é reconhecido e valorizado.
Candidate-se agora e transforme seu futuro com a gente !
Outros requisitos
: 
Escolaridade mínima:
Graduação - Bacharel em Psicologia - Concluído;
Graduação - Bacharel em Recursos Humanos - Concluído;
Graduação - Administração de Empresas Bacharel em Administração de Empresas - Concluído.
Experiências e qualificações:
Experiência sólida em recrutamento de ciclo completo.
Experiência com recrutamento em grande volume, mantendo foco na qualidade e experiência do candidato.
Forte capacidade de gerenciar múltiplas prioridades e projetos em um ambiente dinâmico.
Diferencial: Espanhol",Vagas.com
Analista de Produto e Pricing (Pleno) - 114395,Confidencial,Hortolândia / SP                                       A empresa aceita candidaturas de Hortolândia e cidades próximas,SP,"Descrição
: 
Esta vaga também é destinada a Pessoas com Deficiência (PCD). Valorizamos a diversidade e incentivamos a candidatura de profissionais de todos os perfil.
Gerenciar e manter o cadastro mestre de produtos, incluindo especificações técnicas, códigos, opcionais, acessórios, peças de reposição e serviços;
Garantir a consistência das informações de produtos em catálogos, propostas, site e sistemas internos (Microsoft 365, SharePoint e Lists);
Traduzir e adaptar informações técnicas de fornecedores internacionais (manuais e datasheets em inglês) para uso comercial;
Estruturar e atualizar a precificação dos produtos, considerando custos, importação, tributação, câmbio, margens e posicionamento de mercado;
Manter tabelas de preços de venda e locação, apoiando propostas comerciais, licitações e análises de viabilidade;
Monitorar preços e posicionamento de concorrentes nacionais e internacionais;
Elaborar e atualizar catálogos, fichas técnicas, apresentações e materiais comerciais;
Apoiar o marketing com informações técnicas para campanhas, site e redes sociais;
Contribuir para a melhoria contínua dos processos, apoiando iniciativas de automação, inteligência artificial e documentação das regras de negócio.
No ManpowerGroup, a sua carreira tem um novo rumo! Se você está em busca de crescimento, desafios e um ambiente que valoriza o seu potencial, venha fazer parte do nosso time. Aqui, cada talento é reconhecido e valorizado.
Candidate-se agora e transforme seu futuro com a gente !
Outros requisitos
: 
Formação superior completa em Engenharia (Mecânica, Produção, Química ou correlatas) ou Administração com sólida vivência técnica em indústria;
Experiência em áreas de produto, pricing, inteligência comercial, engenharia de aplicação ou proposta técnica em empresas industriais, de bens de capital ou distribuição técnica;
Excel avançado (procuras, tabelas dinâmicas, modelagem de custos e cenários);
Inglês técnico de leitura (Intermediário-Avançado);
Excelente redação em português (produção de catálogos, fichas técnicas e documentação);
Desejáveis (diferenciais):
Conhecimento de tributação aplicada a precificação (regime de Lucro Real, impostos sobre venda e importação);
Experiência com processos de importação e custos de nacionalização;
Power BI ou outra ferramenta de análise de dados;
Familiaridade com o setor de gases, ar comprimido, equipamentos hospitalares ou normas técnicas (ABNT, ISO);
Vivência com Microsoft 365 (SharePoint, Lists, Teams, Power Automate);
Espanhol intermediário.",Vagas.com
Analista PCP Porto Jr,Porto Sudeste Brasil,Itaguaí / RJ                                       A empresa aceita candidaturas de qualquer cidade do Brasil,RJ,"Descrição
: 
Estamos em busca de um Analista de PCP Jr para integrar nossa equipe em Porto. O profissional será responsável por auxiliar no planejamento e controle da produção, garantindo o cumprimento dos prazos e metas estabelecidos. 


Analisar a capacidade operacional do terminal (estocagem, ferroviária e marítima), considerando restrições operacionais e planejamento de manutenções preventivas;


Planejar operações portuárias por meio da avaliação de cenários operacionais e identificação de gargalos de capacidade;


Analisar a formação de estoques de minério, garantindo atendimento às especificações de qualidade para embarque;


Realizar e acompanhar o inventário de granéis sólidos, analisando desvios entre estoque físico e sistêmico e propondo ações corretivas;


Analisar variações de pesagem entre origem e destino, identificando causas e comunicando às áreas envolvidas;


Garantir o cumprimento do embarque contábil de cargas próprias, assegurando alinhamento entre operação e registros sistêmicos;


Analisar o planejamento de manutenções preventivas (mensal e trimestral), identificando impactos na operação e propondo alternativas para mitigação de riscos;


Analisar a qualidade prevista dos navios e sobras de embarque, realizando ajustes na formação de carga, quando necessário;


Realizar cálculos de laytimes e analisar os motivos de demurrage em operações de navios próprios, contribuindo para identificação de oportunidades de melhoria;


Analisar e controlar documentações das operações de embarque e desembarque, para fins de atendimento de requisitos do recinto alfandegado, na interação de diversos órgãos anuentes;


Apoiar o monitoramento da execução operacional, sinalizando desvios em relação ao planejado;


Interagir com demais áreas do terminal, relacionadas ao planejamento, garantindo alinhamento de informações;


Utilizar e alimentar sistema de gestão operacional, assegurando consistência dos dados para análise;


Divulgar planejamento de curto e médio prazo;


Atualizar controle de orçamento de volume de operações do terminal;


Atuar no planejamento atendendo cláusulas contratuais e interagindo com clientes;


Dar suporte ao Coordenador de PCP para tomadas de decisões.


Incentivamos a participação de Mulheres e PCDs.
Se você se encaixa nesse perfil, candidate-se agora mesmo!
Outros requisitos
: 


Bacharelado em Administração, Comércio Exterior, Engenharia Química, Produção, Civil ou afins, Logística;


CNH (categoria B);


Pacote Office Intermediário;


Utilização de ERP;


Língua inglesa (desejável);


Vivência com documentações de embarque e desembarque, e relação com agência marítima.",Vagas.com
Analista de Suporte de T.i,Ribeiro Caram,São Paulo / SP                                       A empresa aceita candidaturas de São Paulo e cidades próximas,SP,"Descrição
: 
O Grupo 
Ribeiro Caram
 é referência no mercado da construção civil, com atuação em projetos de galpões logísticos, indústrias, shopping centers e data centers em todo o Brasil. Oferecemos um ambiente que valoriza pessoas, desenvolvimento e resultados.
Se você gosta de desafios, tem perfil de obra e quer crescer junto com uma empresa em expansão, vem com a gente.
Estamos em busca de um(a) Analista de Suporte de TI para atuar no suporte técnico aos sistemas da organização, garantindo o pleno funcionamento das operações tecnológicas. Este(a) profissional será responsável por atender usuários, resolver incidentes e contribuir para a segurança e eficiência da infraestrutura de TI.
Principais Atividades


Gerenciar problemas e incidentes de TI, identificando, solucionando e acompanhando ocorrências como falhas em e-mail, indisponibilidade de rede e ameaças de segurança (vírus, invasões, etc.).


Realizar manutenção preventiva e corretiva em sistemas e equipamentos.


Executar atualizações de segurança e backups periódicos, garantindo a integridade e recuperação dos dados.


Prestar suporte técnico aos usuários, tanto remoto quanto presencial, orientando sobre o uso de sistemas e ferramentas.


Atuar na implementação e manutenção de práticas de segurança da informação, protegendo bancos de dados e sistemas contra ameaças.


Cumprir e promover as diretrizes de Segurança, Saúde Ocupacional (SSO) e participar de treinamentos obrigatórios.


Atuar conforme políticas de compliance, prevenindo riscos, fraudes e fortalecendo a cultura de controles internos.


Requisitos


Ensino superior completo em Ciência da Computação, Engenharia da Computação, Sistemas de Informação ou áreas correlatas.


Mínimo de 3 anos de experiência na área de TI.


Desejável experiência de pelo menos 1 ano no segmento de atuação da empresa.


Conhecimentos Técnicos


Conhecimento avançado em sistemas operacionais, redes e protocolos de comunicação.


Experiência com Windows Server e Active Directory.


Domínio em Microsoft 365 (uso e administração).


Forte habilidade em resolução de problemas técnicos.


Outros requisitos
: 
Contratação CLT
•	Vale Refeição ou Vale Alimentação;
•	Vale Transporte / Auxílio Combustível;
•	Convênio Médico;
•	Convênio Odontológico;
•	Seguro de Vida;
•	TotalPass;
•	Conexa Saúde (atendimento psicológico online, disponível conforme adesão e plano do TotalPass);
•	PLR - Participação nos Lucros e Resultados de acordo com os resultados do grupo e metas;
•	Programa Bolsa de Estudos de acordo com procedimento interno;
•	Ambiente colaborativo e oportunidades de desenvolvimento profissional.
Local de atuação:
•	Vila Hamburguesa / SP.
Interessados podem se candidatar pela plataforma ou enviar currículo para:
recrutamento@ribeirocaram.com.br
(Assunto: nome da vaga)",Vagas.com
