titulo,empresa,localizacao,uf,descricao,fonte
Analista de Educacao Continuada II,Ânima,N/A,N/A,"Descrição
: 
Seja um educador ou educadora no Ecossistema Ânima e venha transformar o país pela educação. 
ANALISTA DE EDUCACAO CONTINUADA II - ANIMA HOLDING
Essa posição é para atuar na 
Ânima
, o maior e o mais inovador ecossistema de ensino de qualidade do país, com instituições espalhadas por todo o Brasil. Somos uma empresa em constante evolução, que enxerga em cada detalhe novas formas de promover a educação. Por sinal, essa é a essência que nos faz ser diferentes.
Ah! Independente de cor, idade, gênero, orientação sexual, origem, religião ou qualquer outra característica, ou particularidade que tenha, se você tem desejo e energia para contribuir para a transformação de vidas por meio da Educação, aqui é o seu lugar!
Confira mais sobre a nossa oportunidade.
Do que você precisa para concorrer à vaga:
•	Graduação completa em Administração, Marketing, Economia ou áreas correlatas
•	Experiência prévia com análise de portfólio, pesquisa de mercado e indicadores de performance, preferencialmente no setor educacional;
•	Vivência com análises quantitativas (taxa de matrícula, evasão, NPS) e elaboração de dashboards.
•	Perfil comportamental com boa comunicação, relacionamento interpessoal e capacidade de colaboração entre áreas. Organização, atenção aos detalhes e habilidade para gerenciar prazos e entregas;
Como será seu dia a dia como educador ou educadora: 
•	Apoiar na coleta, consolidação e análise de dados de desempenho de cursos, programas e serviços da Ânima;
•	Elaborar relatórios e dashboards de performance, com foco em indicadores-chave como matrícula, evasão e NPS;
•	Contribuir com pesquisas de mercado e estudos de concorrência, auxiliando na tabulação, análise e geração de insights;
•	Monitorar tendências educacionais e produzir resumos estratégicos para apoio à tomada de decisão;
•	Colaborar com as áreas de marketing, vendas e produto na execução de campanhas e ações de melhoria;
•	Participar de reuniões de acompanhamento, registrando insights, resultados e encaminhamentos;
Apoiar projetos e iniciativas voltados à educação continuada, garantindo padronização e consistência nas entregas.
Conhecimentos necessários para essa posição
•	Domínio do pacote Office (especialmente Excel e PowerPoint) e conhecimentos em Power BI.
•	Conhecimento em técnicas de pesquisa de mercado, coleta e organização de dados;
Modalidade de atuação e horário de trabalho: 
•	Remoto - de segunda a sexta, das 8h30 às 18h30, com 1h12 de intervalo.
Veja o que já vai encontrar no nosso Ecossistema Ânima
•	Bolsas de Estudos
•	Indicação de 2 Bolsas de Estudos para quem preferir
•	Programa de Bem-estar e Qualidade de Vida
•	Wellhub
•	ECOA – Escola Corporativa Ânima, com + de 100 cursos livres e gratuitos
•	Day-off no aniversário
•	Abono de meio-período no aniversário do(a) filho(a) com até 16 anos
•	Programa Valor das Pessoas: vale-presente para os educadores em fases marcantes de suas vidas, como casamento, nascimento e até mesmo uma nova titulação.
Fique atento às etapas do processo seletivo, que acontece de forma 100% remota:
1. Análise dos currículos;
2. Avaliação técnica;
3. Entrevista com nosso time de Recrutamento e Seleção;
4. Entrevista com a liderança
Boa sorte!
#SejaÂnima",Vagas.com
Analista Social Media - Pl/Sr,Morar-EUA by SG Global Group,São Paulo / SP                                       A empresa aceita candidaturas de São Paulo e cidades próximas,SP,"Descrição
: 
Descrição
Estamos em busca de um(a) Social Media Pl/Sênior apaixonado(a) por conteúdo, estratégia e redes sociais. A pessoa ideal para essa vaga é proativa, criativa, analítica e tem domínio completo sobre como transformar redes sociais em canais poderosos de posicionamento, relacionamento e conversão.
Requerimentos


Mínimo de 4 a 5 anos de experiência com social media em ritmo acelerado (agência, startups ou empresas com volume alto de conteúdo);




Domínio das principais redes sociais e profundo conhecimento das melhores práticas de cada uma;




Escrita criativa e estratégica com foco em performance;




Heavy user de redes sociais: antenado(a) em trends, memes, comportamento digital e influenciadores;




Capacidade de atuar com autonomia, pensar estrategicamente e executar com agilidade;




Conhecimento intermediário em RD Station: envio de mensagens, segmentações e fluxos de automação;




Vivência em atendimento nas redes com foco em construção de relacionamento e conversão.


Responsabilidades
-Liderar a estratégia de conteúdo para redes sociais com foco em crescimento, reputação e conversão;
-Criar e executar planos de comunicação digital baseados em dados, tendências e comportamento do público;
-Desenvolver briefings criativos e supervisionar entregas em colaboração com designers, redatores, audiovisual e mídia paga;
-Produzir e revisar roteiros, copys e conteúdos multiplataforma (Instagram, LinkedIn, TikTok, X, YouTube, etc.);
-Realizar e apresentar relatórios executivos com análise de métricas e sugestões de otimização;
-Garantir o tom de voz da marca, consistência e alinhamento com os objetivos do negócio;
-Monitorar canais sociais e KPIs (orgânico e pago), propondo ações para maximizar resultados;
-Participar de brainstorms e liderar reuniões com áreas como Growth, Comercial, Branding e Eventos;
-Identificar oportunidades de inovação e diferenciação da marca nas redes sociais;
-Apoiar profissionais de social mais juniores e conduzir treinamentos internos;
-Responder DMs, comentários e menções com foco em engajamento, relacionamento e conversão de leads, com tom de voz alinhado à marca.
-Gravação de vídeos com celular (mobile), utilizando gimbal/estabilizador;
-Captação e edição de fotografias com olhar estético e alinhado à identidade da marca;
-Cobertura de eventos em tempo real (stories, posts, reels, entrevistas etc.);
-Operação de transmissões ao vivo em plataformas como StreamYard, OBS e similares;
-Envolvimento em todas as etapas do conteúdo: da ideia à publicação e análise de resultado.
-Extração de dados via analytics das plataformas sociais ou ferramentas como MLabs, Meta Business Suite, etc.;
-Relatórios semanais/mensais com insights e recomendações;
-Conhecimento de métricas: alcance, impressões, engajamento, CTR, retenção, entre outras.
Outros requisitos
: 
Diferenciais


Edição de vídeos intermediária/avançada (CapCut, Premiere ou After Effects);




Design intermediário/avançado em Photoshop ou Canva Pro;




Noções de social listening e monitoramento de marca;




Vivência com squads ou times multidisciplinares;




Inglês intermediário (para pesquisa de benchmarks, referências e ferramentas).",Vagas.com
Analista de Métodos e Processos Pl,Confidencial,Manaus / AM                                       A empresa aceita apenas candidaturas de Manaus,AM,"Descrição
: 
PRINCIPAIS ATIVIDADES
Acompanhar o processo produtivo nas linhas de montagem da produção por meio de observação direta e registros operacionais;
•	Prestar suporte nas atividades de análise da qualidade por meio da verificação de produtos e processos, visando assegurar o cumprimento dos requisitos técnicos e normativos.
•	Acompanhar o processo produtivo nas linhas de montagem , realizando balanceamento, tomada de tempo e monitoramento das máquinas de solda e revisão final, para otimizar a eficiência e reduzir falhas.
•	Atualizar e elaborar folhas de processo e demais processos periféricos por meio da coleta de dados e padronização de procedimentos, com o intuito de garantir clareza e rastreabilidade operacional.
•	Acompanhar retrabalhos por meio da análise das causas e execução das correções, para assegurar a recuperação adequada dos produtos e minimizar perdas.
•	Prestar suporte nas áreas de embalagem, reparo técnico e qualidade por meio de apoio operacional e validação de processos, com o objetivo de contribuir para a integridade final dos produtos.
EXPECTATIVAS SOBRE SEU PERFIL


Ensino Superior Completo (Graduação em Engenharias: da Produção, Elétrica, Eletrônica ou correlatas) 


Inglês Intermediário


Excel Intermediário


PowerPoint Intermediário


Conhecimento em ERP Datasul


Noções em Power BI


O QUE OFERECEMOS


Vale Alimentação;


Refeitório Interno;


Plano Odontológico;


Plano Médico;


Wellhub;


Seguro de Vida;


LOCAL DE TRABALHO
Manaus",Vagas.com
Analista de RH Pl,Confidencial,Goiânia / GO                                       A empresa aceita candidaturas de Goiânia e cidades próximas,GO,"Descrição
: 
Analista de RH Pleno – Atração e Seleção
Ramo de atuação: Saúde
Principais atividades:
Realizar todas as etapas dos processos seletivos interno e externo de baixa e média complexidade das áreas corporativas e operações da empresa, através de técnicas e ferramentas de Atração e Seleção garantindo o encaminhamento de candidatos em alinhamento ao perfil solicitado pelas áreas demandantes;
Fortalecer o relacionamento com cliente interno através de Briefing e Follow up;
Aplicação de ferramentas de assessments e elaboração de parecer que registrem a análise de competências e subsidiem o processo de tomada de decisão;
Atualizar as ferramentas de gestão de vagas, garantindo a precisão dos status e informações, para facilitar a compilação de dados e a geração de indicadores;
Fornecer retorno as pessoas participantes dos processos seletivos com objetivos de gerar oportunidades de desenvolvimento e garantir uma melhor experiência;
Construir conexões com áreas parceiras, por meio de uma comunicação fluida garantindo eficiência, agilidade e uma visão integrada dos processos;
Entre outras...
Modelo de trabalho: Híbrido
Local de trabalho: Goiânia - GO
Carga horária mensal: 220 horas
Horário: 08h00 às 18h00 (segunda a sexta-feira)
Requisitos:
Curso superior completo em Psicologia, Gestão de RH, Administração e afins
Remuneração compatível com o mercado e benefícios para o titular e dependente.",Vagas.com
Analista Administrativo Pl - Balança,bp bioenergy,Itumbiara / GO                                       A empresa aceita candidaturas de qualquer cidade do Brasil,GO,"Descrição
: 
Descrição das Responsabilidades:
Estamos em busca de um(a) Analista Administrativo(a) com sólida experiência em rotinas fiscais e contábeis, especialmente voltadas à operação de balança e controle de movimentações de entrada e saída de produtos. Essa posição é estratégica para garantir a conformidade tributária e a acuracidade das informações que alimentam nossos sistemas contábeis e fiscais.
Responsabilidades:


Realizar o controle e conferência de pesagens na balança, garantindo a integridade dos dados registrados.


Atuar diretamente com o núcleo fiscal, apoiando na apuração de impostos, escrituração fiscal e obrigações acessórias.


Identificar e corrigir inconsistências contábeis e fiscais (malha fina), promovendo ajustes e melhorias nos processos.


Garantir o correto lançamento de notas fiscais e documentos contábeis.


Apoiar auditorias internas e externas, fornecendo informações e documentos pertinentes.


Trabalhar em parceria com áreas como logística, contabilidade e fiscal para garantir fluidez e conformidade nos processos.


Requisitos:


Formação em Administração, Ciências Contábeis ou áreas correlatas.


Experiência comprovada com balança, rotinas fiscais e contábeis.


Conhecimento em legislação tributária e obrigações acessórias.


Domínio de sistemas ERP e Excel avançado.


Atenção aos detalhes, proatividade e senso crítico.


Diferenciais:


Vivência com auditorias e processos de malha fina.


Conhecimento em SAP ou sistemas integrados similares.


Perfil analítico e voltado à melhoria contínua.


Outros requisitos
: sem comantarios",Vagas.com
Analista Comercial Interno Pl,Grupo Dislub Equador,Recife / PE                                       A empresa aceita candidaturas de Recife e cidades próximas,PE,"Descrição
: 
Estamos em busca de um Analista Comercial Interno Pleno para se juntar à nossa equipe. Se você é uma pessoa proativa, organizada e com habilidades de comunicação excepcionais, essa vaga é para você!
Principais Responsabilidades


Analisar o desempenho das lojas de conveniência, acompanhando indicadores de vendas, mix de produtos e rentabilidade;


Realizar estudos de mercado e benchmarking para identificar oportunidades de expansão e inovação;


Apoiar negociações e a gestão de fornecedores estratégicos, garantindo alinhamento de campanhas, precificação e promoções;


Preparar e consolidar materiais e relatórios de performance para reuniões do Conselho de Clientes;


Transformar dados em insights práticos para fortalecer o relacionamento com a rede de revendedores;


Mapear a jornada do cliente, propondo melhorias que aumentem engajamento e fidelização;


Contribuir na execução de projetos estratégicos que impactem diretamente a experiência e retenção de clientes finais.


Requisitos:


Desejável experiência prévia na área comercial, canais de distribuição ou projetos de experiência do cliente;


Boa comunicação verbal e escrita;


Habilidade para negociação;


Ensino Superior completo em Administração, Marketing, Economia, Engenharia ou áreas correlatas.


Se você se encaixa no perfil e deseja fazer parte de uma equipe dinâmica e inovadora, candidate-se agora mesmo!",Vagas.com
Analista Inteligência Mercado,bp bioenergy,São Paulo / SP                                       A empresa aceita candidaturas de qualquer cidade do Brasil,SP,"Descrição
: 
Principais Responsabilidades:


Realizar a coleta de dados, análise de informações internas e de mercado, criando inteligência nas recomendações de forma a suportar a tomada de decisão;


Interagir com demais áreas da empresa criando relacionamentos e redes internas de fluxo de informações necessárias para o desenvolvimento das atividades;


Construção e manutenção dos modelos de oferta e demanda, com sensibilidade a variáveis como clima, câmbio, preços internacionais e políticas regulatórias;


Aprofundar conhecimento do setor sucroenergético através do monitoramento do mercado, bem como seus drivers, players, tecnologias e melhores práticas e benchmarking;


Suportar o atendimento das demandas periódicas e ad hoc das áreas clientes, em assuntos que tenham sinergia com o escopo de inteligência atendendo aos interesses da empresa;


Assegurar que todas as suas atividades e comportamento atendam o Código de Conduta da empresa, além de estar em compliance com os procedimentos e normas da Cia.


Idiomas
:
Inglês - Nível Fluente
Outros requisitos
: 
Requisitos Necessários:


Ensino Superior Completo (Desejável Administração, Economia e/ou Engenharias);


Conhecimento em Analise de Mercado de comodities Agrícola, Construção de cenários e projeções e Modelagem Estatística;


Inglês Fluente;


Necessário experiência no segmento sucroenergético;


Pacote Office: Avançado;


Disponibilidade para atuar no escritório de São Paulo (Região Brooklin).


Desejável:
Habilidades com Phyton, R;",Vagas.com
Analista Administrativo Pleno - Comercial,Trasmontano Saúde,São Paulo / SP                                       A empresa aceita candidaturas de São Paulo e cidades próximas,SP,"Descrição
: 
PRINCIPAIS ATIVIDADES
1.	Monitorar tendências de mercado, realizar análises de concorrência e identificar oportunidades para o fortalecimento da atuação comercial da empresa;
2.	Analisar e interpretar dados de vendas, indicadores de desempenho e tendências setoriais, identificando oportunidades de crescimento e melhorias nos resultados;
3.	Prestar suporte operacional, administrativo e estratégico à equipe de vendas, abrangendo o processamento de pedidos, elaboração de relatórios, acompanhamento de metas, gestão de materiais de apoio e controle de indicadores;
4.	Elaborar relatórios de desempenho comercial e marketing, apresentando análises e recomendações sobre resultados, retorno sobre investimento, eficácia das estratégias implementadas;
5.	Apoiar na elaboração, revisão e acompanhamento de contratos comerciais com clientes, fornecedores e parceiros;
6.	Participar do planejamento e monitoramento do orçamento comercial, assegurando o uso eficiente dos recursos e o cumprimento das metas estabelecidas;
7.	Apoiar o relacionamento com clientes, contribuindo para a resolução de demandas, fornecimento de informações sobre produtos e serviços e promoção da satisfação do cliente, inclusive em eventos e treinamentos presenciais.
Todas as nossas posições podem ser afirmativas para a inclusão de mulheres, pessoas negras, profissionais com deficiência, pessoas LGBTQIAPN+ e pessoas 50+
Outros requisitos
: 
Ensino superior cursando em áreas da Comunicação, Marketing e Vendas.",Vagas.com
Analista de Tecnologia e Infraestrutura Sênior,Fundação São Francisco Xavier,Ipatinga / MG                                       A empresa aceita candidaturas de Ipatinga e cidades próximas,MG,"Descrição
: 
Gestão e Execução de Chamados


Gerir chamados complexos no sistema de gestão.


Cumprir metas e assegurar padrões operacionais e de segurança.


Análise e Proposta de Melhorias


Identificar alternativas tecnológicas.


Realizar estudos para aprimorar a infraestrutura e melhorar políticas e procedimentos.


Atualização de Ambiente Tecnológico


Conduzir correções e implantações de novas versões e releases.


Planejar e realizar manutenções programadas para assegurar a sustentação da infraestrutura.


Suporte Técnico Avançado


Oferecer suporte técnico para recursos complexos de TI.


Solucionar problemas e minimizar impactos de atendimento via acesso remoto e treinamentos.


Gestão de Contratos


Negociar, aditar contratos e garantir serviços contratados.


Autorizar pagamentos conforme estabelecido em contrato.


Implantação de Projetos


Orientar profissionais juniores em projetos.


Definir escopo, cronograma e ferramentas, monitorando resultados com indicadores.


Revisões Preventivas e Segurança da Informação. 
Dados da vaga: 
Ensino superior completo em Tecnologia Informação ou áreas correlatas.
Horário: 08h00 às 17h00
📍 Local: Vaga aberta para trabalho em nossos escritórios em Ipatinga e Belo Horizonte (MG), ou Cubatão e Santos (SP).
Inglês intermediário.
Conhecimento necessário:
 ISistema Operacional (Windows – Desktop: Windows 10 e 11 Enterprise; Windows Server – Server 2016, 2019 e Superior e Linux), Ambiente de Virtualização. Atualização de Patchs de servidores, sistema operacional e configurações gerais.",Vagas.com
Analista de Relacções com Investidores I,Ânima,São Paulo / SP                                       A empresa aceita candidaturas de qualquer cidade do Brasil,SP,"Descrição
: 
Seja um educador ou educadora no Ecossistema Ânima e venha transformar o país pela educação. 
Analista de Relações com Investidores I
Essa posição é para atuar no 
Ecossistema Ânima
. que faz parte do Ecossistema Ânima, o maior e o mais inovador ecossistema de ensino de qualidade do país, com instituições espalhadas por todo o Brasil. Somos uma empresa em constante evolução, que enxerga em cada detalhe novas formas de promover a educação. Por sinal, essa é a essência que nos faz ser diferentes.
Ah! Independente de cor, idade, gênero, orientação sexual, origem, religião ou qualquer outra característica, ou particularidade que tenha, se você tem desejo e energia para contribuir para a transformação de vidas por meio da Educação, aqui é o seu lugar!
Confira mais sobre a nossa oportunidade.
Do que você precisa para concorrer à vaga:


Formação superior completa em áreas correlatas (Administração, Economia, Finanças, Contabilidade ou Engenharia);


Experiência em modelagem financeira, valuation e análise de indicadores econômicos;


Vivência em ambiente corporativo de alta demanda, com foco em prazos, entregas e precisão técnica.


Perfil analítico, detalhista e orientado a resultados numéricos. Boa comunicação e clareza para traduzir análises financeiras em informações acessíveis a diferentes públicos;


Como será seu dia a dia como educador ou educadora: 


Apoiar nas atividades da área de Relações com Investidores (RI), assegurando conformidade com obrigações regulatórias e normativas da CVM;


Produzir e atualizar relatórios de performance financeira, operacionais e setoriais, consolidando dados internos e externos;


Analisar o desempenho das ações, acompanhar a base acionária e elaborar relatórios de evolução e tendências;


Contribuir na elaboração de modelos financeiros, projeções estratégicas e simulações de cenários;


Desenvolver apresentações corporativas e materiais de resultados trimestrais e anuais para investidores e analistas;


Apoiar a preparação de documentos e comunicações para órgãos reguladores, garantindo qualidade técnica e precisão numérica;


Acompanhar interações com investidores nacionais e internacionais, auxiliando em análises quantitativas e respostas técnicas.


Conhecimentos que são bacanas para essa posição: 


Domínio avançado de Excel (incluindo dashboards, projeções e análises) e PowerPoint para apresentações executivas;


Conhecimento em Contabilidade Corporativa e Finanças;


Capacidade de interpretar dados complexos e transformá-los em insights estratégicos;


Inglês fluente, com boa desenvoltura em leitura, escrita e conversação técnica.


Modalidade de atuação e horário de trabalho 
Híbrido - de segunda a sexta-feira, das 8h30 às 18h30, com 1h12 de intervalo.
Veja o que já vai encontrar no nosso Ecossistema Ânima


Bolsas de Estudos de até 100% de desconto.


Indicação de 2 Bolsas de Estudos para quem preferir


Vale Refeição ou Vale Alimentação.


Convênio Médico.


Convênio Odontológico.


Auxílio Home Office


Assistência Esportiva - Wellhub


Empréstimo Consignado.


Programa de Bem-estar e Qualidade de Vida


ECOA – Escola Corporativa Ânima, com + de 100 cursos livres e gratuitos


Day-off no aniversário


Abono de meio-período no aniversário do(a) filho(a) com até 16 anos


Programa Valor das Pessoas: vale-presente para os educadores em fases marcantes de suas vidas, como casamento, nascimento e até mesmo uma nova titulação.


Fique atento às etapas do processo seletivo, que acontece de forma 100% remota:


Análise dos currículos;


Avaliação técnica;


Entrevista com nosso time de Recrutamento e Seleção;


Entrevista com a liderança


Boa sorte!
#SejaÂnima",Vagas.com
Analista de Costumer Success,Woli Tecnologia,Araxá / MG                                       A empresa aceita candidaturas de qualquer cidade do Brasil,MG,"Descrição
: 
Venha fazer parte de uma das empresas de tecnologia e educação a distância que mais cresce no país!
Se você é apaixonado por relacionamento com clientes, operacionalização de projetos e soluções inovadoras, buscamos um Analista de Customer Success cheio de energia para se juntar ao nosso time.
Suas principais responsabilidades serão:
- Compreender o negócio do cliente, mantendo contato proativo e oferecendo soluções alinhadas à estratégia do parceiro;
- Atuar na gestão e execução de projetos, acompanhando entregas, prazos e indicadores de desempenho;
- Propor soluções assertivas que impactem diretamente nos resultados e na experiência do cliente;
- Sugerir continuamente formas de aumentar o engajamento e maximizar o sucesso das parcerias;
- Conectar resultados a oportunidades comerciais, fortalecendo e expandindo o relacionamento.
Perfil que buscamos:
- Organização, proatividade e capacidade de resolver problemas;
- Excelente comunicação, escuta ativa e boa escrita;
- Resiliência, dinamismo e habilidade para lidar com múltiplas demandas simultâneas;
- Visão analítica e comercial, identificando oportunidades de crescimento para clientes e para a empresa.
Outros requisitos
: 
- Capacidade de interpretar dados e propor melhorias baseadas em resultados;
- Experiência em gestão de projetos;
- Familiaridade com ferramentas de IA para otimizar o tempo de trabalho.
Se você tem energia para operacionalizar projetos e sensibilidade comercial para transformar parcerias em resultados, essa vaga é para você!",Vagas.com
