titulo,empresa,localizacao,uf,descricao,fonte
Analista de Operações Logísticas (Mídia Ooh),Mude.Fit,Rio de Janeiro / RJ                                       A empresa aceita candidaturas de Rio de Janeiro e cidades próximas,RJ,"Descrição
: 
Você acredita que a cidade pode ser um lugar mais saudável e conectado? Na Mude, nós acreditamos! Somos uma plataforma de mídia e bem-estar que transforma o espaço urbano, oferecendo atividades físicas gratuitas e levando saúde para as pessoas através da nossa rede de mobiliário inteligente.
Para manter essa engrenagem funcionando com perfeição, buscamos um(a) Analista de Operações Logísticas que tenha paixão por organização, processos e que queira fazer parte de uma operação que impacta milhares de vidas diariamente.
O seu desafio no nosso time:
Você será o ponto central entre o planejamento e a execução de nossas campanhas. Sua missão é garantir que cada quadro digital esteja impecável, coordenando equipes de campo, otimizando rotas e mantendo nossa operação eficiente e ágil.
O que você fará no dia a dia:
✅ Planejar e agendar instalações e manutenções de campanhas;
✅ Apoiar equipes operacionais e fornecedores terceirizados;
✅ Otimizar rotas para ganho de produtividade;
✅ Controlar estoque de materiais e equipamentos;
✅ Garantir a organização de dados e indicadores em nossos sistemas.
O que buscamos:
🔹 Experiência com logística operacional e controle de processos;
🔹 Perfil proativo, com foco em resolução de problemas e prazos;
🔹 Domínio de planilhas e ferramentas de acompanhamento;
🔹 Diferencial: Experiência com mídia OOH e gestão de terceiros.
Por que vir para o nosso time? (Nossos benefícios):
🍎 Energia em dia: Café da manhã com frutas e proteínas no escritório;
🍴 Almoço garantido: VR/VA de R$ 25,00/dia;
🚗 Mobilidade: Vale Transporte ou Vale Combustível;
💪 Saúde e Bem-estar: Plano de Saúde (Amil) e convênio Total Pass;
🎂 Seu dia é seu: Day off no aniversário;
📚 Crescimento: Programa de Incentivo à Educação;
👶 Família: Licença Paternidade estendida (30 dias);
🛡️ Segurança: Seguro de Vida e convênios com parceiros.
📍 Local: Bonsucesso, Rio de Janeiro (Dentro da Unisuam).
🏢 Modelo: 100% Presencial.
📩 Gostou da oportunidade? Candidate-se agora",Vagas.com
Analista de Desenvolvimento Humano II (Remuneração e Performance),PAMCARY,São Paulo / SP                                       A empresa aceita candidaturas de São Paulo e cidades próximas,SP,"Descrição
: 
Estamos em busca de um(a) Analista Pleno de Remuneração e Performance para integrar nosso time de Desenvolvimento Humano e apoiar as rotinas estratégicas da área.
Procuramos um(a) profissional com experiência em atividades relacionadas à Classificação Brasileira de Ocupações (CBO), movimentação de pessoal e ciclos de performance, que seja capaz de atuar de forma mais autônoma, contribuindo com análises, melhorias de processos e suporte aos gestores.
É importante apresentar perfil proativo, analítico, organizado e com elevado senso de responsabilidade, confidencialidade e discrição, além de boa capacidade de relacionamento interpessoal.
Se você busca desenvolvimento profissional em um ambiente colaborativo, dinâmico e com desafios que impulsionem seu crescimento, essa oportunidade pode ser ideal para você.
Como será o seu dia a dia:


Atuar na revisão e atualização dos CBOs, propondo melhorias e garantindo aderência às práticas organizacionais;


Conduzir processos de movimentação de pessoal, incluindo promoções, méritos e enquadramentos, com análise crítica e recomendações;


Apoiar a administração da estrutura salarial, contribuindo para a atualização de tabelas, faixas salariais e práticas de remuneração;


Atuar de forma estruturada nos ciclos de performance, organizando dados, acompanhando prazos e apoiando gestores na tomada de decisão;


Prestar suporte consultivo às áreas internas em temas relacionados a remuneração, carreira e performance;


Participar da elaboração e revisão de políticas, diretrizes e procedimentos da área;


Contribuir ativamente com projetos de melhoria contínua nos processos de remuneração e gestão de performance;


Apoiar na geração de relatórios e análises que subsidiem decisões estratégicas da área.


O que você precisa ter:


Ensino superior completo em Administração, Psicologia, Recursos Humanos ou áreas correlatas;


Excel intermediário/avançado;


Experiência prévia consistente em CBO, movimentação de pessoal e ciclos de avaliação de performance e matriz 9box;


Capacidade analítica e autonomia na condução de atividades;


Perfil proativo, responsável e com forte senso de confidencialidade;


Diferenciais:


Experiência com Power BI;


Experiência com pesquisa salarial;


Vivência com indicadores de remuneração e dashboards.


O que oferecemos:
• Assistência médica e odontológica
• Descontos exclusivos em nossos produtos
• Seguro de vida
• Vale-refeição
• vale-transporte
• Cartão Natal
• Sexta Flex
• Day Off de Aniversário
• Auxílio Creche
• Auxílio Filho Excepcional
Jornada personalizada de saúde e bem-estar:
• Teleconsulta
• Programa Futuros Pais
• Cantinho da Mamãe
• Programa de Apoio a Saúde Crônica
• Nutrição
• Atividade física com Wellhub
• Credencial SESC
• Clube de Descontos
• Educação e carreira
#VEMPRAPAMCARY",Vagas.com
Analista Srm Jr - São Paulo / SP,InterCement Brasil S.A,São Paulo / SP                                       A empresa aceita candidaturas de São Paulo e cidades próximas,SP,"Descrição
: 
Estamos em busca de um(a) Analista SRM Jr para se juntar a nossa equipe na unidade de São Paulo/SP! Se você se identifica com a vaga e atende os requisitos, essa pode ser a oportunidade perfeita para você! Confira abaixo as responsabilidades do cargo:
Atuar na gestão do processo de cadastro, qualificação, homologação, requalificação, bloqueio e monitoramento contínuo de fornecedores e terceiros, garantindo aderência às políticas corporativas, compliance e governança da cadeia de suprimentos;								
Conduzir análises de Due Diligence financeira, reputacional, fiscal, trabalhista, jurídica, ESG, socioambiental e compliance, apoiando a mitigação de riscos operacionais, reputacionais e financeiros da companhia;								
Gerenciar fluxos de qualificação e homologação via SAP ECC, SAP Ariba SLP e demais plataformas correlatas, garantindo rastreabilidade, compliance e integridade das informações;								
Apoiar a construção e manutenção da estratégia de Supplier Risk Management (SRM), promovendo modelo preventivo e preditivo de gestão de riscos de fornecedores;								
Atuar em conjunto com as áreas de Suprimentos, Jurídico, Compliance, Segurança, Meio Ambiente, Financeiro e áreas operacionais na avaliação e tomada de decisão sobre homologação e continuidade de fornecedores;								
Emitir pareceres técnicos e relatórios executivos de risco fornecedor (DDR/Due Diligence Reports), consolidando análises e recomendando aprovações, restrições, bloqueios ou planos de mitigação;								
Apoiar a gestão de fornecedores classificados em níveis críticos de risco, conduzindo análises complementares, planos de ação e workflows de aprovação;								
Apoiar iniciativas de integração entre plataformas de SRM, SAP, Ariba, BI e ferramentas analíticas, visando maior visibilidade da exposição de risco x spend;								
Elaborar e acompanhar indicadores de desempenho e risco relacionados à base fornecedora, incluindo: criticidade operacional, exposição financeira, compliance, performance documental, vencimentos regulatórios, monitoramento contínuo, dependência operacional.								
Apoiar auditorias internas e externas relacionadas a compliance, homologação, ESG, gestão de terceiros e governança de fornecedores;								
Se interessou por essa vaga e está em busca de uma oportunidade de crescimento profissional? Candidate-se, estamos ansiosos para conhecê-lo(a)!
Outros requisitos
: 
Conhecimento em processos de Supplier Relationship Management (SRM), Supplier Lifecycle Management (SLM) e gestão de fornecedores;								
Conhecimento em processos de cadastro, homologação, qualificação, requalificação e monitoramento contínuo de fornecedores;								
Conhecimento em ferramentas analíticas e dashboards (Power BI, Qlik Sense ou Tableau);								
Excel e power Point, desejável conhecimento em automação, análise de dados e indicadores de performance;
Conhecimento sobre análises de processos judiciais, será um diferencial. Será muito utilizado no dia a dia a consulta de situações de processos, interpretação a análises de riscos dos mesmos;
Desejável conhecimento no SAP Ariba;
Necessário Superior Cursando (Administração ou Direito).",Vagas.com
Analista de RH Júnior – Atração e Seleção,Grupo Fleury,Vitória / ES                                       A empresa aceita candidaturas de Vitória e cidades próximas,ES,"Descrição
: 
Quais são os desafios da área e do cargo:
Esta pessoa terá como objetivo atuar de forma alinhada à visão estratégica de Negócios do Grupo Fleury, contribuindo para a construção de um ecossistema de Saúde integrado, preventivo e híbrido, tendo como principal foco o cuidado com as pessoas.
Se você tem interesse em fazer parte desse propósito e deseja estar sempre um passo a frente do mercado, vem com a gente!
Sobre a área: 
Executar processos seletivos de baixa e média complexidade das áreas corporativas e operações, alinhados a política e competências corporativas do Grupo, a fim de apresentar pessoas conectadas aos objetivos estratégicos da empresa, buscando não só as competências técnicas, mas o alinhamento de valores e propósito.
Principais atividades: 
•	Realizar todas as etapas dos processos seletivos interno e externo de baixa e média complexidade das áreas corporativas e operações do Grupo Fleury, através de técnicas e ferramentas de Atração e Seleção garantindo o encaminhamento de candidatos em alinhamento ao perfil solicitado pelas áreas demandantes;
•	Fortalecer o relacionamento com cliente interno através de Briefing e Follow up;
•	Aplicação de ferramentas de assessments e elaboração de parecer que registrem a análise de competências e subsidiem o processo de tomada de decisão;
•	Atualizar as ferramentas de gestão de vagas, garantindo a precisão dos status e informações, para facilitar a compilação de dados e a geração de indicadores;
•	Fornecer retorno as pessoas participantes dos processos seletivos com objetivos de gerar oportunidades de desenvolvimento e garantir uma melhor experiência;
•	Promover a marca empregadora, disseminando o eco sistema integrado de saúde e a cultura organizacional;
•	Construir conexões com áreas parceiras, por meio de uma comunicação fluida garantindo eficiência, agilidade e uma visão integrada dos processos;
•	Realizar entrevistas de desligamento, preenchendo o formulário padrão de maneira clara e objetiva, bem como compartilhar as informações relevantes ou reincidentes;
•	Analisar problemas atreladas a jornada de contratação de pessoas e promoção e sugerir alternativas viáveis para solução.
Buscamos alguém que apresente: 
•	Necessário graduação completa;
•	Necessário experiência prévia de estágio ou na assessoria a processos de Atração e Seleção;
•	Pacote Office intermediário.
Antes da inscrição na vaga, é importante verificar se você atende aos requisitos e se conecta com nosso propósito.
Nossa essência inspira o dia a dia, por isso, buscamos pessoas apaixonadas pelo que fazem, e que:
•	Estimulem um ambiente de troca de conhecimentos, compartilhando experiências, possibilitando a interdependência entre os times;
•	Estejam em constante movimento, investindo em autodesenvolvimento e atuando como facilitadora no desenvolvimento das outras pessoas;
•	Busquem consciência social de diversidade e inclusão, cooperando com a construção de um ambiente colaborativo;
•	Identifiquem e antecipem as necessidades dos clientes, agindo prontamente para encontrar soluções adequadas e personalizadas;
•	Planejem e executem o trabalho com excelência a fim de atingir os resultados esperados, com a visão de inovação e agilidade;
•	Gerem e implementem novas ideias, buscando constantemente por melhorias para a experimentação de novas abordagens e a adaptação às mudanças do mercado.
Modelo de Trabalho: Híbrido
Carga horária: 220h
Local: Vila Velha / Espirito Santo
Cuidamos de você em cada etapa da sua jornada! 
Saúde e Bem-estar:


Assistência médica e odontológica para você e sua família;


Ambulatório com clínica médica ou atendimento por telemedicina;


Linhas de cuidado especializadas: gestantes, adoção, obesidade, oncologia, entre outras;


Acesso à plataforma OrienteMe para sessões de terapia e orientação nutricional;


Licença maternidade e paternidade estendidas;


Acesso ao Wellhub para práticas esportivas e qualidade de vida.


Proteção e estabilidade:


Previdência privada;


Seguro de vida.


Facilidades para o dia a dia:


Vale-Alimentação;


Vale-Refeição;


Vale-Transporte;


Auxílio-Creche;


Desenvolvimento e educação:


Plataforma de ensino;


Parcerias educacionais com descontos em cursos e instituições.


Aqui, o cuidado vai além dos benefícios — ele está presente em cada momento da sua trajetória.
Promovemos uma cultura inclusiva, focada na equidade e na valorização das diferenças. 
Nossas vagas são abertas para todos os públicos e, simbolizando a nossa intencionalidade, oferecemos oportunidades afirmativas.
Nosso compromisso vai além do cumprimento das legislações que incentivam a diversidade e inclusão. 
Trabalhamos ativamente para ampliar a representatividade de nossas pessoas, pensando em raça, etnia, gênero, gerações, pessoas com deficiência e LGBTQIAPN+
 em nosso time, além de fortalecer a representatividade de mulheres negras, indígenas, chefes de família.
Para conhecer mais sobre o Grupo Fleury, acesse o site: 
https://carreiras.grupofleury.com.br/ 
O Grupo Fleury informa que a participação em seus processos seletivos é gratuita e nenhuma empresa terceira está autorizada a cobrar valores para a candidatura às vagas, ao treinamento, ao material didático ou qualquer outra despesa relacionada.",Vagas.com
Analista Técnico de Atendimento - Customer Service,Grupo Fleury,N/A,N/A,"Descrição
: 
Sobre a Marca:
O 
Hermes Pardini
 atua há mais de 65 anos em 
Minas Gerais
, sendo referência em 
Análises Clínicas, Exames de Imagem e Vacinas
. Sua trajetória é marcada por oferecer atendimento com precisão, responsabilidade e rigor técnico. Com unidades em 
Belo Horizonte, Nova Lima, Betim, Caeté, Contagem, Ibirite, Lagoa Santa, Pedro Leopoldo, Ribeirão das Neves, Sabará, Santa Luzia, Sete Lagoas, Vespasiano - MG
, o Hermes Pardini é integrante do 
Grupo Fleury
, uma das 
mais respeitadas empresas de medicina diagnóstica e saúde do Brasil
, fortalecendo seu compromisso com excelência, inovação e cuidado com as pessoas.
Quais são os desafios da área e do cargo:
Esta pessoa terá como objetivo atuar de forma alinhada à visão estratégica de Negócios do Grupo Fleury, contribuindo para a construção de um ecossistema de Saúde integrado, preventivo e híbrido, tendo como principal foco o cuidado com as pessoas.
Se você tem interesse em fazer parte desse propósito e deseja estar sempre um passo a frente do mercado, vem com a gente!
Principais atividades:


Responsável por analisar e esclarecer dúvidas das equipes de atendimento interno, executivos de vendas, laboratórios conveniados e os médicos prescritores, visando a compreensão dos métodos dos exames de alta complexidade das marcas do Grupo Fleury;


Orientar laboratórios conveniados sobre métodos de análise e orientação de exames da especialidade atendida, através de contatos telefônicos e meios digitais;


Minimizar as dúvidas das equipes das lojas de atendimento sobre dúvida de cadastros e análise de pedidos de exames da especialidade atendida, através da atualização contínua do help de exames de todos os setores técnicos e de esclarecimentos por telefone;


Suportar a equipe de assessores técnicos e executivos de vendas, através de esclarecimento de dúvidas sobre os exames de alta complexidade prestados aos laboratórios conveniados;


Analisar o fluxo de atendimento da especialidade acompanhada e propor melhorias para a experiência do cliente;


Contribuir nos projetos de melhoria contínua no atendimento dos laboratórios conveniados e cliente internos, seguindo as estratégias definidas pela empresa;


Garantir o conhecimento das equipes do Customer Service e demais clientes internos, através de treinamentos técnicos;


Suportar a gestão do conhecimento interno e externo, através da revisão e atualização de manuais, lâminas de produtos e demais materiais de divulgação em campanhas comerciais;


Apoiar na orientação ativa de pré-analítico, quando necessário;


Realizar a retificação de dados demográficos, quando solicitado por clientes L2L, de acordo com as diretrizes definidas no documento pertinente.


Buscamos alguém que apresente: 


Superior completo em Farmácia Bioquímica, Biomedicina ou Ciências Biológicas.


Experiência na área laboratorial;


Pacote Office – Intermediário;


Inglês – Básico;


Conhecimento em exames de análises clínicas, anatomia patológica, biologia molecular – Avançado;


Boa escuta, flexibilidade, dinamismo, proatividade, boa comunicação.


Antes da inscrição na vaga, é importante verificar se você atende aos requisitos e se conecta com nosso propósito.
Nossa essência inspira o dia a dia, por isso, buscamos pessoas apaixonadas pelo que fazem, e que:
•	Estimulem um ambiente de troca de conhecimentos, compartilhando experiências, possibilitando a interdependência entre os times;
•	Estejam em constante movimento, investindo em autodesenvolvimento e atuando como facilitadora no desenvolvimento das outras pessoas;
•	Busquem consciência social de diversidade e inclusão, cooperando com a construção de um ambiente colaborativo;
•	Identifiquem e antecipem as necessidades dos clientes, agindo prontamente para encontrar soluções adequadas e personalizadas;
•	Planejem e executem o trabalho com excelência a fim de atingir os resultados esperados, com a visão de inovação e agilidade;
•	Gerem e implementem novas ideias, buscando constantemente por melhorias para a experimentação de novas abordagens e a adaptação às mudanças do mercado.
Informações da vaga:
Modelo de Trabalho: Home Office.
Carga Horária: 220hs
Escala: Segunda a sexta feira.
Horário de Trabalho: 08:00h as 17:12h
Cuidamos de você em cada etapa da sua jornada! 
Saúde e Bem-estar:


Assistência médica e odontológica para você e sua família;


Ambulatório com clínica médica ou atendimento por telemedicina;


Linhas de cuidado especializadas: gestantes, adoção, obesidade, oncologia, entre outras;


Acesso à plataforma OrienteMe para sessões de terapia e orientação nutricional;


Licença maternidade e paternidade estendidas;


Acesso ao Wellhub para práticas esportivas e qualidade de vida.


Proteção e estabilidade:


Previdência privada;


Participação nos lucros;


Seguro de vida.


Facilidades para o dia a dia:


Vale-Alimentação;


Vale-Refeição;


Vale-Transporte;


Auxílio-Creche;


Clube de Descontos com lojas, farmácias, viagem, beleza, cultura, lazer, entre outros serviços.


Desenvolvimento e educação:


Plataforma de ensino;


Parcerias educacionais com descontos em cursos e instituições.


Aqui, o cuidado vai além dos benefícios — ele está presente em cada momento da sua trajetória.
Promovemos uma cultura inclusiva, focada na equidade e na valorização das diferenças. 
Nossas vagas são abertas para todos os públicos e, simbolizando a nossa intencionalidade, oferecemos oportunidades afirmativas.
Nosso compromisso vai além do cumprimento das legislações que incentivam a diversidade e inclusão. 
Trabalhamos ativamente para ampliar a representatividade de nossas pessoas, pensando em raça, etnia, gênero, gerações, pessoas com deficiência e LGBTQIAPN+
 em nosso time, além de fortalecer a representatividade de mulheres negras, indígenas, chefes de família.
Para conhecer mais sobre o Grupo Fleury, acesse o site: 
https://carreiras.grupofleury.com.br/ 
O Grupo Fleury informa que a participação em seus processos seletivos é gratuita e nenhuma empresa terceira está autorizada a cobrar valores para a candidatura às vagas, ao treinamento, ao material didático ou qualquer outra despesa relacionada.",Vagas.com
Analista de Business Intelligence (Vaga Exclusiva - Pcd),Atlas Copco Brasil,Barueri / SP                                       A empresa aceita candidaturas de Barueri e cidades próximas,SP,"Descrição
: 
Sua função
Apoiar a Companhia na transformação de dados em informações claras e acessíveis, contribuindo para análises, automações e soluções que aprimorem a eficiência operacional e apoiem a tomada de decisões estratégicas.
Você irá:


Apoiar na análise, tratamento e modelagem de dados, gerando 
insights 
que subsidiem a tomada de decisão;


Participar da criação e manutenção de processos de ETL, utilizando ferramentas de integração e 
Power Platform
, quando necessário;


Desenvolver e atualizar 
dashboards 
e relatórios em 
Power 
BI;


Monitorar o desempenho das soluções de BI, realizando ajustes e sugerindo melhorias;


Auxiliar na automação de fluxos de trabalho com 
Power Automate
 e no desenvolvimento de aplicativos com 
Power Apps
;


Realizar consultas em bases de dados (SQL) e apoiar na organização e estruturação das fontes de informação.


 
Para ter sucesso você precisará
Recomendamos que você se inscreva mesmo que não atenda a todos os requisitos. Valorizamos experiências e perspectivas diversas e estamos ansiosos para ver o que você pode oferecer para a função.


Formação superior em áreas como Tecnologia da Informação, Ciência de Dados, Engenharia, Estatística, Administração, Marketing ou áreas correlatas;


Conhecimento em Pacote Office;


Vivência com ferramentas de BI (como Power BI) será um diferencial;


Inglês será considerado um diferencial;


Boa comunicação e facilidade para interagir com diferentes áreas.


 
Em troca nós oferecemos


Cultura de confiança e responsabilidade;


Aprendizado contínuo e perspectiva de carreira;


Inovação com diferentes tecnologias;


Remuneração e benefícios abrangentes.


 
Informações adicionais


Atuação em Barueri/SP (a Atlas Copco Brasil – Unidade Compressores tem previsão de mudança para a região de Sorocaba/SP em 2027.)


Esta oportunidade é destinada exclusivamente a Pessoas com Deficiência (PcD)


Idiomas
:
Inglês - Nível Básico e Inglês - Nível Intermediário",Vagas.com
Analista de Qualidade - Qualidade Dedicada - Hospital Vivalle,Rede D'Or,São José dos Campos / SP                                       A empresa aceita candidaturas de qualquer cidade do Brasil,SP,"Descrição
: 
Requisitos:
• Ensino Médio Completo;
Atividades:
•	Participar das auditorias externas, realizar auditorias internas e acompanhar o pós-auditoria do no Grupo VIVALLE e Terceiros;
•	Emitir relatórios de Auditorias Interna e Não Conformidades apontadas;
•	Garantir o lançamento das informações na base de dados dos indicadores, interação de processos e não conformidades;
•	Auxiliar na elaboração de Regimentos, Normas, Políticas, POPS e Fluxos;
•	Realizar a gestão dos documentos administrativos (elaboração, revisão, validação e aprovação).
•	Manter atualizado a base de dados de gestão de documentos;
•	Acompanhar as ações de melhorias propostas e o impacto nos resultados dos indicadores;
•	Acompanhar a manutenção das ações e melhorias implantadas;
•	Auxiliar nos Mapeamentos de Processos Institucionais;
•	Auxiliar no desenvolvimento de indicadores alinhados aos resultados dos processos;
•	Oferecer suporte na organização dos eventos relacionados à qualidade (treinamentos, reuniões, etc);
•	Realizar treinamentos relacionados à qualidade;
•	Realizar processo de Integração de Novos Colaboradores e Terceiros;
•	Acompanhar avaliação de fornecedores realizados pelas áreas;
•	Realizar a gestão de contratos (disponibilização no sistema tasy, controle de vencimento, bem como acompanhar a avaliação dos serviços prestados);
•	Aprendizagem de atividades relacionada a rotinas internas do escritório de qualidade para backup e cobertura de férias;
Outras informações:
• Local de trabalho: São José dos Campos/SP;",Vagas.com
