titulo,empresa,localizacao,uf,descricao,fonte
Analista de Dados Sr,Ferroport,"São João da Barra / RJ
              



                      A empresa aceita candidaturas de qualquer cidade do Brasil",RJ,"Descrição
: 
Descrição da Vaga:
Buscamos um(a) Analista de Manutenção Sênior com sólida experiência em análise estatística e inteligência de dados aplicada à manutenção industrial. Este profissional será responsável por transformar dados em insights estratégicos, apoiando a tomada de decisão e a melhoria contínua dos processos de PCM.
Responsabilidades:
Realizar controle estatístico e analítico das variáveis de PCM, antecipando desvios e propondo melhorias.
Utilizar ferramentas como PIMS, MES, ERP, sistemas de gerenciamento de ativos e alarmes.
Propor e desenvolver novos indicadores e métricas, garantindo retorno dos resultados.
Implementar ferramentas analíticas avançadas para coleta, classificação, tratamento e análise de dados complexos.
Integrar novas tecnologias e metodologias analíticas em colaboração com TI e outras áreas.
Conduzir reuniões estratégicas, apresentando análises e recomendações à alta gestão.
Desenvolver dashboards e relatórios periódicos para comunicação de insights.
Liderar projetos de análise de dados, coordenando recursos e entregas.
Criar modelos preditivos e realizar análises exploratórias aprofundadas dos dados de manutenção.
Requisitos:
Formação superior em Engenharia, Ciência de Dados, Estatística, TI ou áreas correlatas.
Experiência com ferramentas analíticas e sistemas industriais (PIMS, MES, ERP).
Domínio em modelagem de dados, estatística e visualização (Power BI, Tableau, etc.).
Conhecimento em manutenção industrial e indicadores de PCM.
Habilidade em comunicação, liderança de projetos e trabalho colaborativo.
Diferenciais:
Experiência com metodologias preditivas e machine learning.
Vivência em ambientes industriais e integração com áreas técnicas",Vagas.com
10934 - Analista de Dados Pleno,Talent Group,"Rio de Janeiro / RJ
              



                      A empresa aceita candidaturas de Rio de Janeiro e cidades próximas",RJ,"Descrição
: 
Instituição de referência nacional em educação, pesquisa e gestão busca profissional para a posição de 
Analista Pleno de Inteligência de Auditoria.
Tem os requisitos da vaga? Venha fazer parte desse time!!
Requisitos Técnicos (Mandatórios):


Graduação completa, preferencialmente em Tecnologia da Informação ou áreas afins;


Experiência comprovada em automação, análise e modelagem de dados;


Domínio em ferramentas como: Excel, Power BI, SQL, entre outras.


Desejáveis:


Conhecimento em ferramentas de automação e tecnologias emergentes com foco em inteligência artificial aplicada à auditoria;


Domínio em ferramentas como: ACL (Analitics e Robotics), Power Query e Power Automate;


Experiência com ETL (Extract, Transform e Load).


Diferenciais:


Pós-Graduação ou MBA em Inteligência Artificial;


Experiência prévia com auditoria baseada em dados (mesmo que em outro setor);


Experiência prévia em consultorias Big4 ou em ambientes educacionais;


Vivência em ambientes com múltiplos sistemas (ERP, CRM, acadêmico, financeiro etc);


Projetos anteriores de monitoramento contínuo, automação de testes ou indicadores de controle.


Habilidades Comportamentais:


Capacidade analítica;


Atenção aos detalhes;


Comunicação eficaz;


Proatividade;


Pensamento crítico e estratégico para o negócio;


Raciocínio lógico;


Comprometimento com entregas e prazos;


Organização;


Adaptabilidade.


Principais Responsabilidades:


Auxiliar no desenvolvimento de ferramentas que otimizem o trabalho dos auditores;


Auxiliar nos incrementos e operações assistidas de ferramentas e relatórios gerenciais;


Auxiliar no desenvolvimento de testes de monitoramento contínuo, mantendo-os atualizados e cobrando respostas das áreas envolvidas;


Contribuir na melhoria dos KPIs da matriz de riscos para o planejamento anual de auditoria;


Elaborar documentações técnicas e “Manual dos Usuários” das ferramentas desenvolvidas;


Processar grandes volumes de dados em tempo real, identificando padrões, anomalias e gerando insights;


Manter comunicação contínua com os auditores, compreendendo as demandas e propondo soluções tecnológicas.


Informações Adicionais:


Contratação CLT + Pacote de Benefícios;


Atuação 100% Presencial - Botafogo/ RJ;


Horário de Trabalho das 09h00 às 18h00;


Início Imediato.",Vagas.com
Analista de Dados,Confidencial,"Rio de Janeiro / RJ
              



                      A empresa aceita candidaturas de Rio de Janeiro e cidades próximas",RJ,"Descrição
: 


Extrair, tratar e modelar dados para relatórios analíticos;


Criar Dashboard;


Analisar dados para auxilar na tomada de decisão;


Dar suporte aos clientes internos em relatórios e treinamentos;


TODOS AS NOSSAS VAGAS SÃO DISPONÍVEIS PARA PCD.
Outros requisitos
: 


Graduação em Marketing, Administração, Engenharia da Produção ou áreas afins;


Conhecimento avançado em Excel, POWER BI, VBA e POWER QUERY.",Vagas.com
Analista de Dados Pl,Fundação São Francisco Xavier,"Ipatinga / MG
              



                      A empresa aceita candidaturas de qualquer cidade do Brasil",MG,"Descrição
: 
O desafio:
Buscamos um(a) Analista de Dados Pleno para atuar de forma estratégica no tratamento, análise e visualização de dados institucionais, apoiando as áreas de negócio com informações precisas e dashboards inteligentes que impulsionem a tomada de decisão.
Principais responsabilidades:


Tratar e preparar dados para cálculo de indicadores, consultando fontes estruturadas, semiestruturadas e não estruturadas armazenadas em Datalake ou Data Warehouse;


Desenvolver dashboards e relatórios analíticos, utilizando padrões visuais definidos pela supervisão;


Acompanhar e validar indicadores institucionais junto às áreas de negócio, contribuindo com o dicionário de dados e com a governança da informação;


Propor métricas e criar painéis de monitoramento da qualidade dos dados, identificando e reportando desvios;


Documentar produtos de dados e indicadores, traduzindo regras de negócio em instruções técnicas para manutenção contínua;


Realizar análises exploratórias, aplicando técnicas estatísticas e de visualização para identificar padrões e tendências;


Atender demandas de análise das áreas de negócio, interpretando necessidades, propondo soluções e garantindo o cumprimento de prazos.


Requisitos:


Ensino superior completo em Ciência de Dados, Estatística, Sistemas de Informação, Engenharia, Administração ou áreas correlatas.


Conhecimentos em: SQL e bancos de dados relacionais; Ferramentas de BI (Power BI, Tableau ou similares); Estatística aplicada e análise exploratória; Excel avançado; Segurança da informação e governança de dados; Design de interface, experiência do usuário e visualização de dados.


Diferenciais desejáveis:


Pós-graduação em Análise de Dados, BI ou Big Data;


Conhecimento em Python ou R;


Certificações intermediárias (Power BI Data Analyst Associate, SQL Database Fundamentals ou Google Data Analytics Professional).


Dados da vaga:
Horário: 08h00 às 17h16
Local: Ipatinga ou Belo Horizonte (MG) | Santos ou São Paulo (SP)
Modelo de trabalho: Híbrido (3 dias presenciais e 2 dias home office)",Vagas.com
Analista de Dados I,Oncoclínicas&Co,"Belo Horizonte / MG
              



                      A empresa aceita candidaturas de Belo Horizonte e cidades próximas",MG,"Descrição
: 
Analista de Dados I 
Belo Horizonte/MG
#VemSerOC
O que você irá fazer:
Identificar e compreender os objetivos da análise de dados;
Analisar as necessidades e requisitos da empresa em relação aos dados;
Extrair dados relevantes de diversas fontes, como bancos de dados e planilhas;
Realizar a limpeza e pré-processamento dos dados para garantir qualidade e integridade;
Utilizar técnicas adequadas para preparar os dados para análise;
Empregar ferramentas como linguagens de programação, bancos de dados e software estatístico para realizar a análise;
Analisar e submeter documentos dos times jurídico e regulatório para apoio a Pesquisa;
Comunicar os resultados de forma clara e compreensível;
Criar relatórios, visualizações de dados e gráficos para apresentar as conclusões;
Apresentar os resultados em reuniões, adaptando a comunicação para diferentes públicos, incluindo gerentes, executivos e outros departamentos.
Entre outras atividades relacionadas ao cargo.
 O que você precisa ter:
Ensino superior completo em Ciências da computação, Matemática, Engenharia da Computação, ou áreas afins.
PowerBI, Grafana
SQL, DAX e PowerQuery.
Python.
Conhecimento ITIL v3 ou v4
Disponibilidade para trabalhar em modelo híbrido.
 Horário de trabalho:
Seg a Qui de 8:00 as 18:00 e Sex de 8:00 as 17:00
 Local de trabalho:
CSO – Santa Efigênia em Belo Horizonte/MG",Vagas.com
Analista de Dados (Controladoria),Milhão Ingredients,"Goianira / GO
              



                      A empresa aceita candidaturas de qualquer cidade do Brasil",GO,"Descrição
: 
Responsabilidades


Desenvolver e automatizar soluções financeiras com Excel, VBA, SQL e BI.


Integrar dados de sistemas (ERP, APIs, bancos) para relatórios e dashboards.


Analisar informações financeiras e gerar insights para decisões estratégicas.


Conectar TI e áreas de negócio, traduzindo demandas em soluções eficazes.


Apoiar projetos ágeis e propor melhorias com ferramentas low-code e Python/R.


Requisitos


Superior completo em TI, Engenharia, Administração ou áreas afins;


Experiência em soluções para Controladoria/Finanças;


Excel avançado, SQL, BI e APIs;


Conhecimento de processos contábeis/financeiros;


Vivência com ERPs e metodologias ágeis.",Vagas.com
Analista de Dados Clínicos Pl,hcor,"São Paulo / SP
              



                      A empresa aceita candidaturas de São Paulo e cidades próximas",SP,"Descrição
: 
Responsabilidades e atribuições:
•	Desenvolver fichas clínicas (CRF) e sistemas (eCRF).
•	Dar apoio na criação de “dummy-table”, elaborar manuais operacionais e revisar documentos de análise de dados, incluindo planos e planilhas de controle.
•	Treinar equipes quanto ao uso do sistema de CRFs eletrônicas, 
•	Garantir consistência, completude e acurácia das bases.
•	Administrar usuários no sistema eletrônico, interagir com o TI 
•	Realizar codificação de termos médicos, elaborar relatórios de controle de qualidade e gerenciar pendências e correções junto aos centros investigadores.
•	Manter interação contínua com a equipe do estudo, desenvolver dashboards, organizar arquivos e apoiar outras áreas do Instituto de Pesquisa.
•	Participar de comitês de monitoramento de dados, revisar POPs, comunicar-se com patrocinadores e fornecedores e acompanhar indicadores.
•	Apresentar resultados em seminários e reuniões do departamento.
Idiomas
:
Inglês - Nível Intermediário
Outros requisitos
: 
Requisitos e qualificações:
•	Graduação na área da Saúde (Fisioterapeuta, Ciências Biológicas, Farmácia, Biomédico, Medicina Veterinária), Ciência de Dados, Ciência da Computação, Estatística, Matemática, Engenharia.
•	Conhecimento em ferramentas de análise e manipulação de dados (Preferencialmente R., Phyton  é um diferencial)
•	Inglês intermediário.
•	Pós-graduação em Ciência de Dados, Data Science Analytics diferencial
•	Conhecimento em sistema EDC – (REDCap, Oracle Clinical, Medidata Rave ou similares).
•	Experiência mínima de 2 anos em gerenciamento e análise de dados, clínico diferencial.
•	Construção de Dashbords, dados de visualização (Power BI, Loker ou Shiny).
Informações adicionais:
Descrição de benefícios
•	Plano de saúde (Seguros Unimed) para titular e dependentes;
•	Plano odontológico (Bradesco) para titular e dependentes;
•	Seguro de vida pessoal;
•	Convênio com redes de farmácias;
•	Parceria com SESC;
•	Vale-transporte;
•	Vale-alimentação;
•	Refeitório no local para colaboradores da unidade Paraiso e complexo;
•	Programa Conectar (reconhecimento por desempenho);
Valorizamos seu bem-estar:
•	Cuidar Hcor – clínica de Atenção Primária à Saúde criada exclusivamente para nossos colaboradores;
•	Clinica Amparo – clínica de Atenção Primária à Saúde criada exclusivamente para os dependentes dos colaboradores;
•	Auster – Programa de apoio social;
•	TotalPass – solução que reúne academias e estúdios para prática de atividade física;
•	Par de ingressos Cinemark no mês do seu aniversário;
•	Recanto – Espaço pensado para que cada colaborador encontre um momento de pausa, se desconecte da rotina e curta momento de descanso e lazer como: áreas de descanso, aulas de dança, treinamento funcional, alongamento e sala de jogos.
Pensamos no seu desenvolvimento:
•	Desconto em escolas de idioma e instituições educacionais.
Etapas do processo seletivo:
Triagem
Teste Técnico
Entrevista com Atração de Talentos
Entrevista com a Liderança
Exame Médico",Vagas.com
Analista de Dados Técnicos de Produtos,Komatsu,"Belo Horizonte / MG
              



                      A empresa aceita candidaturas de Belo Horizonte e cidades próximas",MG,"Descrição
: 
Responsável por elaborar descrições técnicas detalhadas e precisas de produtos, assegurando a correta classificação fiscal e identificando oportunidades de enquadramento em regimes especiais, como Ex-tarifário. Atua de forma estratégica na análise técnica para defesa junto a órgãos regulatórios, demonstrando inexistência de similar nacional e garantindo conformidade legal. Contribui diretamente para a redução da carga tributária e para a competitividade da empresa, por meio da integração entre conhecimento técnico de produtos e legislação fiscal brasileira.
Principais atribuições:


Elaborar descrições técnicas aprofundadas de produtos;


Assegurar correta classificação fiscal de materiais e produtos;


Identificar e propor enquadramento de itens em regimes fiscais especiais (como Ex-tarifário, Drawback e outros);


Atuar na defesa técnica junto a órgãos governamentais;


Contribuir para a governança e integridade dos dados mestres técnicos;


Gerar valor estratégico à empresa por meio da gestão técnica-fiscal dos produtos.


Idiomas
:
Inglês - Nível Intermediário
Outros requisitos
: 


Ensino Superior Completo nas áreas de Engenharia;


Desejável 1 ano na função;


Inglês Intermediário;


Excel avançado, Power Query, Power Automate e ferramentas de análise de dados para automação e eficiência de processos;


Domínio em classificação fiscal, normativas da RF e regulamentações internacionais aplicáveis à produtos e materiais;


Noções em regimes aduaneiros especiais;


Domínio em leitura de catálogos, manuais e desenhos técnicos;


Noções em serviços de campo/oficina.",Vagas.com
10924 - Analista de Dados Genéticos (Ngs),Talent Group,"São Paulo / SP
              



                      A empresa aceita apenas candidaturas de São Paulo",SP,"Descrição
: 
Cliente Talent Group contrata 
Analista de Dados Genéticos (NGS) - Germinativo e Somático PL/SR
 para atuar na análise e interpretação clínica de dados de NGS, PCR e Sanger. A posição envolve triagem e priorização de variantes, elaboração de laudos técnicos em parceria com a equipe médica, participação em discussões de casos e contribuição no desenvolvimento e validação de testes genéticos. 
Responsabilidades:


Executar a análise e interpretação clínica de dados de NGS (painéis de reprodução humana, exoma e painéis oncológicos), além de análises por PCR e sequenciamento Sanger quando aplicável.


Realizar triagem, filtragem e priorização de variantes (SNV/Indels e, quando aplicável, CNV/LOH/fusões) com base em fenótipo (HPO), correlação genótipo–fenótipo e histórico familiar.


Aplicar diretrizes de classificação e reporte de variantes: ACMG/AMP/ClinGen (germinativo) e AMP/ASCO/CAP/ESMO (somático).


Utilizar e manter atualizadas as referências e bancos: ClinVar, gnomAD, HGMD, OMIM, Decipher, LOVD, COSMIC, OncoKB, CIViC, entre outros.


Documentar controle de qualidade (Q30, cobertura/profundidade, uniformidade, taxa de mapeamento, contaminação, duplicatas), abrindo e investigando não conformidades e propondo ações corretivas.


Revisar em dupla e elaborar laudos e relatórios técnicos claros, reprodutíveis e rastreáveis, em parceria com a equipe médica/científica.


Participar de discussões de casos (tumor boards e reuniões clínicas) e prestar suporte técnico à equipe assistencial.


Reanalisar periodicamente casos (p. ex., VUS) e atualizar laudos quando novas evidências clínicas surgirem.


Colaborar no desenvolvimento, melhoria e validação de testes/pipelines (sensibilidade, especificidade, LoD, precisão, reprodutibilidade; estudos de comparabilidade).


Redigir e manter POPs, registros e documentação para auditorias (ISO 15189/17025, CAP/CLIA, ANVISA) e ensaios de proficiência (EMQN/GenQA, quando aplicável).


Zelar por segurança e privacidade de dados conforme LGPD, boas práticas e políticas internas.


Contribuir para treinamentos internos e capacitação contínua da equipe.


Requisitos:


Graduação em Biomedicina, Biotecnologia, Ciências Biológicas, Farmácia ou áreas correlatas.


Experiência comprovada em análise clínica de NGS (germinativo e/ou somático) e interpretação de variantes.


Domínio de HGVS, leitura de VCF, inspeção em IGV, e uso de ferramentas/plataformas de interpretação (ex.: Sophia Genetics, Illumina BaseSpace, Qiagen CLC, Franklin/Genoox, QCI Interpret, VarSome/Ensembl VEP/ANNOVAR).


Conhecimento prático do fluxo laboratorial: extração de DNA/RNA, PCR (convencional e qPCR), Sanger e NGS (para interface com a bancada).


Capacidade de leitura crítica de literatura científica em inglês e de síntese de evidências.


Organização, atenção a detalhes, gestão de prioridades e comunicação clara com times multidisciplinares.


Contratação
: CLT + Benefícios
Modelo de Trabalho
: 100% Presencial
Localização
: Itaim Bibi - São Paulo/SP
Outros requisitos
: 
Diferenciais (Não eliminatórios):


Pós-graduação em Genética/Genômica/Bioinformática ou áreas afins;


Vivência com somático (MSI, TMB, fusões), CNV/aneloploidias e mosaicismo; 


Experiência com exoma/WGS;


Familiaridade com LIMS (p. ex., Motion) e integração de dados clínico-laboratoriais.",Vagas.com
Analista de Dados Saúde e Odonto Jr,SulAmérica,"São Paulo / SP
              



                      A empresa aceita candidaturas de São Paulo e cidades próximas",SP,"Descrição
: 
Para o match perfeito acontecer precisa de PESSOAS, com as mais diversas experiências e pontos de vista, para que possamos continuar evoluindo enquanto empresa.
Por isso, aqui na SulAmérica, incentivamos a candidatura de pessoas de todas as raças/etnias, orientações sexuais, identidades de gênero, gerações, com ou sem deficiência, para todas as nossas vagas. Afinal, as nossas diferenças é o que nos complementam!
#LGBTQI+ #PessoasNegras #PcD #50+ #Gerações #PessoasComDeficiência
Como Será o Seu Dia a Dia Nessa Área:
Desenvolver estudos e indicadores sob supervisão para auxílio na tomada de decisão
• Desenvolver dashboards interativos que facilitem a análise visual e acompanhamento de indicadores
• Realizar manipulação de dados, tratamento, modelagem e validação de bases
• Realizar as rotinas de dados da área (atualizar bases de dados, relatórios, dashboards)
• Automatizar/Otimizar processos da área através de algoritmos
• Atuar em projetos da gerência
• Desenvolver simuladores que permitam calcular de forma prática, responsiva, dinâmica e confiável
• Documentar os processos
• Atuar em demandas oriundas do e-mail corporativo
Requisitos necessários para atuar como Analista de Dados Saúde e Odonto Jr na #SulA:
• Conhecimento em banco de dados, SQL, modelagem de dados, conceitos (fato x dimensão), Google Cloud, Excel Avançado, Python,
data viz (Looker Studio, Power BI, Tableau, etc).
• Ensino superior cursando ou completo.
• Disponibilidade para trabalhar 3x por semana presencial na Paulista.",Vagas.com
Analista de Dados Pl - São Paulo,J&T Express,"São Paulo / SP
              



                      A empresa aceita candidaturas de São Paulo e cidades próximas",SP,"Descrição
: 
Responsável por coletar, analisar e interpretar grandes volumes de dados relacionados à operação logística;
- Realizar análises aprofundadas sobre indicadores-chave de performance (KPIs) logísticos 
- Identificar gaps e ineficiências nos fluxos logísticos e propor soluções baseadas em dados para redução de impacto e melhoria do nível de serviço.
- Desenvolver e manter dashboards e relatórios automatizados utilizando ferramentas de Business Intelligence  para visualização clara e em tempo real dos dados logísticos.
- Elaborar relatórios gerenciais periódicos com insights sobre desempenho e melhorias por regional.
Outros requisitos
: 
Superior Completo. 
Conhecimento avançado do Excel, linguagem de programação SQL, Python, DAX (Power BI) para automatização da extração de dados.
Conhecimento da área logística, principalmente com atuação de e-commerce.",Vagas.com
Analista de Sistemas Sr. (Análise de Dados),FFM,"São Paulo / SP
              



                      A empresa aceita candidaturas de qualquer cidade do Brasil",SP,"Área de Atuação:
 Complexo do Hospital das Clinicas
 
 
Carga horária:
 40 horas semanais
 
 
Local de trabalho:
 São Paulo


 


Requisitos:
 
 Formação Superior  concluída em Ciências da Computação, Ciência de Dados, Engenharia de Sistemas, Engenharia da Computação, Sistemas de Informação, Análise de Sistemas ou Estatística (obrigatoriedade de anexar documentação)


Pós-graduação, MBA ou especialização concluida em áreas como: Business Intelligence, Data Science, Big Data ou Analytics.
 
 Conhecimentos em:


 ● SQL em nível avançado e experiência com modelagem de dados);
● Conhecimento sólido em Python ou R para análise de dados;
● Conhecimento em ferramentas de ETL (Ex: Talend, Pentaho, etc.) [cite_start]e plataformas de nuvem (AWS, Azure ou Google Cloud);
● Processos de ETL/ELT e integração de dados entre sistemas corporativos;
● Conceitos de governança e LGPD


● Experiência com bancos de dados relacionais e não relacionais;
● Conhecimento prático em Machine Learning, Data Visualization e Big Data;
● Conhecimento de APIs e integração de dados.


● Capacidade de interpretar dados para resolver problemas e propor soluções baseadas em evidências.
● Habilidade em priorizar tarefas, condução de atividades entre colaboradores e equipes; negociação de prazos e recursos.
● Gestão de processos


 
Atribuições:
 
Liderar projetos de análise de dados e inteligência, traduzindo necessidades das áreas em modelos e soluções analíticas;
Atuação não apenas na análise técnica, mas como parceiro estratégico das áreas de negócio, apoiando decisões institucionais com base em dados;
Desenvolver dashboards e indicadores estratégicos para alta gestão, utilizando ferramentas de BI e storytelling de dados;
Identificar oportunidades de otimização e melhorias nos processos relacionados à gestão de dados;
Explorar e aplicar técnicas de machine learning, estatística e análise preditiva para apoiar decisões administrativas ou assistenciais;
Implementar processos de governança, qualidade e segurança de dados, alinhados à LGPD e políticas institucionais;
Pesquisar e propor novas tecnologias, frameworks e ferramentas analíticas que agreguem valor;
Atuar como facilitador entre áreas técnicas e gestores, conduzindo apresentações, reuniões e treinamentos com clareza e objetividade;
Documentar e manter atualizada toda a estrutura de dados, garantindo a comunicação eficaz entre os envolvidos no desenvolvimento.
Realizar a homologação de produtos de dados junto aos clientes, treinando usuários para assegurar a conformidade com os requisitos estabelecidos.
Articular a comunicação entre equipes técnicas e não técnicas para garantir o alinhamento dos objetivos.
Elaborar, atualizar e acompanhar o cronograma de atividades dos projetos.


 
 
Etapas:


Todas as fases são eliminatórias e a nota de corte deste processo seletivo será de
 7,0


1º etapa: Avaliação de títulos - análise do currículo e da documentação solicitada
  
 2º etapa: Prova Escrita 
 
 e/ou
 
 3º etapa: Prova Prática ou Dinâmica de Grupo
 
 4º etapa: Entrevista


 Prazo de inscrição:
 24/10/2025 a 30/10/2025",Vagas.com
