titulo,empresa,localizacao,uf,descricao,fonte
Analista de Comércio Exterior Pleno,Confidencial,São Paulo / SP                                       A empresa aceita candidaturas de qualquer cidade do Brasil,SP,"Descrição
: 
DESCRIÇÃO SUMÁRIA:
 
Analisar e acompanhar as operações de exportação, incluindo a gestão da documentação nas modalidades formal e courier e a interface com despachantes aduaneiros e agentes de carga para avaliação de fretes internacionais. Monitorar embarques e fechamentos de câmbio, avaliando prazos, custos e conformidade regulatória. Estruturar e manter controles e indicadores, contribuindo para a eficiência operacional, previsibilidade e mitigação de riscos.
PRINCIPAIS ATIVIDADES:
 


Executar os despachos aduaneiros de mercadorias conforme o POP de Operações de Exportação, por meio da interface com despachantes e órgãos reguladores, visando cumprir a legislação vigente;								


Elaborar os documentos de exportação (invoice, packing list, certificados), com base em requisitos legais e contratuais, a fim de garantir a conformidade documental;								


Consultar e analisar dados de cotações de fretes e seguros internacional, observando custos e prazos, com o objetivo de otimizar recursos logísticos;								


Acompanhar a logística dos embarques, incluindo reservas (voos e navios), coletas e desembaraço, por meio de contato com os parceiros logísticos, visando garantir o cumprimento dos prazos;								


Informar as áreas demandantes e importadores sobre o andamento dos embarques, por meio de comunicação estruturada, a fim de promover transparência operacional;								


Verificar e acompanhar o fechamento de câmbio junto à área financeira, para cumprir exigências legais e proteger a operação;								


Controlar e atualizar planilhas de processos e indicadores de exportação, visando manter a visibilidade e otimizar a gestão das atividades;								


Preparar solicitações de pagamento de despesas de exportação em sistemas corporativos (JDE), conferindo documentos e valores, a fim de garantir a correta execução financeira;								


Controlar o orçamento da área, acompanhando despesas e atualizando registros, com o objetivo de manter o equilíbrio financeiro;								


Atualizar controles de contratos, registros marcários e contatos em desenvolvimento, visando manter a organização das informações.								


Idiomas
:
Inglês - Nível Intermediário
Outros requisitos
: 


Graduação completa em Comércio Exterior, Administração, Logística ou áreas correlatas. Desejável Pós-graduação em Comércio Exterior, Negócios Internacionais, Logística Internacional ou áreas correlatas;


Desejável experiência anterior na indústria, preferencialmente farmacêutica (legislação sanitária nacional e internacional (ANVISA, FDA, EMA); 


Imprescindível conhecimento em conceitos de exportação (Incoterms, documentos, fluxo logístico);


Conhecimento intermediário em Microsoft Pacote Office (Excel, Word e Power Point) e Microsoft Power BI; 


Noções básicas de exigências documentais específicas (certificados sanitários, CPP, COA);			


Possuir inglês e espanhol intermediário (comunicação, escrita e conversação);",Vagas.com
Analista de Gestão de Garantias Júnior,Ecoagro,São Paulo / SP                                       A empresa aceita candidaturas de São Paulo e cidades próximas,SP,"Descrição
: 
O Grupo Ecoagro desenvolve e estrutura operações financeiras adequadas tanto às necessidades de rentabilidade e segurança de investidores quanto à demanda de recursos para produtores e empresas rurais.
Nossos valores:
*Ética e transparência: Agimos com integridade, respeitamos as leis, os princípios morais, e comunicamos nossas políticas e resultados de forma clara.
*Espírito de criatividade: Buscamos novas oportunidades de ação e soluções inovadoras diante das necessidades que se apresentam, assegurando a execução de estratégias que visam o crescimento da Ecoagro.
*Excelência de desempenho: Buscamos melhoria contínua e o controle dos resultados por indicadores de desempenho reconhecidos como referência das melhores práticas.
*Responsabilidade econômica, social e ambiental: Reconhecemos e agimos no sentido de que estas dimensões estejam sempre em equilíbrio, de modo a promover o desenvolvimento e garantir a sustentabilidade.
Valorizamos a diversidade e queremos você com a gente nessa jornada, se você se identifica com o nosso propósito, venha fazer parte do nosso time!
Oportunidade: 
Analista de Gestão de Garantias Júnior
Requisitos:


Graduação: Administração, Economia, Engenharia, Ciências Contábeis ou áreas correlatas (em andamento ou concluída).


Conhecimento necessário: Excel intermediário.


Conhecimento básico sobre instrumentos financeiros e de garantias. 


Conhecimento desejável: Familiaridade com operações estruturadas e de recebíveis (mercado de capitais).


Certificações desejáveis: Certificações ANBIMA, ANCORD, B3 ou certificações em gestão de risco e crédito.


Disponibilidade para viagens é desejável.


Principais responsabilidades:


Apoiar na gestão e otimização das garantias vinculadas às operações estruturadas de CRA, especialmente aquelas associadas a carteiras pulverizadas de recebíveis no setor do agronegócio (Duplicatas, CPRF, CPR, Contratos de Compra e Venda, alienações de estoque e/ou imóveis).


Apoiar as análises de relatórios com foco na avaliação de riscos das garantias envolvidas nas operações.


Contribuir na implementação de estratégias de mitigação de risco, alinhadas às métricas previstas na estrutura de cada operação.


Apoiar no controle e acompanhamento das garantias ao longo do ciclo da operação.


Apoiar na comunicação com áreas internas para garantir a conformidade e integridade dos dados operacionais.


Participar da melhoria contínua dos processos e ferramentas de análise de risco.


Nossos benefícios:
Na Ecoagro, valorizamos o bem-estar e o crescimento dos nossos colaboradores, pensando nisso oferecemos:
Plano de saúde Porto Seguro: 100% coberto pela empresa
Plano odontológico Porto Seguro: 100% coberto pela empresa
Seguro de Vida
Week Off: semana de Folga no Final do Ano
Wellhub e TotalPass
Cartão Flash de R$ 1.100,00 mensal (VR/VA)
Bônus anual (condicionado ao resultado da empresa).
Conheça O Nosso Negócio:
Desde 2009 a Ecoagro está à frente no mercado como maior securitizadora em emissão de CRA no Brasil. São mais de 75 bilhões de emissões de CRA e 6.5 bilhões de fundos sob gestão.
O Grupo Ecoagro desenvolve e estrutura operações financeiras adequadas tanto às necessidades de rentabilidade e segurança de investidores quanto à demanda de recursos para produtores e empresas rurais.
Se você se identifica com o nosso propósito, venha fazer parte do nosso time!
Saiba mais sobre a Ecoagro em: www.ecoagro.agr.br.",Vagas.com
Analista de Relações Institucionais Sênior,Ecoagro,São Paulo / SP                                       A empresa aceita candidaturas de São Paulo e cidades próximas,SP,"Descrição
: 
Descrição: 
O Grupo Ecoagro desenvolve e estrutura operações financeiras adequadas tanto às necessidades de rentabilidade e segurança de investidores quanto à demanda de recursos para produtores e empresas rurais.
Nossos valores:
*Ética e transparência: Agimos com integridade, respeitamos as leis, os princípios morais, e comunicamos nossas políticas e resultados de forma clara.
*Espírito de criatividade: Buscamos novas oportunidades de ação e soluções inovadoras diante das necessidades que se apresentam, assegurando a execução de estratégias que visam o crescimento da Ecoagro.
*Excelência de desempenho: Buscamos melhoria contínua e o controle dos resultados por indicadores de desempenho reconhecidos como referência das melhores práticas.
*Responsabilidade econômica, social e ambiental: Reconhecemos e agimos no sentido de que estas dimensões estejam sempre em equilíbrio, de modo a promover o desenvolvimento e garantir a sustentabilidade.
Valorizamos a diversidade e queremos você com a gente nessa jornada, se você se identifica com o nosso propósito, venha fazer parte do nosso time!
Oportunidade: Analista de RI Sênior:
Responsabilidades


Estruturar e automatizar processos de RI, incluindo mapeamento de fluxos e melhorias operacionais


Gerenciar o CRM do time de distribuição (base e campanhas);


Elaborar relatórios gerenciais e dashboards (ex: volume de operações, crédito);


Organizar assembleias de credores (CRA e fundos), incluindo convocação e condução digital;


Atualizar informações no site institucional (operações, ratings e conteúdos);


Desenvolver materiais institucionais, comerciais e para investidores (relatórios mensais, one pagers);


Elaborar materiais para ofertas (IPO/WH), comunicados e fatos relevantes;


Atuar no relacionamento com investidores e gestão de dúvidas, com acompanhamento de KPIs;


Apoiar liquidação de operações e interagir com áreas internas (risco, gestão, revenda);


Apoiar iniciativas de posicionamento e branding no mercado.


Requisitos:


Graduação: Ensino superior completo em Administração, Economia, Engenharia, Contabilidade ou áreas correlatas.


Conhecimento necessário: Conhecimento em mercado de capitais, produtos estruturados (CRA, fundos) e rotinas de RI;


Experiência com elaboração de relatórios e materiais para investidores;


Domínio de Excel e PowerPoint;


Experiência com organização de processos e gestão de informações;


Noções sobre regulamentação de mercado de capitais;


Conhecimento desejável: Conhecimento em Power BI ou ferramentas de visualização de dados;


Certificações desejáveis: CPA-20, CEA ou CFA (ou em andamento).


Conheça O Nosso Negócio:
Desde 2009 a Ecoagro está à frente no mercado como maior securitizadora em emissão de CRA no Brasil. São mais de 75 bilhões de emissões de CRA e 6.5 bilhões de fundos sob gestão.
O Grupo Ecoagro desenvolve e estrutura operações financeiras adequadas tanto às necessidades de rentabilidade e segurança de investidores quanto à demanda de recursos para produtores e empresas rurais.
Se você se identifica com o nosso propósito, venha fazer parte do nosso time!
Saiba mais sobre a Ecoagro em: www.ecoagro.agr.br.",Vagas.com
Analista Planejamento de Serviços,Gi Group,Cachoeirinha / RS                                       A empresa aceita candidaturas de Cachoeirinha e cidades próximas,RS,"Descrição
: 
Multinacional do segmento químico em parceria com a Gi Group contrata:
Cargo: Analista de Planejamento de Serviços
Requisitos:


Formação superior completa em áreas como Química, Engenharia de processos, Engenharia química ou áreas correlatas;


Experiência prévia em ambiente laboratorial ou industrial, com atuação em processos operacionais;


Experiência em orientação técnica de equipes operacionais, atuando como referência técnica e ponto focal do processo;


Cursos ou treinamentos em ISO/IEC 17025, Qualidade, Sistemas de Gestão ou Auditorias Internas;


Vivência com sistemas de controle de amostras, rastreabilidade ou LIMS;


Experiência com gestão de prazos, indicadores operacionais e controles de fluxo;


Vivência com processos de recebimento, preparo, controle ou gestão de amostras será considerada um diferencial;


Conhecimento intermediário de ferramentas do pacote Office, com ênfase em Excel, para análise de dados, acompanhamento de indicadores e reporte de informações.


Atividades:
Atuação no processo de recebimento e preparo de amostras, com foco em garantir a correta entrada, conferência, identificação, armazenamento e preparação das amostras destinadas às análises laboratoriais, conforme procedimentos internos, requisitos regulatórios e normas de qualidade aplicáveis. O(a) profissional será responsável por assegurar a rastreabilidade, integridade e conformidade das amostras, atuando de forma integrada com os laboratórios analíticos e demais stakeholders, contribuindo para o cumprimento de prazos, qualidade dos resultados e eficiência operacional da área durante o período de contrato.
Responsabilidades e atribuições: 
· Atuar como responsável técnico pelo processo de recebimento e preparo de amostras, garantindo que as atividades executadas pelo time de técnicos e operadores estejam alinhadas aos procedimentos, requisitos regulatórios e normas de qualidade
·Orientar, direcionar e apoiar tecnicamente o time operacional, assegurando correta execução das rotinas, entendimento dos procedimentos e tratamento adequado das amostras
· Assegurar a rastreabilidade, integridade e conformidade das amostras ao longo de todo o fluxo, desde o recebimento até o envio aos laboratórios analíticos
· Monitorar prazos, volumes e prioridades do processo, atuando de forma proativa para garantir atendimento aos SLAs e às necessidades dos laboratórios e stakeholders
· Atuar como principal interface entre o time operacional, laboratórios analíticos, qualidade, logística e demais áreas envolvidas no processo de amostras
· Avaliar desvios, não conformidades ou riscos relacionados ao processo, conduzindo análises, orientando o time e apoiando a definição e acompanhamento de ações corretivas
· Garantir a correta utilização e atualização dos sistemas, controles e registros relacionados ao processo de amostras
· Apoiar a padronização, melhoria contínua e evolução do processo, contribuindo para maior eficiência e robustez operacional
Oferta e benefícios:
Regime de contratação: Temporário
Local de trabalho: Cachoeirinha–RS
Horário de trabalho: Segunda a sexta das 08:00 às 17:00
Remuneração e benefícios: salário compatível ao mercado, refeitório no local, vale-alimentação, vale-transporte, seguro de vida, assistência médica e odontológica.
Idiomas
:
Inglês - Nível Intermediário
Outros requisitos
: 
• Proatividade e senso de urgência.
• Trabalho em equipe e colaboração.
• Orientação para resultados e melhoria de processos.
• Boa comunicação e gestão de prioridades.
• Flexibilidade e resiliência.",Vagas.com
Analista de Processos Agrícolas Sr,Clealco,Clementina / SP                                       A empresa aceita candidaturas de qualquer cidade do Brasil,SP,"Descrição
: 
Atuar como suporte técnico e metodológico nas rotinas e projetos das operações agrícolas, contribuindo com a execução eficiente dos processos de campo e garantindo a aplicação das boas práticas operacionais, de segurança, meio ambiente e qualidade. Apoiar o Especialista em Operações Agrícolas na identificação e tratamento de anomalias, na melhoria contínua e no cumprimento dos indicadores de performance.
PRINCIPAIS RESPONSABILIDADES:


Apoiar a implementação e o monitoramento da gestão de rotinas agrícolas, acompanhando de forma sistemática os processos de colheita, plantio, tratos culturais e preparo de solo, com foco na aderência aos padrões operacionais e no cumprimento dos cronogramas estabelecidos.


	Analisar relatórios operacionais e identificar gargalos nas operações agrícolas, por meio da leitura crítica de indicadores de desempenho, propondo diagnósticos e encaminhamentos que visem a melhoria da eficiência.


Apoiar tecnicamente a gestão agrícola na mitigação de gargalos operacionais, conduzindo análises estruturadas e sugerindo ajustes em processos, recursos ou métodos de execução.


Desenvolver, em conjunto com os gestores agrícolas, planos de ação para aumento da eficiência operacional, utilizando dados históricos, benchmarking interno e ferramentas de melhoria contínua como base para as propostas.


	Participar da elaboração e revisão das Instruções de Trabalho (ITs), garantindo a padronização das atividades nas frentes operacionais, em conformidade com os procedimentos e boas práticas da Companhia.


	Aplicar com proficiência a metodologia PDCA nas áreas agrícolas, conduzindo ciclos de melhoria contínua, com identificação de causas, definição de planos de ação, execução, verificação de resultados e padronização de soluções eficazes.


	Realizar o acompanhamento e a sustentação da metodologia SDCA nas operações agrícolas, promovendo a manutenção das melhorias implementadas e atuando na correção de desvios recorrentes.


Acompanhar tecnicamente os projetos operacionais da área agrícola, apoiando o cumprimento dos prazos, controle de custos e garantia da qualidade das entregas, em alinhamento com os objetivos da Companhia.


	Participar ativamente da construção de eventos Kaizen com os gestores agrícolas, contribuindo para a identificação de causas raiz de problemas operacionais e colaborando na implantação de soluções sustentáveis.


Propor ações corretivas frente a desvios identificados em projetos e iniciativas Kaizen em andamento, contribuindo para a regularização do cronograma, do escopo e dos resultados esperados.


	Realizar o acompanhamento da estrutura de pessoas nas áreas agrícolas, por meio da análise de headcount, sinalizando possíveis necessidades de ajustes à gestão para assegurar a cobertura das operações.


	Analisar e acompanhar os custos operacionais das áreas agrícolas, utilizando relatórios financeiros e operacionais, com o objetivo de apoiar decisões que promovam o uso eficiente de recursos e o controle orçamentário.


	Atuar em conformidade com os princípios éticos, normas de conduta e diretrizes ambientais da Companhia, garantindo que suas ações estejam alinhadas à cultura e às exigências regulatórias aplicáveis.


	Zelar pelo cumprimento das normas de Saúde e Segurança do Trabalho, fomentando práticas seguras, assegurando o uso correto de EPI’s e promovendo a atualização contínua dos procedimentos com foco na prevenção de acidentes e no cumprimento das obrigações legais.


REQUISITOS:


Formação Mínima Exigida: Graduação em Engenharias, Administração de Empresas, ou Áreas Correlacionadas.


Tipo de experiência: Conhecimento em colheita mecanizada de cana, plantio manual e mecanizado de cana de açúcar, tratos culturais, preparo de solo.


Outros conhecimentos necessários: Conhecimento em Orçamentos / Conhecimento em Sistemas de Monitoramento Solinftec / Conhecimento em Sistema PIMS / Conhecimento intermediário em Excel, Power Point, Word e Project / Gestão da Rotina / Melhoria Contínua.",Vagas.com
Analista de Desenvolvimento de Negócios,Confidencial,São Paulo / SP                                       A empresa aceita candidaturas de São Paulo e cidades próximas,SP,"Descrição
: 
Pré-requisitos:
•	Formação superior completa ou em andamento (Relações Internacionais, Comércio Exterior, Administração de Empresas, Hotelaria, Turismo, Eventos, Marketing, Gestão Comercial, Publicidade e áreas correlatas)
•	Idiomas Português e Inglês fluentes
•	Conhecimentos em todas as aplicações do Windows Office e Canva
•	Pessoa auto-motivada, pró-ativa, flexível, prestativa, colaborativa, comprometida, persistente, com alta competência comunicativa, que tenha iniciativa e contribua no trabalho em equipe
•	Excelente habilidade de comunicação verbal e escrita em Português e Inglês 
•	Forte capacidade de negociação e persuasão
•	Orientado para metas e resultados
•	Habilidade para trabalhar de forma independente com autogestão do tempo e das tarefas
•	Ter visão estratégica para planejamento anual das atividades
•	Com flexibilidade de horário para algumas datas especiais durante o ano e para viagens
•	Desejável experiência na organização de eventos
•	Desejável experiência na área comercial 
Responsabilidades: 	
•	Feiras (Venda de espaços em estande coletivo e sua organização/produção em feiras de negócios brasileiras): 
o	Prospecção de potenciais expositores para estande coletivo via e-mail, WhatsApp e principalmente via telefone
o	Atuação de forma dinâmica, visando novas oportunidades de negócios
o	Realização diária de follow-ups com prospects e leads
o	Prestação de atendimento consultivo, identificando as necessidades dos expositores
o	Apresentação de soluções mais adequadas a cada perfil de empresa expositora
o	Realização de visitas às empresas para apresentação dos estandes coletivos assim como em feiras de negócios com o intuito de atrair novos expositores   
o	Atualização e elaboração de listas de potenciais expositores e seus contatos para abordagem comercial
o	Negociação e intermediação entre fornecedor e expositor
o	Constante follow up com fornecedores e expositores
o	Planejamento e gestão do orçamento do projeto
o	Coordenação e revisão de contratos junto a advogado  
o	Acompanhamento dos processos para garantir os prazos e serviços contratados 
o	Cumprimento de trâmites burocráticos e regras da feira
o	Atendimento ao expositor e operacionalização de todas as suas demandas
o	Organização de coquetel no estande para promoção de networking
o	Busca de oportunidades de matchmaking para os expositores
o	Suporte in loco em todos os dias da feira, desde o início até o fechamento do estande
o	Relatório pré e pós feira em inglês e confecção de planilha de prestação de contas a ser enviada para entidade governamental
o	Elaboração de material promocional para a prospecção de novos expositores e para divulgação nos canais de comunicação
•	Comercial
o	Intermediação de contatos entre associados: elaboração de e-mails de apresentação, agendamento de visitas, follow-ups e relatório de feedback em Excel
o	Levantamento de contatos e elaboração de lista de empresas que ainda não são associadas 
o	Atendimento a consultas sobre assuntos comerciais, parcerias, dados estatísticos, tarifas aduaneiras, abertura de empresa, legislação trabalhista etc
o	Produção de relatórios setoriais e de guias de negócios
o	Prospecção de novos associados
o	Venda de anúncios para o Relatório Anual
o	Prospecção de novos projetos e feiras 
o	Promoção e venda de associação em todas as categorias e dos serviços 
•	Comunicação:
o	Atualização do website (atualização da seção de Feiras e de Publicações)
o	Elaboração de material e divulgação das feiras e de serviços nos canais de comunicação (Linkedin, Instagram, website e Newsletter) 
•	Outros: 
o	Apoio a outras áreas
Idiomas
:
Português - Nível Fluente e Inglês - Nível Fluente",Vagas.com
