titulo,empresa,localizacao,uf,descricao,fonte
Analista de Governança de Segurança da Informação III,Grupo Fleury,N/A,N/A,"Descrição
: 
Quais são os desafios da área e do cargo:
A área de Segurança da Informação é responsável por proteger os dados e sistemas de uma organização contra acessos não autorizados, vazamentos, ataques cibernéticos e qualquer tipo de ameaça que possa comprometer a integridade das informações.
Seu foco principal está em garantir três pilares essenciais: confidencialidade (acesso apenas por pessoas autorizadas), integridade (dados corretos e não alterados indevidamente) e disponibilidade (informações acessíveis sempre que necessário). Para isso, envolve práticas como gestão de riscos, implementação de controles de segurança, monitoramento de incidentes, conformidade com normas e conscientização dos usuários.
Essa área atua de forma estratégica para proteger ativos digitais, assegurar a continuidade dos negócios e garantir a confiança de clientes e parceiros.
Principais atividades: 


Conduzir e evoluir frameworks de governança de Segurança da Informação.


Garantir aderência a requisitos regulatórios como LGPD e normas como ISO 27001.


Atuar na gestão de riscos de Segurança da Informação.


Liderar avaliações de segurança em fornecedores e projetos.


Estruturar e acompanhar indicadores de segurança.


Apoiar auditorias internas e externas.


Revisar controles e políticas de segurança.


Atuar na governança de terceiros.


Apoiar requisitos de segurança em projetos.


Elaborar documentos corporativos formais.


Promover conscientização em segurança.


Apoiar resposta a incidentes sob ótica de governança.


Buscamos alguém que apresente: 


Experiência em Governança de Segurança da Informação.


Conhecimento em ISO 27001, LGPD e gestão de riscos.


Experiência com auditorias.


Avaliação de fornecedores.


Conhecimento em NIST, CIS ou COBIT (diferencial).


Ensino superior completo em TI ou áreas correlatas. Pós em Segurança ou Governança (desejável).


Diferenciais


Certificações como ISO 27001, CISM, CRISC, CISSP


Experiência em ambientes regulados


Vivência com documentos institucionais


Antes da inscrição na vaga, é importante verificar se você atende aos requisitos e se conecta com nosso propósito.
Nossa essência inspira o dia a dia, por isso, buscamos pessoas apaixonadas pelo que fazem, e que:
•	Estimulem um ambiente de troca de conhecimentos, compartilhando experiências, possibilitando a interdependência entre os times;
•	Estejam em constante movimento, investindo em autodesenvolvimento e atuando como facilitadora no desenvolvimento das outras pessoas;
•	Busquem consciência social de diversidade e inclusão, cooperando com a construção de um ambiente colaborativo;
•	Identifiquem e antecipem as necessidades dos clientes, agindo prontamente para encontrar soluções adequadas e personalizadas;
•	Planejem e executem o trabalho com excelência a fim de atingir os resultados esperados, com a visão de inovação e agilidade;
•	Gerem e implementem novas ideias, buscando constantemente por melhorias para a experimentação de novas abordagens e a adaptação às mudanças do mercado.
Modelo de Trabalho: 
(Home Office)
Carga Horária: 220h
Escala: Segunda á sexta - feira
Horário de Trabalho: 08h00 ás 17h00
Cuidamos de você em cada etapa da sua jornada! 
Ajustar os benefícios conforme vaga/localidade e apague esse trecho antes de publicar a vaga.
Saúde e Bem-estar:


Assistência médica e odontológica para você e sua família;


Ambulatório com clínica médica ou atendimento por telemedicina;


Linhas de cuidado especializadas: gestantes, adoção, obesidade, oncologia, entre outras;


Acesso à plataforma OrienteMe para sessões de terapia e orientação nutricional;


Licença maternidade e paternidade estendidas;


Acesso ao Wellhub para práticas esportivas e qualidade de vida.


Proteção e estabilidade:


Previdência privada;


Participação nos lucros;


Seguro de vida.


Facilidades para o dia a dia:


Vale-Alimentação;


Vale-Refeição;


Vale-Transporte;


Auxílio-Creche;


Clube de Descontos com lojas, farmácias, viagem, beleza, cultura, lazer, entre outros serviços.


Desenvolvimento e educação:


Plataforma de ensino;


Parcerias educacionais com descontos em cursos e instituições.


Aqui, o cuidado vai além dos benefícios — ele está presente em cada momento da sua trajetória.
Promovemos uma cultura inclusiva, focada na equidade e na valorização das diferenças. 
Nossas vagas são abertas para todos os públicos e, simbolizando a nossa intencionalidade, oferecemos oportunidades afirmativas.
Nosso compromisso vai além do cumprimento das legislações que incentivam a diversidade e inclusão. 
Trabalhamos ativamente para ampliar a representatividade de nossas pessoas, pensando em raça, etnia, gênero, gerações, pessoas com deficiência e LGBTQIAPN+
 em nosso time, além de fortalecer a representatividade de mulheres negras, indígenas, chefes de família.
Para conhecer mais sobre o Grupo Fleury, acesse o site: 
https://carreiras.grupofleury.com.br/ 
O Grupo Fleury informa que a participação em seus processos seletivos é gratuita e nenhuma empresa terceira está autorizada a cobrar valores para a candidatura às vagas, ao treinamento, ao material didático ou qualquer outra despesa relacionada.",Vagas.com
Analista de Workforce Pleno - Grupo Fleury,Grupo Fleury,São Paulo / SP                                       A empresa aceita candidaturas de São Paulo e cidades próximas,SP,"Descrição
: 
Quais são os desafios da área e do cargo:
Esta pessoa terá como objetivo atuar de forma alinhada à visão estratégica de Negócios do Grupo Fleury, contribuindo para a construção de um ecossistema de Saúde integrado, preventivo e híbrido, tendo como principal foco o cuidado com as pessoas.
Se você tem interesse em fazer parte desse propósito e deseja estar sempre um passo a frente do mercado, vem com a gente!
Sobre a área: 
Atua no dimensionamento e controle das equipes da operação, realizando análises consistentes, propondo ajustes de recursos conforme variações de forecast e apoiando melhorias nos processos de Workforce. Deve ser capaz de interpretar cenários, operacionalizar ajustes e contribuir para a eficiência operacional das áreas atendidas. Além de apoiar nas atualizações das bases de dados geradas pela área.
Principais atividades: 
Executar análises de dimensionamento e apoiar a construção das escalas da operação, de acordo com as diretrizes definidas pelos negócios;
Identificar oportunidades de melhoria nos processos de Workforce e participar da implementação junto às áreas envolvidas;
Realizar análises de capacidade operacional das unidades e propor recomendações de ajustes na alocação de equipes;
Apoiar estudos de impacto decorrentes de mudanças de cenário nas marcas, preparar e apoiar na execução de plano de ação;
Contribuir na construção da peça orçamentária anual, fornecendo informações e análises necessárias;
Garantir a manutenção das informações no plano de alocação das unidades;
Ser referência operacional em temas de Workforce para Analistas I, compartilhando boas práticas e orientações técnicas quando necessário.
Buscamos alguém que apresente: 
Ensino superior completo em Administração, Engenharias ou afins
Excel intermediário (avançado é diferencial) e domínio do pacote Office;
Desejável conhecimento básico em banco de dados (ex.: consultas simples em SQL);
Desejável experiência prévia com rotinas de dimensionamento de equipes;
Informações da vaga:
Modelo de Trabalho: Híbrido - Campo Belo/SP
Carga Horária: 220h
Escala: 5x2
Horário de Trabalho: Das 08h00 as 17h48
Antes da inscrição na vaga, é importante verificar se você atende aos requisitos e se conecta com nosso propósito.
Nossa essência inspira o dia a dia, por isso, buscamos pessoas apaixonadas pelo que fazem, e que:
•	Estimulem um ambiente de troca de conhecimentos, compartilhando experiências, possibilitando a interdependência entre os times;
•	Estejam em constante movimento, investindo em autodesenvolvimento e atuando como facilitadora no desenvolvimento das outras pessoas;
•	Busquem consciência social de diversidade e inclusão, cooperando com a construção de um ambiente colaborativo;
•	Identifiquem e antecipem as necessidades dos clientes, agindo prontamente para encontrar soluções adequadas e personalizadas;
•	Planejem e executem o trabalho com excelência a fim de atingir os resultados esperados, com a visão de inovação e agilidade;
•	Gerem e implementem novas ideias, buscando constantemente por melhorias para a experimentação de novas abordagens e a adaptação às mudanças do mercado.
Cuidamos de você em cada etapa da sua jornada! 
Saúde e Bem-estar:


Assistência médica e odontológica para você e sua família;


Ambulatório com clínica médica ou atendimento por telemedicina;


Linhas de cuidado especializadas: gestantes, adoção, obesidade, oncologia, entre outras;


Acesso à plataforma OrienteMe para sessões de terapia e orientação nutricional;


Licença maternidade e paternidade estendidas;


Acesso ao Wellhub para práticas esportivas e qualidade de vida.


Proteção e estabilidade:


Previdência privada;


Participação nos lucros;


Seguro de vida.


Facilidades para o dia a dia:


Vale-Alimentação;


Vale-Refeição;


Vale-Transporte;


Auxílio-Creche;


Clube de Descontos com lojas, farmácias, viagem, beleza, cultura, lazer, entre outros serviços.


Desenvolvimento e educação:


Plataforma de ensino;


Parcerias educacionais com descontos em cursos e instituições.


Aqui, o cuidado vai além dos benefícios — ele está presente em cada momento da sua trajetória.
Promovemos uma cultura inclusiva, focada na equidade e na valorização das diferenças. 
Nossas vagas são abertas para todos os públicos e, simbolizando a nossa intencionalidade, oferecemos oportunidades afirmativas.
Nosso compromisso vai além do cumprimento das legislações que incentivam a diversidade e inclusão. 
Trabalhamos ativamente para ampliar a representatividade de nossas pessoas, pensando em raça, etnia, gênero, gerações, pessoas com deficiência e LGBTQIAPN+
 em nosso time, além de fortalecer a representatividade de mulheres negras, indígenas, chefes de família.
Para conhecer mais sobre o Grupo Fleury, acesse o site: 
https://carreiras.grupofleury.com.br/ 
O Grupo Fleury informa que a participação em seus processos seletivos é gratuita e nenhuma empresa terceira está autorizada a cobrar valores para a candidatura às vagas, ao treinamento, ao material didático ou qualquer outra despesa relacionada.",Vagas.com
Analista Comercial- Inside Sales Pl,Vetnil,Louveira / SP                                       A empresa aceita candidaturas de qualquer cidade do Brasil,SP,"Descrição
: 
Há mais de 30 anos trabalhamos para entregar o 
melhor da medicina veterinária
, da 
pesquisa
 e da 
ciência
 a todos os nossos parceiros, que no dia a dia, se empenham para fazer o 
cuidado
 
chegar aos animais
. Entendemos que, para isso, precisamos primeiro valorizar as relações humanas, reconhecendo nossos colaboradores que se dedicam, fazendo nosso trabalho acontecer e progredir todos os dias.
Somos premiados entre
 “Melhores empresas para se trabalhar” 
pela Great Place to Work Brasil, no ranking Indústria e São Paulo 2025 e no ranking Agronegócio 2021, e conquistar esse reconhecimento é ter a certeza de que estamos no caminho certo.
Venha fazer parte do nosso time!
Oportunidade: 
Analista Comercial de Inside Sales
Local de Trabalho:
 Louveira/SP
Quais são os requisitos?


Ensino superior completo na área administrativa ou áreas relacionadas;


Conhecimento em elaboração e análise de relatórios gerenciais e KPIs;


Vivência com CRM, BI e/ou ferramentas de gestão comercial;


Noções de funil de vendas, acompanhamento de carteira e performance comercial;


Experiência prévia em vendas, atendimento ao cliente ou área comercial;


Conhecimento em rotinas comerciais e Inside Sales. 


Conhecimento intermediário ou avançado em Excel e ferramentas de análise de dados;


Disponibilidade para viagens e CNH categoria B.


Quais são as principais responsabilidades?
Realizar atendimento a distribuidores, clientes e equipe comercial, prestando suporte comercial e operacional. 
Executar ações de Inside Sales para geração de oportunidades de vendas, relacionamento e fortalecimento da carteira de clientes. 
Acompanhar indicadores comerciais da equipe de Inside Sales dos distribuidores. 
Elaborar, atualizar e analisar relatórios gerenciais, dashboards e KPIs da área. 
Monitorar clientes, pedidos, positivação, campanhas comerciais e ações de vendas. 
Apoiar a execução de campanhas promocionais e ações comerciais junto aos distribuidores. 
Identificar oportunidades de crescimento, recuperação de clientes e aumento de sell-out. 
Apoiar a gestão comercial com análises, levantamentos e informações para tomada de decisão.",Vagas.com
Analista de Engenharia de Produto Pl. (Mecânico),Elevadores Otis,São Bernardo do Campo / SP                                       A empresa aceita candidaturas de São Bernardo do Campo e cidades próximas,SP,"Descrição
: 
Analista de Engenharia de Produto Pl. (Mecânico)
São Bernardo do Campo (SP) | Modelo híbrido
 
Sobre a posição
 
Suportar no desenvolvimento de componentes e sistemas mecânicos, conforme processo de desenvolvimento de produtos (PDP), assegurando que todo desenvolvimento atenda as normas técnicas locais e standards da Engenharia Global garantindo a Segurança e Qualidade para os nossos técnicos e usuários.
 
Principais responsabilidades


Suportar as atividades de desenvolvimento de novos produtos e implementação de melhorias em produtos existentes, desde a concepção até a entrega do produto homologado e instalado em Campo


Realizar modelamento 3D e detalhamento 2D dos projetos em desenvolvimento


Assegurar a conformidade dos produtos com normas técnicas e as políticas globais de desenvolvimento de novos produtos da Otis;


Acompanhar montagem, produção de protótipos, testes e homologação de novos produtos


Suportar análise de viabilidade técnica, funcional e econômica dos projetos. Garantindo o cumprimento dos prazos estipulados nos cronogramas dos projetos


Participar de reuniões com integrantes de outras Engenharias da OTIS pelo mundo com intuito de buscar as novas tecnologias em desenvolvimento para aplicar em nossos produtos


Identificar oportunidades de redução de custo, melhorias de processo de montagem em campo e manufatura, aumento de performance e melhoria contínua dos produtos


Atuar em conjunto com as áreas de Produção, Qualidade, Compras, Suprimentos e Comercial para garantir a execução dos projetos;


Participar ativamente no programa de Qualidade da companhia, mantendo a organização da área de trabalho, coletando dados, colaborando nas análises de causa-raiz


Garantir a satisfação dos nossos clientes seguindo os padrões de segurança, ética e qualidade exigidos pela Companhia.


 
Requisitos


Graduação completa em Engenharia Mecânica


+2 anos de experiência em engenharia de produto ou áreas correlatas


Conhecimento em análise de elementos finitos (FEA)


Vivência com desenvolvimento de produtos e processos de fabricação (diferencial)


Inglês Avançado e Espanhol desejado.


Conhecimento em software de CAD 2D / 3D (PTC Creo, ProE, NX, Similares),


Conhecimento em softwares de simulação (FEA), conhecimento no software Windchill e em Gestão de Projetos será um diferencial.


 
Perfil


Perfil analítico e orientado a resultados


Capacidade de trabalhar com prazos e múltiplas demandas


Proatividade e senso de responsabilidade técnica


Boa comunicação e facilidade de interação com times globais


Foco em qualidade, segurança e melhoria contínua",Vagas.com
Analista de Suprimentos Sr - (Strategic Sourcing),Porto Sudeste Brasil,Rio de Janeiro / RJ                                       A empresa aceita candidaturas de qualquer cidade do Brasil,RJ,"Descrição
: 
Estamos em busca de um Analista de Suprimentos Sr - (Strategic Sourcing) para se juntar à nossa equipe. Se você é apaixonado por estratégias de sourcing e busca constantemente otimizar processos, essa vaga é para você!
	Gestão de Fornecedores:
• Identificar e desenvolver fornecedores potenciais de materiais, considerando critérios como qualidade, segurança, conformidade ambiental e capacidade técnica.
• Desenvolver parcerias estratégicas com nossos fornecedores.
• Conhecimento no mercado fornecedor de mineração e operações portuárias.
• Identificar e mitigar riscos específicos relacionados aos fornecedores de materiais.
Negociação Contratual:
• Conduzir negociações contratuais, termos e condições de compras, com análises na composição de preços, abertura de custos, TCO e condições de pagamento, fórmulas paramétricas de reajustes, garantindo a melhor contratação para a empresa.
• Garantir que todos os processos estejam alinhados com as políticas, padrões e normas regulatórias da organização.
• Utilizar dados históricos e de mercado (benchmarking) para tomar decisões e melhorar continuamente as práticas de suprimentos.
• Comparar práticas e preços com os do mercado para garantir competitividade.
• Estabelecer contratos de longo prazo e acordos estratégicos.
Análise e Inteligência de Mercado:
• Monitorar as tendências e mudanças de mercado, identificando oportunidades de melhoria e inovação.
• Realizar reuniões periódicas com fornecedores e áreas solicitantes com o intuito de avaliar novas tecnologias e / ou processos.
• Realizar análises de benchmarking para garantir que a empresa esteja em conformidade com as melhores práticas do setor.
Relacionamento:
• Participação em projetos estratégicos e colaboração com as outras áreas para alinhar os procedimentos e estratégias de suprimentos com as metas organizacionais.
Incentivamos a participação de Mulheres e PCDs.
Se você se encaixa nesse perfil, candidate-se agora mesmo!
Outros requisitos
: 


Formação acadêmica em Administração, Economia, Engenharia ou área relacionada;


Pós-Graduação / MBA em Suprimentos ou áreas relacionadas (desejável);


Inglês Avançado;


Conhecimento em Excel (avançado);


Conhecimento e Aplicação da Metodologia Strategic Sourcing;


Conheciemnto em gestão de suprimentos de serviços, composição de preços, abertura de custos e TCO;


Habilidades avançadas de negociação e comunicação;


Conhecimento profundo das práticas e ferramentas de suprimentos, cadeia de valor e estratégias de negociação;


Capacidade de trabalhar de forma colaborativa e estratégica em um ambiente dinâmico.",Vagas.com
Analista de Sustentabilidade Jr. - Laboratórios Padrão,Grupo Fleury,Goiânia / GO                                       A empresa aceita candidaturas de Goiânia e cidades próximas,GO,"Descrição
: 
Sobre a Marca:
O Laboratório Padrão
 atua há mais de 40 anos em 
Goiás
, sendo referência em 
Análises Clínicas, Exames de Imagem e Vacinas
. Sua trajetória é marcada pela oferta de saúde com tecnologia de ponta e compromisso com o bem-estar dos clientes. Com unidade em 
Goiânia, Aparecida de Goiânia, Trindade, Caldas Novas, Goainésia, Piracanjuba, Goianira e Senador Canedo - GO
, o Laboratório Padrão é integrante do 
Grupo Fleury
, uma das mais respeitadas empresas de 
medicina diagnóstica e saúde do Brasil
, fortalecendo seu compromisso com excelência, inovação e cuidado com as pessoas.
Quais são os desafios da área e do cargo:
Esta pessoa terá como objetivo atuar de forma alinhada à visão estratégica de Negócios do Grupo Fleury, contribuindo para a construção de um ecossistema de Saúde integrado, preventivo e híbrido, tendo como principal foco o cuidado com as pessoas.
Se você tem interesse em fazer parte desse propósito e deseja estar sempre um passo a frente do mercado, vem com a gente!
Sobre a área: 
Apoiar aos processos de sustentabilidade, qualidade, meio ambiente e ações sociais, identificando oportunidades, reduzindo o risco legal e promovendo a melhoria contínua, contribuindo para a gestão de custos e para o desenvolvimento sustentável da companhia.
Principais atividades: 


Apoiar processos de integração de novas marcas, mudanças de processos e sistemas. 


Acompanhar e apoiar a gestão de documentos da cia, garantindo que os documentos estejam padronizados com o sistema de gestão;


Auxiliar na parametrização dos dados do SE suíte de acordo com as necessidades da organização;


Acompanhar análises críticas de desempenho do sistema de gestão integrado;


Disponibilizar treinamentos de integração de novos colaboradores, apresentando o sistema de gestão integrado;


Monitorar a eficácia dos processos de ações corretivas e preventivas e apoiar os responsáveis, garantindo que as ações sejam tomadas evitando a recorrência;


Organizar a programação e realizar as auditorias internas, através de convocações de auditores internos garantindo o cumprimento das normas;


Dar suporte na implantação de ferramentas da qualidade quando necessário e acompanhar ações oriundas de Análises Críticas da Alta Direção;


Apoiar as lideranças no entendimento e atendimento aos requisitos normativos e de certificação/acreditação;


Acompanhar e analisar o cumprimento das legislações ambientais aplicáveis aos processos de meio ambiente;


Levantar, executar, analisar e disponibilizar dados estatísticos e indicadores de recursos naturais, resíduos, efluentes e outros temas relacionados à meio ambiente e qualidade;


Executar e acompanhar processos de Licenciamento Ambiental e projetos aplicáveis à meio ambiente em todo o Grupo;


Disseminar a cultura de Qualidade e Meio Ambiente entre as equipes e auxiliar na efetiva utilização pelas áreas da empresa das ferramentas da qualidade, incluindo softwares de gestão;


Direcionar as demandas aos Assistentes, Aprendizes e Estagiários;


Atender as solicitações que chegam para a Qualidade e Meio Ambiente nos sistemas utilizados pelo grupo. 


Buscamos alguém que apresente: 


Superior Completo em Farmácia, Biomedicina, Biologia, Enfermagem, Administração ou Gestão da Qualidade;


Desejável pós graduação em Qualidade e cursos de auditor interno ou externo.


Nossa essência inspira o dia a dia, por isso, buscamos pessoas apaixonadas pelo que fazem, e que:
•	Estimulem um ambiente de troca de conhecimentos, compartilhando experiências, possibilitando a interdependência entre os times;
•	Estejam em constante movimento, investindo em autodesenvolvimento e atuando como facilitadora no desenvolvimento das outras pessoas;
•	Busquem consciência social de diversidade e inclusão, cooperando com a construção de um ambiente colaborativo;
•	Identifiquem e antecipem as necessidades dos clientes, agindo prontamente para encontrar soluções adequadas e personalizadas;
•	Planejem e executem o trabalho com excelência a fim de atingir os resultados esperados, com a visão de inovação e agilidade;
•	Gerem e implementem novas ideias, buscando constantemente por melhorias para a experimentação de novas abordagens e a adaptação às mudanças do mercado.
Modelo de Trabalho: 


Modalidade de trabalho: Híbrido (1x por semana presencialmente)


Horário: de segunda a sexta-feira das 08h às 18h 


Cuidamos de você em cada etapa da sua jornada! 
Ajustar os benefícios conforme vaga/localidade e apague esse trecho antes de publicar a vaga.
Saúde e Bem-estar:


Assistência médica e odontológica para você e sua família;


Ambulatório com clínica médica ou atendimento por telemedicina;


Linhas de cuidado especializadas: gestantes, adoção, obesidade, oncologia, entre outras;


Acesso à plataforma OrienteMe para sessões de terapia e orientação nutricional;


Licença maternidade e paternidade estendidas;


Acesso ao Wellhub para práticas esportivas e qualidade de vida.


Proteção e estabilidade:


Previdência privada;


Participação nos lucros;


Seguro de vida.


Facilidades para o dia a dia:


Vale-Alimentação;


Vale-Refeição;


Vale-Transporte;


Auxílio-Creche;


Clube de Descontos com lojas, farmácias, viagem, beleza, cultura, lazer, entre outros serviços.


Desenvolvimento e educação:


Plataforma de ensino;


Parcerias educacionais com descontos em cursos e instituições.


Aqui, o cuidado vai além dos benefícios — ele está presente em cada momento da sua trajetória.
Promovemos uma cultura inclusiva, focada na equidade e na valorização das diferenças. 
Nossas vagas são abertas para todos os públicos e, simbolizando a nossa intencionalidade, oferecemos oportunidades afirmativas.
Nosso compromisso vai além do cumprimento das legislações que incentivam a diversidade e inclusão. 
Trabalhamos ativamente para ampliar a representatividade de nossas pessoas, pensando em raça, etnia, gênero, gerações, pessoas com deficiência e LGBTQIAPN+
 em nosso time, além de fortalecer a representatividade de mulheres negras, indígenas, chefes de família.
Para conhecer mais sobre o Grupo Fleury, acesse o site: 
https://carreiras.grupofleury.com.br/ 
O Grupo Fleury informa que a participação em seus processos seletivos é gratuita e nenhuma empresa terceira está autorizada a cobrar valores para a candidatura às vagas, ao treinamento, ao material didático ou qualquer outra despesa relacionada.",Vagas.com
