titulo,empresa,localizacao,uf,descricao,fonte
Analista de Controladoria Pleno,Concremat,São Paulo / SP                                       A empresa aceita candidaturas de qualquer cidade do Brasil,SP,"Descrição
: 
Somos a Concremat,
 uma 
plataforma de integração do grupo CCCC
, que conecta o Brasil e a América Latina a uma rede global de especialistas. Mais do que fornecer soluções técnicas de engenharia, somos protagonistas na construção e viabilização de grandes projetos, sempre em parceria com nossas empresas-irmãs. Nosso propósito é claro: criar um futuro compartilhado, pautado no crescimento sustentável e na colaboração entre mercados, pessoas e tecnologias.
Atuamos em 15 países e mais de 200 localidades,
 ampliando constantemente nossa presença e impacto. Com uma abordagem que une inovação e experiência, proporcionamos soluções eficientes e integradas para os desafios da engenharia e infraestrutura. Nosso compromisso é fortalecer o desenvolvimento regional, promovendo conexões estratégicas entre diferentes mercados e culturas, sempre com foco na excelência e na responsabilidade socioambiental.
Se você busca desafios globais, inovação contínua e um ambiente colaborativo, a Concremat é o lugar certo para você. Aqui, cada profissional faz parte de um ecossistema que transforma realidades e impulsiona o futuro. Venha construir esse legado conosco!
Vem ser Concremat!
Estamos em busca de pessoas para atuar como
 Analista de Controladoria Pleno
Requisitos da Vaga


Formação superior em Ciências Contábeis;


Pacote Office, especialmente Excel;


Experiência anterior em controladoria em empresas de engenharia, construção civil ou infraestrutura;


Vivência com gestão e controle de contratos/projetos;


Experiência prática com modelos de análise financeira e indicadores gerenciais.


Excel avançado (tabelas dinâmicas, fórmulas complexas, Power Query, macros/VBA);


Conhecimento avançado em Power BI (uso de templates, conexão de dados, criação de visuais);


ERP (SAP ou similares) – desejável;


Inglês intermediário será considerado diferencial;


CRC ativo será considerado diferencial.


Atribuições e Responsabilidades


Verificar o controle orçamentário de projetos e contratos (CAPEX e OPEX);


Elaborar e analisar relatórios financeiros, DRE por projeto e projeções de resultados;


Analisar as variações entre Orçado x Incorrido (receitas, custos, despesas, tributos, margens) de contratos;


Consolidar e acompanhar KPIs financeiros e operacionais;


Suportar os times de engenharia e planejamento na análise de viabilidade e performance de contratos;


Desenvolver e manter dashboards no Power BI com base em templates existentes e novas demandas;


Automatizar controles e relatórios financeiros utilizando Excel avançado (incluindo VBA e Power Query);


Atuar no fechamento mensal e forecast financeiro, garantindo acuracidade dos dados;


Interagir com diferentes áreas (planejamento, engenharia, contabilidade, financeiro e fiscal) para garantir a integridade das informações dos projetos;


Atender auditoria interna e externa


Local de Trabalho: 
São Paulo/ SP - Morumbi
Modelo de trabalho:
 100% presencial.
A Concremat 
acredita que a diversidade impulsiona a inovação e melhora nossos produtos e serviços. Promover a equidade e a inclusão gera novas ideias e contribui para uma sociedade mais justa. Nosso compromisso com as pessoas reflete diretamente na satisfação dos colaboradores, 
resultando em uma nota de 4,3 no Glassdoor.
Buscamos criar um ambiente onde todos possam ser autênticos, valorizados por seu talento e potencial. Por isso, incentivamos candidaturas de diferentes gêneros, raças, religiões, idades, orientações sexuais, nacionalidades e pessoas com deficiência.
Se você acredita no seu potencial, candidate-se, mesmo que não atenda a todos os requisitos. 
Queremos talentos dispostos a crescer com a gente!
Idiomas
:
Inglês - Nível Intermediário",Vagas.com
Analista de Sistemas Júnior,MARFRIG GLOBAL FOODS SA,São Paulo / SP                                       A empresa aceita candidaturas de São Paulo e cidades próximas,SP,"Descrição
: 
Analista de Sistemas Junior.
O Analista de Sistemas Júnior é responsável por apoiar o levantamento de requisitos, análise, documentação e manutenção de sistemas de informação. Atuará em conjunto com as equipes de desenvolvimento, infraestrutura e negócios, contribuindo para a melhoria contínua dos processos e soluções tecnológicas da empresa.
Principais Atividades e Responsabilidades:
•	Apoiar o levantamento e a análise de requisitos de sistemas junto aos usuários e áreas de negócio.
•	Elaborar e manter a documentação técnica e funcional dos sistemas.
•	Realizar testes funcionais de correção e homologação de novas funcionalidades.
•	Acompanhar a implementação de soluções e prestar suporte técnico básico aos usuários.
•	Auxiliar na identificação e correção de falhas em sistemas, garantindo o correto funcionamento das aplicações.
•	Apoiar a integração entre sistemas internos e externos.
•	Contribuir com a melhoria de processos e boas práticas de desenvolvimento e manutenção de sistemas.
•	Participar de reuniões de acompanhamento de projetos, demandas e correções técnicas.
Requisitos:
Formação desejável:
•	Ensino superior completo ou cursando em Ciência da Computação, Análise e Desenvolvimento de Sistemas, Engenharia de Software ou áreas correlatas.
Conhecimentos desejáveis:
•	Lógica de programação e fundamentos de desenvolvimento de software.
•	Banco de dados relacionais (ex.: SQL Server, MySQL, PostgreSQL).
•	Conhecimento básico em documentação técnica (casos de uso, diagramas, especificações funcionais).
Consideramos os(as) candidatos(as) para todos os cargos, sem distinção de gênero, raça, orientação sexual, religião, nacionalidade, idade ou deficiência.
#LI-RD1
Outros requisitos
: 
Atuação 100% presencial.",Vagas.com
Analista de Compras,Confidencial,Belo Horizonte / MG                                       A empresa aceita candidaturas de Belo Horizonte e cidades próximas,MG,"Descrição
: 
Estamos em busca de um Analista de Compras para se juntar à nossa equipe! 
Responsabilidades:


Levantamento de quantitativos em projetos de obras (infraestrutura e edificação);


Pesquisa e negociação com fornecedores de materiais e serviços;


Análise comparativa de propostas e sugestão de melhores opções;


Cadastramento de fornecedores e emissão de ordens de compra;


Elaboração de mapas de cotação e análise de dados;


Lançamento e conferência de notas fiscais e ordens de compra;


Verificação de medições e memórias de cálculo das obras;


Apoio no planejamento e controle físico-financeiro das obras;


Organização de documentos, fotos e notas fiscais em servidor;


Vistorias em imóveis do grupo quando necessário;


Acompanhamento de inovações tecnológicas e de materiais;


Elaboração de indicadores de desempenho.


Requisitos:


Experiência prévia como Analista de Compras;


Conhecimento em negociação e análise de mercado;


Habilidade em comunicação e relacionamento interpessoal;


Pacote office intermediário;


CNH B. 


Local de trabalho:
 Savassi/Belo Horizonte, 100% presencial. 
Oferecemos:


Salário compatível com o mercado;


Vale Alimentação/Refeição;


Vale Transporte ou Auxílio Combustível (De acordo com a sua necessidade);


Bonificação por Desempenho;


My day (uma folga no mês do seu aniversário, para aproveitar da melhor maneira possível);


Gympass (para manter corpo e mente saudáveis, extensivo a dependente também);


Café da manhã com frutas;


Assistência Médica.


Se você é uma pessoa proativa, organizada e com habilidade em negociação, candidate-se agora mesmo! Clique no botão abaixo e envie seu currículo.",Vagas.com
Analista Acadêmico I,Ânima,N/A,N/A,"Descrição
: 
Seja um educador ou educadora no Ecossistema Ânima e venha transformar o país pela educação. 
ANALISTA ACADÊMICO I
Essa posição é para atuar na 
Ânima
, o maior e o mais inovador ecossistema de ensino de qualidade do país, com instituições espalhadas por todo o Brasil. Somos uma empresa em constante evolução, que enxerga em cada detalhe novas formas de promover a educação. Por sinal, essa é a essência que nos faz ser diferentes.
Ah! Independente de cor, idade, gênero, orientação sexual, origem, religião ou qualquer outra característica, ou particularidade que tenha, se você tem desejo e energia para contribuir para a transformação de vidas por meio da Educação, aqui é o seu lugar!
Confira mais sobre a nossa oportunidade.
Do que você precisa para concorrer à vaga:


Graduação concluída ou em curso em Pedagogia, Estatística, Administração, Gestão de Projetos ou áreas correlatas. Pós-graduação será considerada um diferencial;


Experiência com planejamento, monitoramento e controle de cronogramas e entregas;


Capacidade de leitura, organização e análise de dados acadêmicos;


Organização de fluxos e processos operacionais, com foco em prazos e resultados.


Habilidades de comunicação assertiva com diferentes públicos (docentes, líderes, áreas técnicas).


Perfil comportamental proativo, com atitude resolutiva diante de problemas e imprevistos. Capacidade analítica para identificar riscos e propor soluções. Foco em resultados, metas e qualidade na execução. Flexibilidade para atuar em ambientes dinâmicos e em constante mudança. Organização e gestão do tempo para lidar com múltiplas tarefas simultâneas.


Como será seu dia a dia como educador ou educadora: 


Monitorar as ações e projetos da área, garantindo o cumprimento de prazos, marcos e entregas;


Apoiar a liderança no planejamento e execução da Avaliação por Competências e demais processos de evolução acadêmica;


Atuar no suporte à gestão de projetos (sustentação e evolução), utilizando ferramentas de controle como cronogramas, checklists e painéis de status;


Consolidar e analisar dados de aplicações avaliativas, incluindo fluxo de recursos e Avaliação Institucional (AI), gerando relatórios e painéis gerenciais;


Interagir com áreas parceiras (acadêmica, suporte, tecnologia, coordenação de curso), assegurando alinhamento e fluidez nos processos;


Participar de reuniões de planejamento, revisão e alinhamento estratégico, contribuindo com insights e soluções;


Apoiar na padronização, atualização e organização de fluxos e documentos operacionais;


Acompanhar indicadores de engajamento de docentes e discentes, propondo melhorias contínuas nos processos avaliativos.


Conhecimentos que são bacanas para essa posição: 


Domínio de ferramentas como Excel e Power BI, além de vivência com dashboards e relatórios;


Familiaridade com sistemas acadêmicos (SIGA, SIAF, ULIFE).


Colaboração em times multidisciplinares e squads de projeto;


Modalidade de atuação e horário de trabalho
Remoto - de segunda a sexta das 9h às 19h, com 1h12 de intervalo.
Veja o que já vai encontrar no nosso Ecossistema Ânima
•	Bolsas de Estudos
•	Indicação de 2 Bolsas de Estudos para quem preferir
•	Programa de Bem-estar e Qualidade de Vida
•	Wellhub
•	ECOA – Escola Corporativa Ânima, com + de 100 cursos livres e gratuitos
•	Day-off no aniversário
•	Abono de meio-período no aniversário do(a) filho(a) com até 16 anos
•	Programa Valor das Pessoas: vale-presente para os educadores em fases marcantes de suas vidas, como casamento, nascimento e até mesmo uma nova titulação.
Fique atento às etapas do processo seletivo, que acontece de forma 100% remota:
1. Análise dos currículos;
2. Avaliação técnica;
3. Entrevista com nosso time de Recrutamento e Seleção;
4. Entrevista com a liderança
Boa sorte!
#SejaÂnima",Vagas.com
Analista de Incorporação Sênior,Direcional,Belo Horizonte / MG                                       A empresa aceita candidaturas de Belo Horizonte e cidades próximas,MG,"Descrição
: 
Estamos em busca de um(a) Analista de Incorporação para integrar nosso time! Essa pessoa será responsável por conduzir os processos de licenciamento dos empreendimentos junto aos órgãos competentes, acompanhando condicionantes, contrapartidas e aprovações necessárias para o lançamento, habite-se e entrega dos projetos, dentro dos prazos estabelecidos pela empresa.
Responsabilidades e Atividades
Gerenciar o processo de licenciamento dos empreendimentos junto aos órgãos públicos e entidades reguladoras;
Acompanhar as condicionantes e contrapartidas durante a execução das obras;
Elaborar cronogramas e fluxos de aprovação para cada projeto, definindo etapas, prazos e áreas envolvidas;
Realizar análise crítica dos mapas de concorrência para definição de fornecedores;
Equalizar propostas recebidas, validar notas fiscais e controlar medições dos contratos relacionados à incorporação;
Garantir a conformidade documental e legal dos projetos para obtenção do habite-se e demais aprovações técnicas.
Idiomas
:
Português - Nível Fluente
Outros requisitos
: 
Qualificações Técnicas
Informática básica (Word, navegação, arquivos);
Excel básico (cadastros, fórmulas simples, organização de dados);
PowerPoint básico (apresentações institucionais ou de status de projeto);
Boa capacidade de leitura, escrita e interpretação de documentos técnicos e normativos;
Desejável conhecimento prévio em processos de licenciamento urbanístico e ambiental (diferencial);
Formação superior completa ou cursando em Arquitetura, Engenharia, Direito, Administração ou áreas correlatas.
Competências Comportamentais
Boa comunicação verbal e escrita;
Perfil analítico, organizado e com foco em prazos;
Habilidade para trabalhar em equipe multidisciplinar;
Proatividade e senso de responsabilidade.",Vagas.com
Analista Fiscal Sr,Marjan Farma,São Paulo / SP                                       A empresa aceita candidaturas de São Paulo e cidades próximas,SP,"Descrição
: 


Gerar e analisar os relatórios fiscais (livros de entrada/saída, apuração do ICMS/IPI), visando à consistência dos registros fiscais para garantir a qualidade das informações necessárias para atender as demandas internas e as obrigações principais e acessórias;


Apuração Diretos e Indiretos (PIS, COFINS, ICMS, ICMS ST e IPI);


Obrigação Acessória EFD Contribuição;


PERDCOMP;


Sistema SAP transação J1BTAX;


Assegurar o acompanhamento do Calendário Mensal das Obrigações Fiscais para o cumprimento das mesmas;


Responsável em manter os sistemas Fiscais (SAP / Mastersaf) configurados e atualizados com base na legislação vigente;


Levantar, analisar e acompanhar processos e fluxos operacionais que interagem com os registros dos dados;


Interagir com as áreas e treinar pessoas envolvidas no processo de registro que geram informações fiscais;


Acompanhar e revisar os trabalhos operacionais pré-estabelecidos a equipe fiscal;


Gerar e validar os arquivos (Sped Contábil, Fiscal, EFD Contribuições, DCTF, PER/DCOMP, Bloco K e REINF) e demais obrigações fiscais;


Assegurar a leitura e interpretação de Layout técnico de SPED e legislação correspondente;


Buscar e acompanhar as alterações da legislação fiscal;


Responsável em estabelecer processo de melhoria contínua (PDCA).


Local de trabalho: Santo Amaro, São Paulo - SP | 100% Presencial.
Outros requisitos
: 


Ensino super completo em Administração, Ciências Contábeis ou cursos correlatos;


Excel avançado;


Conhecimentos em arquivos TXT e sistema ERP SAP;


Desejável conhecimento em SAP e Mastersaf/ TaxOne;


Experiência em Indústria médio/grande porte.",Vagas.com
Analista de Faturamento Sênior,J&T Express,São Paulo / SP                                       A empresa aceita candidaturas de São Paulo e cidades próximas,SP,"Descrição
: 
Gestão e Revisão de Faturamento de Clientes
Responsável por gerar, revisar e lidar com exceções para contas-chave.
Garantir que os valores das faturas estejam consistentes com contratos, guias de remessa e listas de preços.
Liderar o processo de reconciliação, lidando com disputas e ajustes complexos.
Monitoramento de Contas a Receber e Cobrança
Acompanhou as contas a receber e desenvolveu planos de cobrança.
Analisou contas em atraso e forneceu recomendações para melhorar a eficiência da cobrança.
Preparou relatórios de análise de contas a receber para apoiar a tomada de decisões financeiras.
Otimização de Processos e Análise de Dados
Analisou gargalos de eficiência no processo de liquidação e propôs e implementou soluções de otimização.
Utilizou ferramentas de BI, ERP e Excel para estatísticas de dados e análise de custos.
Participou dos testes e implementação de atualizações do sistema ou novos módulos de liquidação.
Colaboração e Treinamento Interdepartamental
Trabalhou em estreita colaboração com os departamentos de negócios, operações, atendimento ao cliente, finanças e impostos.
Ministrou treinamento aos membros da equipe sobre processos de liquidação e regulamentações tributárias.
Integração de negócios coordenada para equipes multinacionais (chinesas e paquistanesas).
Outros requisitos
: 
Proficiência em notas fiscais brasileiras (NF-e / NFS-e) e regulamentações relacionadas, como ISS e ICMS;
Proficiência em sistemas ERP (TOTVS Protheus, SAP, etc.) e Microsoft Excel (funções avançadas, Tabelas Dinâmicas, Power Query);
Família com análises relacionadas a liquidações.
Habilidades Interpessoais:
Forte capacidade de análise lógica e resolução de problemas;
Detalhista, capaz de trabalhar sob pressão e possuir habilidades de trabalho em equipe e liderança;
Experiência em gerenciamento de projetos ou otimização de processos é desejável.
Experiência no seguimento logístico",Vagas.com
Analista Farmacotécnico Sênior,JOBCENTER DO BRASIL LTDA,Guarulhos / SP                                       A empresa aceita candidaturas de qualquer cidade do Brasil,SP,"Descrição
: 
Experiência na área de atuação (farmacotécnica) e áreas de interface. Conhecimento de operações em escala semi-industrial e industrial; Amplo conhecimento das legislações vigentes e aplicabilidade das metodologias analíticas. Conhecimento em ferramentas da qualidade e de gerenciamento de projetos. Pacote Office e noções básicas de estatística.
Desejável inglês intermediário e conhecimento de sistema SAP ERP.
Superior completo em Farmácia.
Principais Responsabilidades: Realizar pesquisa bibliográfica nos compêndios oficiais, banco de dados e patentes, objetivando a construção de conhecimento prévio acerca do fármaco alvo de desenvolvimento; Propor novas tecnologias aplicadas aos projetos, executar atividades em escala laboratorial e acompanhar integralmente as etapas de fabricação dos lotes piloto; Elaborar relatórios técnicos e demais documentações pertinentes às etapas do desenvolvimento e submissão de novos registros ou pós-registro, de acordo com os critérios estabelecidos na legislação vigente de cada categoria; Auxiliar no processo de viabilidade através de análise técnica direcionada a novos produtos ou manutenção de portfólio para projetos de alta complexidade; Interpretar resultados analíticos de testes in vitro e in vivo e avaliar tendências nos estudos de estabilidade e revisão periódica de produto, correlacionado com o design da formulação e processo; Acompanhar as atividades estabelecidas em cronograma, através das ferramentas de gerenciamento de projetos, garantindo a aderência da execução frente aos prazos estabelecidos; Exercer com autonomia a liderança de ideias e conduzir planos de ação visando melhoria de processos, redução de custos e oportunidades para o negócio.
Salário + Benefícios (VT/Estacionamento + Refeitório No Local)
Horário de Trabalho: Seg a Qui 07h15 - 17h00 – Sex 07h15 as 12h15)
Local de Trabalho: Guarulhos- SP | Híbrido
Contrato Temporário por 9 meses",Vagas.com
Analista de Cibersegurança Sênior,OSKLEN,Rio de Janeiro / RJ                                       A empresa aceita candidaturas de Rio de Janeiro e cidades próximas,RJ,"Descrição
: 
Atividades:
 Monitorar, analisar e responder a incidentes de segurança; Gerir ferramentas e políticas de cibersegurança para proteger os sistemas e dados da empresa; Utilizar soluções de segurança (EDR, SIEM, Vulnerability Management, Firewall, DLP, etc.), aplicando normas e boas práticas (ISO 27001, NIST, LGPD); Conduzir investigações técnicas; Orientar a equipe em respostas a incidentes; Avaliar vulnerabilidades e propor planos de mitigação; Coletar, analisar e disseminar informações sobre ameaças cibernéticas (CTI); Acompanhar fornecedores e auditar a conformidade dos controles implementados; Atuar na redução de riscos, prevenindo ataques e garantindo a continuidade do negócio; Assegurar conformidade regulatória e legal em relação à segurança da informação; Elaborar relatórios executivos e conduzir reuniões sobre a performance da área de segurança de informação (KPIs e Métricas de SI).
Conhecimentos/Experiências necessários:
 Experiência em gestão e resposta a Incidentes de Segurança e análise de vulnerabilidades; Experiência com firewalls e controles de Rede; Experiência em normas e frameworks de Segurança (ISO 27001, NIST CSF, LGPD); Experiência em auditoria e compliance em Segurança da Informação.
Conhecimentos/Experiências desejáveis: 
Conhecimento em WAF; Conhecimento em inglês intermediário.
 Formação: 
Graduação completa (TI ou áreas correlatas). Desejável pós em Segurança da Informação, Cybersecurity ou similares.
Horário:
 De segunda a sexta, 9h às 18:30h (Formato híbrido flexível – 3X semana presencial – Rio Comprido/RJ) .
Outros requisitos
: 
Promovemos Diversidade e Inclusão em nossos processos seletivos, incentivando a candidatura sem discriminação de raça, etnia, religião, cor, sexo, idade, deficiência, nacionalidade, orientação sexual, identidade ou expressão de gênero.",Vagas.com
Analista da Qualidade,TekniPlex Materials Science Solutions,São Paulo / SP                                       A empresa aceita candidaturas de São Paulo e cidades próximas,SP,"Descrição
: 
Analisar e elaborar os procedimentos e forma de execução de cada tarefa, preparando listas de verificação com base nas recomendações das normas, visando identificar métodos de auditoria para esses procedimentos.
Participar de comissões internas, visando encontrar soluções para aumento de produtividade, melhoria de qualidade, mudanças de processos e redução de custos.
Elaborar diálogos de qualidade e treinamentos referentes a Qualidade, aplicar aos setores envolvidos.
Elaborar/atualizar procedimentos e instruções de trabalho, visando atender aos requisitos das normas ISO9001/14001/FSSC22000.
Identificar deficiências em processos, sistemas e tarefas, promovendo a conscientização das pessoas e setores diretamente envolvidos, visando o seu engajamento na busca de soluções e implementação das ações corretivas.
Analisar as reclamações de clientes, elaborar planos de ação e acompanhar as implementações das ações.
Dar tratamento estatístico aos dados relacionados a desvios de qualidade, reclamações de clientes e fornecedores.
Apoiar as demais áreas na solução de problemas, identificando e removendo barreiras e obstáculos, atuando como facilitador para mudança de comportamentos e assimilação de mudanças.
Organizar e acompanhar o processo de calibração dos equipamentos.
Acompanhar os prestadores de serviço durante a realização do serviço nas dependências da fábrica.
Outros requisitos
: 
Vivência em fabricação de embalagens flexíveis;
Vivência em processo produtivo (extrusão, laminação)
Conhecimento nas ferramentas de qualidade (Ishikawa, 5PQ, 8D e outras);
Conhecimento em controle de calibração
Vivência em tratativas de reclamação de cliente – receber a reclamação junto ao setor de Assistência técnica, realizar a rastreabilidade da reclamação, buscar as informações internas para definição da procedência da reclamação, realizar reunião com equipe técnica para elaboração de plano de ação (usar metodologia adequada – ferramentas da qualidade), acompanhar a implementação das ações corretivas e avaliar a sua eficácia.",Vagas.com
